"Quote of the Day: Milton Friedman? Yeah, That Name Rings a Bell.",real
US economy Bleeds,real
Yellen warns housing weakness weighing on US recovery,real
Time Warner's “Neutral” Rating Reaffirmed at Zacks (TWX),real
So much for $35bn ad giant! Omnicom-Publicis merger called off,real
"Asia stocks muted as China data, Wall St weighed",real
FOREX-Battered euro nervous after slumping on dovish Draghi comments,real
Gold Ends Near Steady; Rebound In U.S. Dollar Index Limits Gains,real
Costco key April sales metric beats expectations,real
"CBS profit up 5.6%, sees strong second half",real
Apple to acquire Beats Electronics for $3.2 billion,real
Apple close to buying Beats for $3.2 bn: Source,real
Apple's Beats Purchase Could Have Saved HTC,real
Is Investment Banking Dead?,real
"MARKET COMMENT: FTSE 100 Ends At 10 Week High, Euro Spooked By Draghi",real
Two arrested in Australia over insider trading scam,real
UPDATE 2-Mortgage battle drives Australian bank margins toward new lows,real
"The Rise of Alibaba, and a Tycoon",real
Plenty of questions remain as Alibaba files jumbo US IPO,real
"Fannie Mae, Freddie Mac Post Profits Driven by Legal Settlements",real
"Om Malik: For Tesla, another year ahead of ramping up Model S production",real
Have Tesla shares hit bottom? Take our poll,real
OnePlus One Running CyanogenMod 11S to be Available by End of This Month,real
"'Hundreds' killed in Islamic extremist attack on Nigerian border, officials claim",real
First Take: Alibaba appeases a battered tech market,real
"Google Shopping Express opens shop in Manhattan, West LA",real
"Snapchat pays up over privacy allegations, gets slapped with 20-year probation",real
"FTC: Snapchat deceived consumers, hid security breach that exposed users  ...",real
"Subscription E-Book Service Oyster Crosses 500K Titles, Plans An Android  ...",real
Synthetic Life Forms Created In The Lab,real
VIDEO: Scientists Create First Life Form With Manmade Genetic Code,real
Bike month event planned in Merced,real
"Breathing world's dirtiest air, Delhi needs to clean up its act now",real
The goblin shark: a rare glimpse of something truly hideous,real
How to Install CyanogenMod on the Google Nexus 7 2013,real
California passes bill forcing smartphone makers to offer kill switch by July 2015,real
Google Finally Steps Up For Net Neutrality… Sort Of,real
"Google, Netflix, & Facebook Protest Net Neutrality Rules",real
Apple's $3.2bn Deal With Beats Electronics Almost Final,real
Gia Coppola plumbs James Franco's teenage tales in 'Palo Alto',real
The food industry's not-so-sweet influence,real
American Idol Results: Final Three Set After Thursday's Elimination,real
Kim Kardashian discovers racism because of her baby North,real
'Anti-Gay' HGTV Hosts Defend Themselves: 'We Love Homosexuals' (Video),real
HGTV Pulls The Plug On Real Estate Show,real
Spider-man is still amazing,real
"Jada Pinkett Smith slams uproar over photo of daughter Willow, 13, in bed with  ...",real
"ABC Renews 'SHIELD', 'The Goldbergs', 'Resurrection' and More",real
"The CS Interview with Jon Favreau on His New Movie, Chef",real
"'I ignore Hoult', says Jennifer Lawrence",real
"Marvel TV Doubles Down, Orders 'Agent Carter' And Renews 'Agents Of SHIELD'",real
James Franco isn't in 'Dawn Of The Planet Of The Apes',real
Latest trip to 'Oz' is in good voice,real
Lea Michele's 'Legends of Oz: Dorothy's Return' Marks Box-Office Debut for  ...,real
Laughs move in next door in 'Neighbors',real
Zac Efron Interview For 'Neighbors' ('Bad Neighbours' In The UK),real
Watch a very drunk Reese Witherspoon trying to pronounce Cara Delevingne's  ...,real
"Hugh Jackman Treated Again for Skin Cancer, Urges All to Wear Sunscreen",real
May is Lyme Awareness Month,real
MERS death toll rises to 126 in Saudi,real
Saudi Arabia reports 4 more deaths from MERS,real
How polar bears stay fat but healthy: It's all in the genes,real
CDC Reports Syphilis is Increasing in Homosexual and Bisexual Men,real
Antipsychotic medication linked to reduced rate of violent crime: Lancet,real
Frequent arguments with family and friends linked with greater risk of death,real
Alibaba hints at China IPO for Alipay,real
"Marissa Mayer, Alibaba and Yahoo's expanding wallet",real
War games played on West PH Sea beachfront,real
Why Has China Become More Aggressive Toward Vietnam?,real
Wall Street posts modest gains with Dow closing at record high,real
Peter Foster: Has Thomas Piketty become Francois Hollande's least favourite  ...,real
FAA: US passenger jet nearly collided with drone in March,real
MD & DE Governors Concerned Over Pfizer Aquisition of AstraZeneca,real
Old shipyard site at Houma proposed for Superfund cleanup,real
EPA Employee Spent 2-6 Hours Per Day Watching Porn at Work,real
What Geithner's new book means for Hillary in 2016,real
USPS Loses $1.9 Billion in Second Quarter Despite Operating Profits,real
"Euro, dollar on soft ground over Ukraine, ECB comment",real
Euro to US Dollar (EUR/USD) Exchange Rate weakens sharply as Ukraine  ...,real
FOREX-Euro steadies after slumping on dovish Draghi comments,real
Marchionne Moves Fiat Chrysler Automobiles NV To London - Italy Shunned,real
Smartphone Kill Switch Bill Approved,real
Nintendo responds to criticism regarding same-sex relationships in Tomodachi  ...,real
Did Nintendo Just Come Out AGAINST Same-Sex Marriage?! Find Out What  ...,real
FTC scolds Snapchat for being 'not so secure',real
New Netflix users to pay $1 more for service,real
Netflix hikes prices by $1 for new subscribers,real
"Despite Furor, Proposed Net Neutrality Changes Appear Headed For A Vote",real
Apple close to making its biggest ever acquisition,real
Apple Beats By Dre Acquisition: What Will Happen To Beats Music For Android  ...,real
Dr. Dre Confirms Apple-Beats Deal in Video: Watch,real
Apple close to buying Beats for $3.2 bn: Source,real
Official: Dr. Dre Is $3.2 Billion Richer As He Sells 'Beats' Headphones To Apple  ...,real
Ford recalls more than 692000 vehicles,real
"Ford recalls nearly 700000 Escape SUVs, C-MAX hybrids for safety issues",real
Facebook Poke is dead,real
Michael Jackson was fan of Justin Timberlake - and they have finally released a  ...,real
Grant Ward on 'S.H.I.E.L.D.' cannot - and should not - be redeemed (opinion),real
How Will You Honor the Matriarchs in Your Life?,real
Free eCards and More Among Best Last Minute Mother's Day Gift Ideas,real
It's My First Mother's Day Since My Mom Died Unexpectedly And I Don't Know  ...,real
From the Web: LDS Church releases #itwasmom video,real
Kim Kardashian Fires Back on Twitter About Wedding Rumors,real
Kim Kardashian And Kanye West Still Working Out Prenup,real
'Neighbors' Crashing Spider-Man's Party at Box Office with $45 Million Opening,real
“Growing Up Fisher” Cancelled By NBC; Won't Get 2nd Season,real
"'Community': Well, NBC Finally Canceled It (Insert Your Own Darkest Timeline  ...",real
Comedy Central Picks Stephen Colbert Replacement (Exclusive),real
"Mila Kunis confirms pregnancy, engagement on 'Ellen': 5 highlights",real
Mila Kunis Pregnancy Cravings: Sauerkraut & Pickles,real
Eurovision 2014 Preview: United Kingdom,real
Eurovision fairytale for Europe's smallest nations,real
Eurovision 2014: Ireland left devastated after crashing out of contest in semi-final,real
All finalists of Eurovision Song Contest 2014 known,real
Bearded Drag Queen and Political Tensions Cast a Shadow on Eurovision 2014,real
What's Happening In Hip-Pop: James Franco Speaks On Weird Instagram  ...,real
"Chaotic Comedy 'Moms' Night Out' Has Wholesome Content, Toxic Attitude",real
"Frosties' Tony the Tiger voice actor Lee Marshall dies, aged 64",real
Penny Dreadful,real
Judge Oders Chris Brown To Stay In Jail For Four More Months [VIDEO],real
Lamar Sally: Fighting Sherri Shepherd for Custody of Unborn Child,real
"Kansas is 10th most dangerous state to work, according to report",real
Stillbirths higher after Hurricanes Katrina and Rita,real
23-State Salmonella Outbreak from Backyard Poultry Flocks,real
Debunking the Myths of a Liberal Economist,real
Airliner nearly collided with drone,real
Where To Now For The Euro After Mario Draghi Signals An Easing Is Coming?,real
Vietnam sea spat part of China's larger strategy,real
Actions by Chinese ships in South China Sea deeply troubling: US Senators,real
You are what you eat,real
CA-BUSINESS Summary,real
End of bar cars on Metro-North trains,real
TSLA: Missouri Mulls Tesla Direct Sales Ban,real
Tesla Motors Inc (TSLA) Q1 Earnings Preview: Too Much Risk to Trade,real
"Capsules: States' Medicaid Decisions Leave Health Centers, Patients In Lurch",real
Hillshire buying Pinnacle Foods for $4.23 billion,real
Record Highs for Dow,real
Is the Dollar at a Turning Point?,real
"BNP Paribas, Credit Suisse Seek Leniency in US, NYT Says (1)",real
UK satellite company Inmarsat offers free airline tracking service,real
Chrysler Posts $690 Million First Quarter Loss,real
Pfizer: U.K. job promises are legally binding,real
David Cameron in talks with Astra,real
"Allergan Calls Valeant Unsustainable, Rejects $45B Offer",real
British Sky Broadcasting Group PLC Statement on potential acquisition,real
BSkyB confirms 21st Century Fox asset acquisition plans,real
Murdoch eyes $14-bn deal to merge pay-TV units,real
Japan's public debt rises to record 1.02 quadrillion yen,real
Ford and Chrysler recall huge numbers of vehicles,real
Google Secretly Tried Selling Glass To Wealthy Golfers,real
"Apple To Offer Senior Positions To Beats' Lovine, Dr. Dre [REPORT]",real
Apple looks at Beats purchase,real
Apple in talks to acquire Beats for $3.2bn,real
Lost at Sea: Research Sub out of Woods Hole Goes Missing in Deep Pacific  ...,real
Gas prices decrease by 1 1/2 cents in last week,real
Microsoft gives Windows 8.1 users extra month to upgrade,real
Bee decline study puts pressure on UK to ban garden chemicals,real
Public outcry pushes FCC head on the back foot on net neutrality,real
"Google, Netflix lead nearly 150 tech companies in protest of FCC net neutrality  ...",real
Google Reportedly Testing New User Interface For Gmail,real
Parrot launching smartphone drones,real
'Neighbors' unseats Spidey to top box office,real
Neighbors Unseated Spider Man 2 in the Box Office,real
Spiderman 2 Ousted From Top Spot,real
Fox fall schedule cuts back on 'American Idol',real
Epic Video of Solange Attacking Jay Z,real
Drunk In Beating: Beyonce's Sister Solange Physically Attacks Jay-Z Inside  ...,real
Must-Watch: Solange Knowles Ferociously Attacks Jay-Z In Hotel Elevator! [Video],real
Woman forced to pay back £15 million after her holocaust memoir is revealed to  ...,real
"Mad Men Review: “The Runaways” (Season 7, Episode 5)",real
Hugh Jackman has 2nd skin cancer growth removed,real
“Game of Thrones” Recap: “Law & Order: King's Landing”,real
"Game of Thrones 4.06 Review: ""The Laws of Gods and Men""",real
'Game of Thrones' Recap: The Trial of Tyrion Lannister,real
Falling 'Idol': Are music reality shows over?,real
Inside George Clooney and Amal Alamuddin's Engagement Party,real
Don't need kids? Will Goerge and Amal be planning for kids soon,real
TV Monday: The Blacklist wraps up season on high note,real
Eminem's Special Mother's Day Tribute: Video,real
"On Mother's Day, Eminem Drops Video For Nicer Song About His Mom",real
Boy Scouts to the rescue! Injured Ann Curry saved by troop,real
"FROZEN's Elsa, New character in ONCE UPON A TIME Season Four",real
NBC Starts Upfronts in a Strange Place: On Top,real
Lucid dreams through brain stimulation can alter way of sleeping - study,real
Heathrow passenger has deadly virus,real
Jordanian government urges caution as 5th MERS death reported,real
Study IDs 17 Chemicals Linked to Breast Cancer,real
A potent source of genetic variation in cognitive ability has just been discovered,real
"Alcohol kills one person every 10 seconds, SA among top consumers",real
'Star Wars' robotic arm approved for production,real
Rome painted pink for Avon Preview Breast Cancer Walk,real
Cervical cancer incidence highest among women outside screening parameters,real
"Dispite cold winter, ticks are out in force",real
Mono mono: Twins with rare disease born holding hands in Ohio,real
Twin sisters born holding hands bring delivery room to tears,real
Hillshire Brands buying Pinnacle Foods for $6.6bn,real
Hillshire Buys Pinnacle Foods For $4.3 Billion,real
US dollar holds gains against euro,real
Elizabeth Arden (RDEN) Announces Quarterly Earnings Results,real
Pfizer underscores UK commitments,real
Pinterest launches its way to make money: promoted pins,real
Charges From Fiat Merger Hamper Chrysler's Q1 Results,real
Medicaid Expansion Less Costly Than Expected,real
China's expansion in M2 improves,real
Wall Street sets records after traders push indexes up overnight,real
"US STOCKS SNAPSHOT-Dow, S&P 500 close at record highs",real
"Wall Street rises at open, S&P 500 near record",real
'Struggling' Sony No Bonuses Third Year in Row,real
Inmarsat to offer free tracking service following Malaysia Air disaster,real
Allergan Rejects Valeant's Unsolicited Takeover Proposal,real
Report: AT&T Readying Acquisiton of DirecTV for $50 Billion,real
Gas prices drop more than 5¢ in the past week,real
Dr. Dre May Become Hip-Hop's First Billionaire,real
Apple Likely to Keep Beats Hardware a Separate Brand,real
Microsoft to fix two critical bugs this Patch Tuesday,real
Moto E India launch: First look and picture gallery,real
Entry-Level Moto E Phone Has Sharp Screen and Water-Resistant Body,real
"Another Moto E render leaks, this time showing the handset in white",real
India based online retailer Flipkart teases the upcoming Motorola Moto E; launch  ...,real
Moto G Cinema name pops up Motorola's website,real
"Motorola Moto E spotted on Indian import website, confirms sub-Rs 10000 price  ...",real
BlackBerry fights back with cut-price Z3 smartphone,real
Climate Change Chatter: Science and Politics,real
Brzezinski Mocks Scarborough's 'Long Road' to Defend Rubio's Climate Change  ...,real
Climate change threat to infrastructures in Qatar,real
Facebook removes Poke and Camera apps from stores,real
"Antarctic glaciers melting ""unstoppable:"" study",real
NASA Research Indicates Antarctic Glaciers Melting Past Point of No Return,real
Rep. Carol Shea-Porter: Washington must enforce equal Internet speeds for all,real
Cadillac CTS-V Coupe special edition,real
Twitter Adding Mute Button for Unwanted Posts,real
Twitter update brings mute feature to official Android app,real
MUSIC NEWS: STREAM COLDPLAY'S 'GHOST STORIES',real
Neighbors' grabs North American box office top spot,real
First Look: Eminem Apologizes To His Mom In Spike Lee-Directed Video For  ...,real
"'Mad Men' Review: ""The Runaways""",real
"Miley Curses Liam Hemsworth For Breaking Her Heart, Poses With Giant  ...",real
WATCH: Miley Cyrus cracking date rape joke,real
"Bradley Cooper a 'master manipulator,' says ex Jennifer Esposito",real
Michael Jackson's back from the dead. Again.,real
NOTHING TO SEE HERE,real
Beyoncé And Jay-Z Relax At Basketball Game After Solange Attack Video Leaks,real
After THAT Jay Z and Solange fight - Beyonce's sister deletes family Instagram  ...,real
Beyonce's sister attacked Jay Z at the Met Gala after-party in New York City last  ...,real
Top 10 #WhatJayZSaidToSolange tweets,real
Fox ready to air 'Batman' prequel,real
Fox Plays Up 'Eventizing' in Upfront,real
Batman v Superman director Snyder teases glimpse of new Batmobile,real
'Batman vs. Superman' Batmobile (PHOTO): Zack Snyder Teases Ben Affleck's  ...,real
Optimus Prime Rides Grimlock Into Battle in New Poster for Transformers: Age of  ...,real
Why a Community resurrection is extraordinarily unlikely—though not impossible,real
'Alien' creator HR Giger dies at 74,real
Dancing With The Stars: Semi Final Shocker As An Olympian Is Voted Off,real
Meryl Davis Dancing With the Stars Viennese Waltz Video 5/12/14 #DWTS  ...,real
"Review: Game of Thrones — 'The Laws of Gods and Men' (s4, e6) (Includes first  ...",real
WHO calls on governments to do more to prevent alcohol-related deaths and  ...,real
"Pregnant Women More Likely to be in Car Crashes, Study Finds",real
CDC confirms 2nd mers case in US,real
Second U.S. case of deadly MERS virus found in Orlando area,real
E-cigs getting snuffed out?,real
'No benefit' from red wine ingredient,real
Solvents linked to memory and thinking problems,real
Lee Kun Hee Was Catalyst For Growth Of Samsung Group,real
Samsung chairman Lee Kun Hee stable after surgery for heart attack,real
SAC Capital's Michael Steinberg Faces Six Years Jail Time,real
Switzerland to vote on world's highest minimum wage,real
AAA expects Memorial Day travel increase,real
"Sulzberger: Abramson ouster about management, not unequal pay",real
Does the New York Times Know How to Fire Someone?,real
Was the New York Times' firing of Jill Abramson sexist?,real
More Than 3000 Chinese Nationals Evacuated From Vietnam: State Media,real
Violence subsides in Vietnam after anti-China rioting,real
Protests erupt after Philippines accuses China of building secret military base on  ...,real
Here's Exactly Why Pinterest Is Worth Its $5 Billion Valuation,real
Who'll miss a Red Lobster?,real
"Reader feedback May 17: Pizza deliver driver robbed, Red Lobster, LPGA  ...",real
The Red Lobster Chain is Worth Two Billion Dollars,real
Red Lobster sold to Golden Gate Capital for $2.1B,real
Why Democrats Are Paying Attention to Piketty's Book on Inequality,real
TrueCar Announces Pricing of Initial Public Offering,real
Today's Gold per ounce price spot gold per gram spot silver rate close review  ...,real
Markets take a beating as stocks end in the red,real
"US Stock Futures Near Flat After Drop in Jobless, Higher Consumer Spending",real
Report: AT&T will announce it's buying DirecTV,real
JCPenney's sales went up,real
"JC Penney quarterly sales rise 6.3%, shares surge",real
Vince McMahon loses $350 million in one day; no longer a billionaire,real
WWE Is Taking a Beating—And Not the Fake for TV Kind of Beating,real
WWE and NBCUniversal Close to Signing a New Deal,real
Google Improves iOS Now App,real
The 'right to be forgotten' explained,real
Actor 'Asks Google To Pull Teen Affair Results',real
Report lists top 5 people who would want the 'right to be forgotten',real
German Regulator Says Google Promises 'Right to be Forgotten' Mechanism in  ...,real
"Apple, Google Make Peace, Drop Lawsuits",real
"Apple, Google settle one of the highest-profile lawsuits in technology",real
Apple and Google drop lawsuits to focus on patent reform,real
'World's largest dinosaur' discovered in Argentina,real
Paleontologists in Argentina discover largest dinosaur bones,real
911 officials: Text messaging coming soon,real
A 911 text? Elkhart County emergency dispatchers are ready for typed calls for  ...,real
Prepare for Titanfall on your mobile: official companion app out now,real
Google buys Word Lens app maker to improve Google Translate,real
Adidas teases with new 'Photo Print' app; takes sneaker customization to another  ...,real
Test for Satya Nadella as he touts Microsoft's new Surface tablets,real
New specialty store opening today at Jordan Creek,real
"NASA's Curiosity Mars rover finishes drilling task at Windjana, resumes mission  ...",real
Whatever happened to the Apple deal for Beats?,real
Dr. Dre's 'First Billionaire in Hip – Hop' Facebook Post Strengthens Possibility of  ...,real
"The Red Spot Of Jupiter Is Shrinking, Say's NASA",real
Halo 5: Guardians officially announced,real
343 Industries Announces Halo 5: Guardians for Xbox One,real
Halo 5 Guardians Will Be the Xbox One's Maiden Halo,real
Cannes: Man Dives Under Ugly Betty Star's Skirt,real
Man dragged away after bizarre dive under actress at Cannes,real
Grey's Anatomy Season 10 Episode 24: Live Streaming Information of Finale Show,real
Sandra Oh Open to Returning for 'Grey's Anatomy' Series Finale,real
"Sarah Silverman, Bill Hader And Judd Apatow Now Writing For Chipotle!",real
Revenge comedy wins hearts at Cannes,real
"Jill Abramson brought a lawyer to a salary fight, and other reasons why the  ...",real
Here Are Some Of The Poignant Artifacts On Display At The New 9/11 Memorial  ...,real
"Artifacts large, small highlight museum dedicated to Sept. 11",real
The 9/11 Museum Dedication -- A Profile of Two Unsung Heroes of 9/11,real
STAR WARS release first official image from the set!,real
Here We Go: 'Star Wars Episode VII' Kicks Off Filming at Pinewood,real
Original 'Star Wars' Actor Tells New Movie to Take a Hike: It'll Just Bore Me,real
Footage of FDR walking unveiled in Pa.,real
Sherri Shepherd's Ex Rules for Our Marriage: 1) DON'T GET FAT,real
Andy Samberg Teases 'SNL' Return,real
How Barbara Walters Got a Reputation for Making People Cry,real
Hillary Clinton Joins Barbara Walters as She Bids Farewell,real
"Oprah, others help Barbara Walters say farewell",real
Festival Blast – The Hangout Fest 2014,real
arcade fire tour 2014,real
Solange & Jay Z Elevator Video Gets Audio Courtesy of 'SNL'!,real
Measles vaccine cures cancer,real
Altered Measles Vaccine Cures Cancer,real
Japan's women enjoy top life expectancy,real
Meds and Movement: My Breast Cancer Treatment Plan,real
America's health care divide deepens as the coverage gap in red states grows,real
"Using internet, apps to manage blood pressure has dangers, study says",real
MERS virus infects another in Illinois,real
Brazil faces dengue threat during FIFA world cup,real
Stem Cell Therapy Shows Promise For MS In Mouse Model,real
And Now The Bad News: Red Wine Is Not Great For Health After All,real
Time to Stop the War on Inequality,real
WWE: WTF Went Wrong?,real
"Overall situation in Vietnam stabilizing, sources say",real
Over 3000 Chinese Flee Vietnam Due to Violence,real
Home builders most pessimistic in a year,real
"After A Rough Winter, We're Ready To Hit The Road",real
Find your own investment benchmark,real
Auto interiors company to be created by joint venture between Wisconsin  ...,real
Pinterest Valued at $5 Billion in Financing Round,real
FTC says Snapchat deceived customers,real
Edmond wrong on global warming,real
Sony PlayStation 4 outsells Microsoft Xbox One for fourth straight month,real
Bestselling Console of PS4 In April,real
April NPD: Xbox One still in second as price drop looms,real
Microsoft Completes Its 180 And Drops Kinect From Xbox One,real
Texas should worry about Antarctica,real
Google Glass gets new leader as company hires marketing expert,real
Google Glass Becomes Part of UC Irvine Medical School,real
How octopuses don't tie themselves into knots,real
Camelopardalid Meteor Shower Date and When to Watch: Rare Cosmic Event to  ...,real
Fossils of 'Titanosaur' in Argentina bigger than 13 African elephants,real
Apple and Google settle patent war on smartphone OS platforms,real
Beyoncé and Jay Z star in fake movie trailer to promote On The Run Tour,real
Jay Z and Beyonce Tease Star-Packed Action Film 'Run',real
Beyonc&eacute; and Solange photographed for the first time since video leak,real
Paul McCartney nixes two more Tokyo shows,real
Deryck Whibley blames month-long hospital stay on heavy drinking,real
"Doctor Who: Radio Times BAFTA Audience Award a ""really special moment for  ...",real
"Backstage at BAFTA: Graham Norton on buses, awards and lots of wine",real
James Franco refuses to be part of `Spring Breakers` movie sequel,real
As I Lay Dying singer Tim Lambesis jailed for six years for trying to hire hitman to  ...,real
Bachelorette 2014 Spoilers: Does Andi Dorfman Get Engaged in the Finale?,real
"Schwarzenegger, Stallone, and Gibson lead charge of action heroes from  ...",real
LIVE! Be First On The Billboard Music Awards Red Carpet,real
Billboard Music Awards' Most Memorable Fashion Moments,real
"After Box Office Success, Warner Bros. and Legendary Pictures Moving Ahead  ...",real
'Godzilla' opens with smashing $93.2M - FOX Carolina 21,real
Pamela Anderson reveals sex abuse,real
'Girls Gone Wild' founder booked on assault charge,real
Kim Kardashian's grey Lanvin wedding gown in Vogue a hug hit! (see pics),real
Mosquito Season,real
"US Confirmed Third Case of MERS, CDC Says It's a Man From Illinois",real
Is too much exercise bad for your health?,real
AT&T Buying DirecTV for $48.5B (T),real
AT&T agrees to purchase DirecTV in $48.5B deal,real
AT&T makes bet on video with $48.5 bln DirecTV bid,real
Billionaire has untreatable cancer,real
U.S. stock futures edge lower Monday to start week,real
Cable 'keeping options open' about AstraZeneca future,real
Sweden pans Pfizer bid for AstraZeneca,real
Deutsche Bank sees 'tectonic plate shift' in banking,real
Deutsche Bank taps investors for €8bn,real
BBC Turkey mistakes women's identities in Soma blunder,real
"Yahoo Japan Corp.'s share price down, cancels its offer for the acquisition of  ...",real
Hong Kong stocks finish flat,real
AAA says 1.3 million Ohioans will travel for long Memorial Day holiday weekend,real
Completing the single market in capital,real
"Verizon To Boost 4G LTE Using AWS Spectrum Under A New Brand Name, XLTE",real
Facebook to release Snapchat-style video messaging app?,real
Ailing Kepler telescope cleared for new duty,real
RUBIK'S CUBE INVENTION: Google celebrates toy puzzle's 40th anniversary  ...,real
Procrastination warning: today's Google doodle is a functioning Rubick's Cube,real
Average Gas Prices Fall 1.5 Cents in PA,real
Is Level 3 Communications Ready to Move to the Next Level?,real
"Paleontologists Discover Fossil Remains of World's Biggest Creature, Titanosaur",real
"Turning Light into Matter, Ending an 80-Year Quest",real
