"Samsung, LG launch Google smartwatches",real
HTC One M7 and One M8 to Receive Android L Within 90 Days After Google  ...,real
"Samsung, LG set to battle over Android-based wearables",real
Samsung introduces Gear Live smartwatch,real
Oldest Human Feces Suggest Neanderthals also Consumed Vegetables,real
What Discovery of Oldest Human Poop Reveals About Neanderthals' Diet,real
Montana Health Department Server Hack Likely Compromised 1.3 Million  ...,real
Researchers crack iPad PINs by tracking the fingers that enter them,real
Here's what Facebook's workforce looks like,real
Google debuts health & fitness tracking platform Google Fit,real
Google Fit unveiled as Apple HealthKit rival,real
"GM lifts sales stall on '13, '14 Cruzes",real
General Motor prepares to recall some Cruze sedans with Takata air bags,real
General Motors,real
Wildlife officials decline to interfere with natural process of nesting eagles,real
Stocks edge higher despite economic data,real
Supreme Court pulls the plug on Aereo,real
Supreme Court rules for broadcasters in Aereo case,real
U.S. Supreme Court hammers Aereo with 6-3 ruling,real
Alaska humpback whales may lose endangered status,real
Net neutrality action: Why Occupy Google? And 'father' of the term Tim Wu  ...,real
Tightly packed trio of black holes discovered,real
Google I/O protesters heckle at developer event,real
"Verizon ends data for Chromebook Pixel, Google covers up",real
"Beyonce, Jay Z share wedding video at 'On the Run' opener",real
Beyoncé And Jay Z Kick Off 'On The Run' Tour In Miami,real
Beyonce and Jay Z 'On the Run' Tour Official Setlist,real
Bey & Jay's 'On the Run Tour' On Track to Break $100 Mil Threshold,real
Beyonce Knowles' Tribute To Michael Jackson,real
Michael Jackson Has Sold More Albums Since His Death Than The Last 13  ...,real
Michael Jackson's 11 Best Music Videos,real
How Michael Jackson's Kids Are Doing Five Years After His Death,real
Michael Jackson Attorneys Plea to Dismiss the King of Pop Five Years After Death,real
Today in entertainment history: June 25,real
New Trailer Released for “Hunger Games: Mockingjay – Part 1″,real
Josh Hutcherson looks eerily defeated in new government propaganda teaser  ...,real
The Hunger Games: Mockingjay teaser trailer address,real
President Snow addresses Panem in 'Mockingjay' teaser -- with a surprise guest,real
new teaser for The Hunger Games: Mockingjay (Video),real
Watch! Hunger Games: Mockingjay teaser trailer,real
"Bob Dylan lyrics fetch $2 million in New York auction, but no sale for John  ...",real
'Like a Rolling Stone' draft could sell for $2 million,real
Gary Oldman Apologizes for Offensive Comments about Jews in 'Playboy  ...,real
"Gary Oldman Apologizes, Andy Serkis Channels Gollum & Caesar in Our Late  ...",real
Sarah Jessica Parker returning to TV in Crime Series,real
Sarah Jessica Parker to Return to TV in New Crime Drama Busted,real
Lana Del Rey Reportedly Left Barrie-James O'Neill for Photog Francesco  ...,real
Barrie-James O'Neill: 'It's not over between Lana Del Rey and I',real
Lana Del Rey Snatches #1 Crown On Billboard 200; Sam Smith Bows High,real
VIDEO: Lana Del Rey Calls Off Engagement,real
Lana Del Rey Is Officially Single,real
WATCH: Brad Pitt Goes to War in New 'Fury' Trailer,real
Sony releases 1st official trailer for 'FURY' starring Brad Pitt,real
'Fury' Trailer Puts Brad Pitt & Shia LaBeouf In A Tank,real
Veteran character actor Eli Wallach dies at 98,real
"Eli Wallach, prolific US character actor, dies at 98 0",real
Acclaimed character actor Eli Wallach dies at 98,real
"'The Good, The Bad and The Ugly Star' Eli Wallach Dies At 98",real
dozens hospitalized at Avicii concert in Boston last night; two deaths tied to Las  ...,real
Dozens Of Avicii Fans Get Too Fucked Up In Boston,real
"Dozens treated for drugs, alcohol at Boston concert",real
Several hospitalized at Avicii concert in Boston,real
Demi Lovato reveals her gay granddad's spirit is her inspiration,real
Demi Lovato reveals grandfather was gay,real
Demi Lovato gives advice to fans in 'Seventeen'...,real
Demi Lovato In 'Seventeen' — Bold Red Lips & Bright Purple Hair,real
Footage of Kim Kardashian Addressing Kanye West Impersonator In Blackface  ...,real
Hip-Hop Rumors: Are Kim And Kanye Fighting Already? Right After The Wedding?,real
Catch of the day: Kim Kardashian puckers up to dolphin in Mexico,real
Rob Kardashian and Kim Kardashian at war!,real
Kim Kardashian & Reggie Bush's Families Are Basically Identical…And Here's  ...,real
Kim Kardashian criticized for revealing outfits,real
"Kim Kardashian shares a kiss with a dolphin – yes, really",real
French court orders extradition of Jewish shooting suspect,real
"Lucas Museum on 'Solid Legal Ground,' Says Rahm, Reassures Bears Tailgaters",real
George Lucas museum choice prompts strong reactions from leaders,real
'Star Wars' Creator George Lucas Selects Chicago for Museum,real
'Star Wars' creator to set up movie museum in Chicago,real
'Star Wars' Creator George Lucas Chooses Chicago As Home Of Museum,real
Mayor: George Lucas museum coming to Chicago,real
"Transformers: Age of Extinction – the juggernaut gets bigger, louder, longer, but  ...",real
Mark Wahlberg Says Ted Is A Worse Influence In Ted 2,real
'Transformers: Age of Extinction' delivers in wrong ways,real
Nicola Peltz sacrificed for Transformers,real
Transformers 4 Actors Explain Why Michael Bay Hit Them With A Broom,real
"From teddy bears to Transformers, Mark Wahlberg's toy story",real
ABC says Muir replacing Sawyer at 'World News',real
Why the Evening-News Anchor Is No Longer the Most Important Person on TV,real
Diane Sawyer to step down from 'World News',real
"Diane Sawyer, David Muir, George Stephanopoulos: Sawyer Steps Down As  ...",real
UPDATE 2-Anchor Diane Sawyer to step down from 'ABC World News' show,real
Diane Sawyer stepping down as 'World News' anchor,real
Failed marriage to 'Deal or No Deal' model broke Andrew Stern,real
Model's Husband Commits Suicide Weeks After She Was Photographed Getting  ...,real
Corvette sinkhole attraction,real
Korean War anniversary and GOP disdain for vets,real
Is North Korea Threatening War over Seth Rogen and James Franco's New  ...,real
North Korea to 'mercilessly' destroy makers of Seth Rogen film,real
North Korea calls new US movie featuring Seth Rogen and James Franco an 'act  ...,real
N.Korea slams new Seth Rogen movie as 'act of war',real
"North Korea Declares Seth Rogen and James Franco's 'The Interview' an ""Act of  ...",real
North Korea promises war if 'the interview' starring James Franco is released,real
North Korea says US movie comedy is 'act of war',real
North Korea calls new US movie an 'act of war',real
"UN Report: More Americans Use Cannabis, Seeking Treatment",real
"Having Babies Later In Life Linked To Longevity In Women, Study",real
"Women who give birth later in life live longer, research shows",real
NYC loses appeal to ban large sugary drinks,real
Sugary Drinks,real
"Soda ban in New York City goes too far, court rules",real
FDA: Acne Products Can Cause Dangerous Side Effects,real
Acne products linked to severe allergic reactions,real
World Health Organization Calls for Drastic Action to Halt West Africa's Deadly  ...,real
WHO urges 'drastic action' on Ebola outbreak in Africa,real
"3D mammograms detect cancer better, prevent false alarms",real
Cancer detection rate improved with 3D breast imaging technique,real
"3-D mammograms improve breast cancer screening, study finds",real
The VERY Surprising Reason Your TV Might Kill You,real
Beware -- watching too much TV could kill you!,real
Can Too Much Vitamins In Cereals Be Harmful To Kids?,real
Allen County pastor faces sex charges,real
Swimming in murky waters,real
Barclays' dark pool shunned by clients after fraud case,real
Barclays Dark Pool Shunned by Clients,real
"UPDATE - Barclays shares sink as lawsuit filed over its ""dark pool""",real
Barclays Shares Fall After Accusation of Fraud and Deceit,real
Salesforce.com and Philips launch cloud-based professional healthcare platform,real
Lee Harvey Bullard Is Thursday's Stock Market Fall Guy,real
Markets Slightly Lower As Bullard Hints Lower Rates Could Come Sooner Than  ...,real
US STOCKS-Wall St dips on Fed's Bullard comments on interest rates,real
Economists Slash Growth Forecasts After Weak Consumer Spending,real
US jobless claims fall,real
In the papers: Alibaba chooses NYSE over NASDAQ,real
Alibaba chooses New York Stock Exchange over Nasdaq,real
Global Tensions Ease Along With OIl Prices,real
Argentina has processed June 30 debt payment,real
Argentina's Kicillof says has processed June 30 debt payment,real
Strong Exports Sees NZD/USD Up At 0.8780,real
United Tech's Sikorsky Wins $1.3B US Helicopter Deal,real
GoPro Shares Jump More Than 30 Percent on First Day of Trading,real
GoPro's Woodman Cashes In on the Camera Maker's First Day of Trading,real
GoPro goes public: Camera maker up 30%,real
"Photo Release -- NASDAQ Welcomes GoPro, Inc. (NASDAQ: GPRO) to The  ...",real
GoPro CEO: Surfing trip made me a billionaire,real
Ikea raises hourly pay for US retail workers,real
Ikea to raise its average minimum hourly wage to $10.76,real
IKEA to raise minimum wage at US stores,real
Sheffield manufacturer snapped up by global giant in £1.7bn deal,real
Notable 52-Week Highs and Lows of the Day 06/26: (AA) (IRM) (BKS) High  ...,real
UPDATE 2-Alcoa to buy aerospace company Firth Rixson,real
AAA: Higher gas prices not enough to stop Fourth of July travelers,real
More drivers on road for July 4 weekend,real
US jobless claims dip,real
The Eccentric Chinese Billionaire Who Loves New York Tried Again Today to  ...,real
Tycoon booed by cash-hungry crowd,real
Chinese Millionaire Hosts Luncheon for Homeless New Yorkers,real
Chinese Tycoon 1,real
"UPDATE 3-Japan jobless rate hits 16-yr low, signals spending rebound ahead",real
"On wings of e-cigarettes, Philip Morris Int'l to sell Marlboro product that heats  ...",real
Gorgeous Faces Keep Guenon Monkeys from Sleeping Around,real
"The Binge-Watch Before The Purge, Now That Aereo Is Likely Done",real
Bid Adieu to Aereo—At Least for Now,real
'Public' as in 'airwaves' vs. 'public' as in 'performance',real
Aereo loss protects $4 billion in fees for broadcasters,real
Are Supremes changing the mobile landscape?,real
Apple's 16GB iPod Touch Is Available For Rs 16900 In India,real
"iPod Touch Price Cut $100, Hinting iWatch Release Date Coming Soon?",real
Apple Introduces Lower-Priced iPod Touch,real
"Apple Updated The iPod Touch, Lowering The Price And Adding New Colors",real
"YouTube's new features: crowdfunding, fan-made subtitles and 60fps video",real
"YouTube stars create communities, not fans",real
General Motors orders dealers to stop selling Chevy Cruze,real
GM once again suspends sales of the Chevrolet Cruze,real
"Brand News: Kellogg's, Aereo, GM and more",real
Neanderthals ate vegetables too,real
Newly discovered 50000-year-old poop proves the Neanderthals ate better than  ...,real
Live video: Chrysler unveils new Ram Truck vehicle,real
European broadband gets ready for 4K,real
Here's What It Looks Like When Google Enacts Europe's New 'Right To Be  ...,real
"Google starts 'forgetting' things in Europe, begins removing search results",real
Google begins wiping Europe search results over 'right to be forgotten' ruling,real
The Right To Be Forgotten: Balancing Conflicting Rights,real
Alps says no complaints from GM over ignition switches,real
A New Doc Explores The Bright Life And Sudden Death Of Aaron Swartz,real
"With Google's Android One, expect sub-$100 phones from Micromax and others",real
Android L preview now available: Here are the big changes in the new OS,real
Google announces Android One to revolutionize low-end smartphones,real
How Google declared open war against passwords at I/O,real
Google not killing Nexus line over Android Silver,real
Use 'Ok Google' anywhere on your Android smartphone,real
Android Auto Debuts; Brings Google-Apple Battle into Your Car [w/Video],real
Google Unveils New Android Version in Push Against Apple,real
Which Cars Will Feature Android Auto And When?,real
Download the Android L Developer Preview release now,real
Google Announces Sub- $100 Smartphone,real
"Samsung, LG launch smartwatches",real
Google Inc (GOOGL): Google I/O 2014 All One Needs to Know in Under 9 Minutes,real
Apple's iWatch Is Cleared For Takeoff,real
"Google partners Micromax,others for sub-$100 smartphone by Oct",real
American Wood Stork No Longer Listed As Endangered Species,real
Who is David Muir? (Other than Diane Sawyer's new 'Evening News' replacement),real
"ABC News shakeup: Sawyer, Stephanopoulos, Muir in new roles",real
Diane Sawyer stepping down as ABC anchor,real
Phil Collins donates extensive Alamo collection to museum,real
Grammy-winner Collins donates artifacts to Alamo,real
"Shiaa LaBeouf arresetd, escorted from Broadway show",real
Shia LaBeouf Arrested In New York For 'Disorderly Conduct' At Performance Of  ...,real
"Police: Shia LaBeouf removed from Broadway theater, arrested",real
Police: Shia LaBeouf escorted out of Broadway theatre showing 'Cabaret' for  ...,real
France to extradite Jewish museum shooting suspect Nemmouche to Belgium,real
Two Irish actors invited to join the Academy,real
"Sherri Shepherd, Jenny McCarthy exit 'The View'",real
"Sherri Shepherd to Leave ""The View"" After Seven Years",real
Beyonce reveals secret wedding day clips during 'On the Run' tour,real
"Beyonce, Jay Z Unveil Wedding Video During On The Run Tour",real
"Beyonce, Jay Z Reveal Unseen Wedding Footage and Blue Ivy Moments at 'On  ...",real
They're On the Run! Beyoncé and Jay Z Kick Off Their Joint Tour in Miami,real
Beyoncé Blows Minds With Her Sexy & Sassy Bodysuits For The On The Run  ...,real
Watch Beyonce and Jay Z Play ''03 Bonnie and Clyde' for 'On the Run' Kick-Off,real
Rogen scared of NKorean threat?,real
Will North Korea consider this blog an “act of war”?,real
North Korea calls Seth Rogen-James Franco 'The Interview' as 'act of terrorism',real
North Korea calls US movie about plot to assassinate Kim Jung Un an “act of war”,real
36 sent to hospitals with 'medical issues' at Swedish DJ's Boston dance music  ...,real
Why 36 Avicii Fans Were Rushed to Hospital During Concert,real
"Michelle Fairley talks '24' shock, Lady Stoneheart chatter",real
Kevin Bacon joins Johnny Depp in 'Black Mass',real
Benedict Cumberbatch Films 'Black Mass' Scene in Lynn,real
Kim Kardashian flashes a lot of leg (and Spanx) in thigh-split dress as she  ...,real
Kim Kardashian posts revealing selfie on Instagram,real
Kim Kardashian Goes Back to Brunette ... and Shows Off Her Cleavage!,real
Reviews: 'Transformers: Age of Extinction' 'They Came Together',real
"Movie Review: ""Transformers: Age of Extinction"" (Rated PG-13)",real
A loud explosion of CGI in 'Transformers:Age of Extinction',real
5 questions for Transformers leader Optimus Prime,real
'Transformers: Age of Extinction' review,real
Watch: Red Letter Media Watches First 3 'Transformers' Movies At The Same  ...,real
Review: Transformers 4 FAIL - ENOUGH IS ENOUGH!,real
Lindsay Lohan Debuting Theatrical Side in London Stage,real
Lindsay Lohan to Make Stage Debut in David Mamet's 'Speed-the-Plow',real
Girl Meets World:Hammy reboot lacks charm,real
'Girl Meets World' marks a switch in the Disney program,real
Kristen Stewart Dropped From Snow White & The Huntsman 2?,real
"Frank Darabont To Direct 'Snow White And The Huntsman 2,' Kristen Stewart  ...",real
"Eli Wallach, always around: RIP",real
"Eli Wallach: The Good, the Bad and the Gifted",real
"RIP Eli Wallach (1915-2014): Watch Oscar Acceptance Speech, Career Profile  ...",real
Reconsidering 'gay pride' in today's more inclusive society,real
'Star Wars' creator George Lucas' museum heading to Chicago (Report),real
ReWalk(TM) Personal Exoskeleton System Approved by FDA for Home Use,real
Flu Vaccine Spray Better Than Shots for Young Kids,real
NY tourist known as plague survivor has died,real
Indiana home care funding nearly doubled after Olmstead ruling; still lower than  ...,real
Heavy drinking tied to 1 in 10 early deaths,real
Report: Excessive drinking responsible for 1 in 10 adult deaths,real
Breast cancer risk test 'promising',real
CORRECTION number of Ebola confirmed deaths in Sierra Leone,real
"26/06/2014WHO urges 'drastic action' on Ebola, calls 11-nation meeting",real
Link between hypertension and vitamin D deficiency confirmed,real
Planned Parenthood offers free HIV testing in honor of National HIV Testing Day,real
SAAF awarded HIV mobile testing van,real
Free HIV Testsing for National HIV Testing Day!,real
"Across the US, June 27 is National HIV Testing Day",real
Summer Season Springs Cluster Headaches Into Action,real
New York City's Ban on Oversized Sodas is Dead,real
NY Top Court Denies Ban on Super Sized Sugary Drinks,real
Appeals Court Kills NYC's Big Soda Ban,real
Watching TV for 3 or More Hours Boosts Chances of Early Death,real
Summer meal programs feed hungry kids,real
Arts and crafts retailer Michaels has tepid return to stock market,real
Arts and crafts retailer Michaels begins trading below IPO price of $17,real
"Stocks notch tiny gains, but still end week lower",real
US Stocks Log Weekly Loss Despite Upbeat Friday,real
"Stocks open mixed as the market heads toward a slight weekly loss, its second  ...",real
Rick Perry: Don't kill the Export-Import Bank; cites its impact on jobs,real
"A ""Third Option"": Reformed Reauthorization of the Export-Import Bank",real
Argentina Bond Judge Says He Will Nullify BNY Payment,real
US Judge Says Argentina Can't Pay Some Bondholders -- Update,real
"UPDATE 4-Argentina deposits debt payment, but US court blocks payout",real
VIX back below 12 as stocks bounce,real
7 Things You Need To Know About The VIX,real
[Ticker] Tobacco giant initiates EU court challenge,real
"BNP expected to plead guilty, pay nearly 9-billion-dollar fine",real
BNP Paribas faces ban on processing some dollar payments - report,real
US named watchdog for BNP Paribas,real
Oil edges lower for second straight weekly decline,real
"Crude Oil Vulnerable As Iraq Concerns Fade, Data To Catalyze Volatility",real
Minitrue: CY Leung Disagrees With the Global Times,real
Mainland loans threaten HK banks: Moody's,real
'Referendum' has too many votes to be credible,real
"Jobs data in focus, American Apparel on death watch for the week ahead",real
FIELDS: The pornification of little-girl fashion,real
Analysis: Barclays dark pool lawsuit raises technology and compliance questions,real
There are attempts to shake Bulgaria's banking system: minister (ROUNDUP),real
There are deliberate attempts to destabilise the banking system-Bulgaria's  ...,real
PRASA Says It Doesn't Plan to Restructure,real
Steady job growth boosts consumer confidence,real
Dreiling will retire as Dollar General CEO,real
HP reportedly close to settling suits on Autonomy deal,real
AT&T 4G LTE,real
AT&T equal to rival Verizon,real
Russia abruptly aborts launch of new-generation rocket,real
Vegetables on the Menu For Neanderthals,real
Verizon Billing System Outage Hits Parts of US,real
Watch This Film About Why Aaron Swartz Matters More Than Ever,real
Mexican law enforcement chopper fires at agents in Arizona - 3 Hours Ago,real
Android L's Material keyboard now available on Google Play [DOWNLOAD],real
"Android Wear Wars: The Moto 360, LG G Watch And Samsung Gear Live  ...",real
"A test drive with Android Auto, a simple solution to clunky car software",real
Google throws enterprise IT a bone with Android L,real
"Google Nexus 5, Nexus 7: Download and Install Android 4.5/5.0 Lollipop",real
"LG G Watch, Samsung Gear Live Vie for Smartwatch Buyers' Attention",real
Android L Developer Preview – first look,real
How To Get Your Hands On Android L Developer Preview,real
LG G Watch vs Samsung Galaxy Gear Live: Which Is Better?,real
Man in Screamingly Loud Paisley Shirt Explains Google's Subtle New Design  ...,real
Asus to Launch Sub-$150 Android Wear Smartwatch This September: Report,real
ABC v. Aereo — A big (or maybe not-so-big) win for the networks,real
Lawyers Weigh In On Supreme Court's Aereo Ruling,real
Broadcast Stocks Trade Higher In Wake Of Aereo Ruling,real
"Aereo CEO: We're disappointed in the outcome, but our work is not done",real
Law enforcement cracks down on impaired boating this weekend,real
'Operation Dry Water' will crack down on boating and drinking,real
“Operation Dry Water” campaign targets boaters under the influence,real
Corps of Engineers ramping up for Operation Dry Water 2014—concentrated  ...,real
"GM recalls over 450000 more vehicles, some in Canada",real
"GM issues 3 more recalls covering 474000 vehicles - WBOC-TV 16, Delmarvas  ...",real
Takata airbags force yet another GM recall,real
Shanghai GM recalls 194107 Excelle GT vehicles,real
Is Tim Cook Gay? Apple CEO Outed By CNBC; Watch Him Speak Out On Sexual  ...,real
Google starts deleting some search results at users' request,real
"Daimler and Nissan to invest $1.36 billion to develop, build small cars",real
Renault-Nissan and Daimler Expand Cooperation with New Plant in Mexico,real
UPDATE 1-Daimler and Nissan approve joint Mexico production -sources,real
'The Leftovers' Is a Promising Show You Shouldn't Watch Right Away,real
Damon Lindelof Says HBO's 'Leftovers' Is Nothing Like 'Lost',real
The Awe-Inspiring Bleakness of HBO's 'The Leftovers',real
TV review: 'The Leftovers' comes to HBO,real
"Where Is the Cast of ""Boy Meets World"" Now?",real
TV Review: 'Girl Meets World',real
Official: Lindsay Lohan to Make West End Debut in SPEED-THE-PLOW,real
Robert De Niro pops into stranger's Brooklyn home to watch World Cup,real
Beyoncé and Jay Z Give Inside Look at 'On the Run Tour',real
RUSH HOUR: The stories you need to know today,real
Keeping Up With The Kardashians cancelled? Kim Kardashian unveils video  ...,real
Kim K. Steps Out For A Walk In New York,real
Rob Kardashian drug and sizzurp fears,real
Kardashians Growingly Concerned About Black Sheep Rob's Fondness For  ...,real
French Montana Bought Khloé Kardashian $35000 Worth of Jewels — Which  ...,real
Khloe Kardashian Celebrates 30th Birthday With French Montana!,real
The Kardashian clan party in NYC,real
French Montana's Confusing Comment about Khloe Kardashian,real
Kris Jenner: Khloe Kardashian Is Just Friends With French Montana (VIDEO),real
Wahlberg brings family to premiere,real
"Movie review: Money, not talent, drives fourth 'Transformers' movie",real
A Villain in the New 'Transformers' Movie May Remind You of a Certain Vice  ...,real
Mark Wahlberg - Mark Wahlberg Was 'Absolutely Miserable' On The Gambler Diet,real
Box-office preview: 'Transformers' rolls out for $100 million opening,real
More than meets the eye,real
'Transformers' eyes $100-million open; ABC shakes up 'The View',real
Actress Amy Adams Gives Her 1st Class Seat To US Soldier,real
Amy Adams Gives Her First Class Plane Seat To U.S. Soldier,real
Actress Amy Adams gives first-class seat to soldier,real
True class: Actress Amy Adams gives up first-class seat to soldier,real
Rolling Stone Ronnie Wood today expressed his...,real
"AFP Tributes to soul legend Bobby Womack, dead at 70",real
"AP Drama WriterJune 26, 2014 Updated 14 minutes ago",real
Shia LaBeouf and his amazing thunder-stealing abilities,real
Zach Braff and Lena Dunham among the celebrities to mock Shia LaBeouf on  ...,real
Confessions of a Reformed Shia Labeouf Fan,real
Lena Dunham mocks Shia LaBeouf's theatre meltdown,real
Kristen Stewart Will NOT Appear in SNOW WHITE AND THE HUNTSMAN Sequel,real
Seth MacFarlane To Pledge Up To $1 Million To 'Reading Rainbow',real
Seth MacFarlane Will Donate Up To $1 Million In Matching Funds To 'Reading  ...,real
Seth MacFarlane boosts 'Reading Rainbow',real
Academy Invites 271 New Members,real
"The View Reportedly Firing Jenny McCarthy, Sherri Shepherd",real
Sherri Shepard And Jenny McCarthy Exiting 'The View',real
"Mary Rodgers, author of 'Freaky Friday,' dies at 83",real
EU Panel OKs Expanded Use of Roche Cancer Drug,real
Excessive drinking causes 10% of deaths among working-age adults,real
88000 deaths a year are due to excessive drinking,real
FDA approves long-delayed inhalable insulin drug Afrezza from MannKind,real
Teething Babies Do Not Need Medicine On Their Gums,real
FDA Approves Robotic Exoskeleton For Sale In US,real
"Greens good for health but don't lead to weight loss, study shows",real
Hiding victims of ebola is now illegal in Sierra Leone,real
WHO Warns West Africa Countries of Ebola Spread,real
"'Be ready' for Ebola outbreak's spread, WHO warns West African nations",real
Find Out Where You Can (and Cannot) Get Medical Marijuana in Mass.,real
IKEA and 7 others that pay above minimum wage,real
News in Breif,real
Argentinean Vice-president Meets Official Agenda in Cuba,real
AAA: Fourth of July Travel Up; Strongest For Auto Travel,real
AAA Predicts July 4 Travel Will Be Highest in 7 Years,real
Dov Charney Blocked from retaking control,real
"You're paying more for gasoline, and here's why",real
Gasoline prices move higher,real
Why the Stock Market Dropped After Bullard's Interest Rate Forecast,real
Forex - USD/JPY near 1-month lows after tepid Japan data,real
Stocks Notch Tiny Gains to End Week,real
"Stocks move lower on Wall Street, led by banks",real
US 'Flash Boys' Style Lawsuit Slashes £2.5bn Off Barclays' Stock Value,real
NY Attorney General goes after Barclays,real
US West Coast Port Workers Will Be Off Contract Starting Tuesday - Expect  ...,real
Enrollment help is out there,real
