General Motor prepares to recall some Cruze sedans with Takata air bags,real
Wildlife officials decline to interfere with natural process of nesting eagles,real
Supreme Court pulls the plug on Aereo,real
U.S. Supreme Court hammers Aereo with 6-3 ruling,real
Net neutrality action: Why Occupy Google? And 'father' of the term Tim Wu  ...,real
Google I/O protesters heckle at developer event,real
"Beyonce, Jay Z share wedding video at 'On the Run' opener",real
Beyonce and Jay Z 'On the Run' Tour Official Setlist,real
Beyonce Knowles' Tribute To Michael Jackson,real
Michael Jackson's 11 Best Music Videos,real
Michael Jackson Attorneys Plea to Dismiss the King of Pop Five Years After Death,real
New Trailer Released for “Hunger Games: Mockingjay – Part 1″,real
The Hunger Games: Mockingjay teaser trailer address,real
new teaser for The Hunger Games: Mockingjay (Video),real
"Bob Dylan lyrics fetch $2 million in New York auction, but no sale for John  ...",real
Gary Oldman Apologizes for Offensive Comments about Jews in 'Playboy  ...,real
Sarah Jessica Parker returning to TV in Crime Series,real
Lana Del Rey Reportedly Left Barrie-James O'Neill for Photog Francesco  ...,real
Lana Del Rey Snatches #1 Crown On Billboard 200; Sam Smith Bows High,real
Lana Del Rey Is Officially Single,real
Sony releases 1st official trailer for 'FURY' starring Brad Pitt,real
Veteran character actor Eli Wallach dies at 98,real
Acclaimed character actor Eli Wallach dies at 98,real
dozens hospitalized at Avicii concert in Boston last night; two deaths tied to Las  ...,real
"Dozens treated for drugs, alcohol at Boston concert",real
Demi Lovato reveals her gay granddad's spirit is her inspiration,real
Demi Lovato gives advice to fans in 'Seventeen'...,real
Footage of Kim Kardashian Addressing Kanye West Impersonator In Blackface  ...,real
Catch of the day: Kim Kardashian puckers up to dolphin in Mexico,real
Kim Kardashian & Reggie Bush's Families Are Basically Identical…And Here's  ...,real
"Kim Kardashian shares a kiss with a dolphin – yes, really",real
"Lucas Museum on 'Solid Legal Ground,' Says Rahm, Reassures Bears Tailgaters",real
'Star Wars' Creator George Lucas Selects Chicago for Museum,real
'Star Wars' Creator George Lucas Chooses Chicago As Home Of Museum,real
"Transformers: Age of Extinction – the juggernaut gets bigger, louder, longer, but  ...",real
'Transformers: Age of Extinction' delivers in wrong ways,real
Transformers 4 Actors Explain Why Michael Bay Hit Them With A Broom,real
ABC says Muir replacing Sawyer at 'World News',real
Diane Sawyer to step down from 'World News',real
UPDATE 2-Anchor Diane Sawyer to step down from 'ABC World News' show,real
Failed marriage to 'Deal or No Deal' model broke Andrew Stern,real
Corvette sinkhole attraction,real
Is North Korea Threatening War over Seth Rogen and James Franco's New  ...,real
North Korea calls new US movie featuring Seth Rogen and James Franco an 'act  ...,real
"North Korea Declares Seth Rogen and James Franco's 'The Interview' an ""Act of  ...",real
North Korea says US movie comedy is 'act of war',real
"UN Report: More Americans Use Cannabis, Seeking Treatment",real
"Women who give birth later in life live longer, research shows",real
Sugary Drinks,real
FDA: Acne Products Can Cause Dangerous Side Effects,real
World Health Organization Calls for Drastic Action to Halt West Africa's Deadly  ...,real
"3D mammograms detect cancer better, prevent false alarms",real
"3-D mammograms improve breast cancer screening, study finds",real
Beware -- watching too much TV could kill you!,real
Allen County pastor faces sex charges,real
Barclays' dark pool shunned by clients after fraud case,real
"UPDATE - Barclays shares sink as lawsuit filed over its ""dark pool""",real
Salesforce.com and Philips launch cloud-based professional healthcare platform,real
Markets Slightly Lower As Bullard Hints Lower Rates Could Come Sooner Than  ...,real
Economists Slash Growth Forecasts After Weak Consumer Spending,real
In the papers: Alibaba chooses NYSE over NASDAQ,real
Global Tensions Ease Along With OIl Prices,real
Argentina's Kicillof says has processed June 30 debt payment,real
United Tech's Sikorsky Wins $1.3B US Helicopter Deal,real
GoPro's Woodman Cashes In on the Camera Maker's First Day of Trading,real
"Photo Release -- NASDAQ Welcomes GoPro, Inc. (NASDAQ: GPRO) to The  ...",real
Ikea raises hourly pay for US retail workers,real
IKEA to raise minimum wage at US stores,real
Notable 52-Week Highs and Lows of the Day 06/26: (AA) (IRM) (BKS) High  ...,real
AAA: Higher gas prices not enough to stop Fourth of July travelers,real
US jobless claims dip,real
Tycoon booed by cash-hungry crowd,real
Chinese Tycoon 1,real
"On wings of e-cigarettes, Philip Morris Int'l to sell Marlboro product that heats  ...",real
"The Binge-Watch Before The Purge, Now That Aereo Is Likely Done",real
'Public' as in 'airwaves' vs. 'public' as in 'performance',real
Are Supremes changing the mobile landscape?,real
"iPod Touch Price Cut $100, Hinting iWatch Release Date Coming Soon?",real
"Apple Updated The iPod Touch, Lowering The Price And Adding New Colors",real
"YouTube stars create communities, not fans",real
GM once again suspends sales of the Chevrolet Cruze,real
Neanderthals ate vegetables too,real
Live video: Chrysler unveils new Ram Truck vehicle,real
Here's What It Looks Like When Google Enacts Europe's New 'Right To Be  ...,real
Google begins wiping Europe search results over 'right to be forgotten' ruling,real
Alps says no complaints from GM over ignition switches,real
"With Google's Android One, expect sub-$100 phones from Micromax and others",real
Google announces Android One to revolutionize low-end smartphones,real
Google not killing Nexus line over Android Silver,real
Android Auto Debuts; Brings Google-Apple Battle into Your Car [w/Video],real
Which Cars Will Feature Android Auto And When?,real
Google Announces Sub- $100 Smartphone,real
Google Inc (GOOGL): Google I/O 2014 All One Needs to Know in Under 9 Minutes,real
"Google partners Micromax,others for sub-$100 smartphone by Oct",real
Who is David Muir? (Other than Diane Sawyer's new 'Evening News' replacement),real
Diane Sawyer stepping down as ABC anchor,real
Grammy-winner Collins donates artifacts to Alamo,real
Shia LaBeouf Arrested In New York For 'Disorderly Conduct' At Performance Of  ...,real
Police: Shia LaBeouf escorted out of Broadway theatre showing 'Cabaret' for  ...,real
Two Irish actors invited to join the Academy,real
"Sherri Shepherd to Leave ""The View"" After Seven Years",real
"Beyonce, Jay Z Unveil Wedding Video During On The Run Tour",real
They're On the Run! Beyoncé and Jay Z Kick Off Their Joint Tour in Miami,real
Watch Beyonce and Jay Z Play ''03 Bonnie and Clyde' for 'On the Run' Kick-Off,real
Will North Korea consider this blog an “act of war”?,real
North Korea calls US movie about plot to assassinate Kim Jung Un an “act of war”,real
Why 36 Avicii Fans Were Rushed to Hospital During Concert,real
Kevin Bacon joins Johnny Depp in 'Black Mass',real
Kim Kardashian flashes a lot of leg (and Spanx) in thigh-split dress as she  ...,real
Kim Kardashian Goes Back to Brunette ... and Shows Off Her Cleavage!,real
"Movie Review: ""Transformers: Age of Extinction"" (Rated PG-13)",real
5 questions for Transformers leader Optimus Prime,real
Watch: Red Letter Media Watches First 3 'Transformers' Movies At The Same  ...,real
Lindsay Lohan Debuting Theatrical Side in London Stage,real
Girl Meets World:Hammy reboot lacks charm,real
Kristen Stewart Dropped From Snow White & The Huntsman 2?,real
"Eli Wallach, always around: RIP",real
"RIP Eli Wallach (1915-2014): Watch Oscar Acceptance Speech, Career Profile  ...",real
'Star Wars' creator George Lucas' museum heading to Chicago (Report),real
Flu Vaccine Spray Better Than Shots for Young Kids,real
Indiana home care funding nearly doubled after Olmstead ruling; still lower than  ...,real
Report: Excessive drinking responsible for 1 in 10 adult deaths,real
CORRECTION number of Ebola confirmed deaths in Sierra Leone,real
Link between hypertension and vitamin D deficiency confirmed,real
SAAF awarded HIV mobile testing van,real
"Across the US, June 27 is National HIV Testing Day",real
New York City's Ban on Oversized Sodas is Dead,real
Appeals Court Kills NYC's Big Soda Ban,real
Summer meal programs feed hungry kids,real
Arts and crafts retailer Michaels begins trading below IPO price of $17,real
US Stocks Log Weekly Loss Despite Upbeat Friday,real
Rick Perry: Don't kill the Export-Import Bank; cites its impact on jobs,real
Argentina Bond Judge Says He Will Nullify BNY Payment,real
"UPDATE 4-Argentina deposits debt payment, but US court blocks payout",real
7 Things You Need To Know About The VIX,real
"BNP expected to plead guilty, pay nearly 9-billion-dollar fine",real
US named watchdog for BNP Paribas,real
"Crude Oil Vulnerable As Iraq Concerns Fade, Data To Catalyze Volatility",real
Mainland loans threaten HK banks: Moody's,real
"Jobs data in focus, American Apparel on death watch for the week ahead",real
Analysis: Barclays dark pool lawsuit raises technology and compliance questions,real
There are deliberate attempts to destabilise the banking system-Bulgaria's  ...,real
Steady job growth boosts consumer confidence,real
HP reportedly close to settling suits on Autonomy deal,real
AT&T equal to rival Verizon,real
Vegetables on the Menu For Neanderthals,real
Watch This Film About Why Aaron Swartz Matters More Than Ever,real
Android L's Material keyboard now available on Google Play [DOWNLOAD],real
"A test drive with Android Auto, a simple solution to clunky car software",real
"Google Nexus 5, Nexus 7: Download and Install Android 4.5/5.0 Lollipop",real
Android L Developer Preview – first look,real
LG G Watch vs Samsung Galaxy Gear Live: Which Is Better?,real
Asus to Launch Sub-$150 Android Wear Smartwatch This September: Report,real
Lawyers Weigh In On Supreme Court's Aereo Ruling,real
"Aereo CEO: We're disappointed in the outcome, but our work is not done",real
'Operation Dry Water' will crack down on boating and drinking,real
Corps of Engineers ramping up for Operation Dry Water 2014—concentrated  ...,real
"GM issues 3 more recalls covering 474000 vehicles - WBOC-TV 16, Delmarvas  ...",real
Shanghai GM recalls 194107 Excelle GT vehicles,real
Google starts deleting some search results at users' request,real
Renault-Nissan and Daimler Expand Cooperation with New Plant in Mexico,real
'The Leftovers' Is a Promising Show You Shouldn't Watch Right Away,real
The Awe-Inspiring Bleakness of HBO's 'The Leftovers',real
"Where Is the Cast of ""Boy Meets World"" Now?",real
Official: Lindsay Lohan to Make West End Debut in SPEED-THE-PLOW,real
Beyoncé and Jay Z Give Inside Look at 'On the Run Tour',real
Keeping Up With The Kardashians cancelled? Kim Kardashian unveils video  ...,real
Rob Kardashian drug and sizzurp fears,real
French Montana Bought Khloé Kardashian $35000 Worth of Jewels — Which  ...,real
The Kardashian clan party in NYC,real
Kris Jenner: Khloe Kardashian Is Just Friends With French Montana (VIDEO),real
"Movie review: Money, not talent, drives fourth 'Transformers' movie",real
Mark Wahlberg - Mark Wahlberg Was 'Absolutely Miserable' On The Gambler Diet,real
More than meets the eye,real
Actress Amy Adams Gives Her 1st Class Seat To US Soldier,real
Actress Amy Adams gives first-class seat to soldier,real
Rolling Stone Ronnie Wood today expressed his...,real
"AP Drama WriterJune 26, 2014 Updated 14 minutes ago",real
Zach Braff and Lena Dunham among the celebrities to mock Shia LaBeouf on  ...,real
Lena Dunham mocks Shia LaBeouf's theatre meltdown,real
Seth MacFarlane To Pledge Up To $1 Million To 'Reading Rainbow',real
Seth MacFarlane boosts 'Reading Rainbow',real
"The View Reportedly Firing Jenny McCarthy, Sherri Shepherd",real
"Mary Rodgers, author of 'Freaky Friday,' dies at 83",real
Excessive drinking causes 10% of deaths among working-age adults,real
FDA approves long-delayed inhalable insulin drug Afrezza from MannKind,real
FDA Approves Robotic Exoskeleton For Sale In US,real
Hiding victims of ebola is now illegal in Sierra Leone,real
"'Be ready' for Ebola outbreak's spread, WHO warns West African nations",real
IKEA and 7 others that pay above minimum wage,real
Argentinean Vice-president Meets Official Agenda in Cuba,real
AAA Predicts July 4 Travel Will Be Highest in 7 Years,real
"You're paying more for gasoline, and here's why",real
Why the Stock Market Dropped After Bullard's Interest Rate Forecast,real
Stocks Notch Tiny Gains to End Week,real
US 'Flash Boys' Style Lawsuit Slashes £2.5bn Off Barclays' Stock Value,real
US West Coast Port Workers Will Be Off Contract Starting Tuesday - Expect  ...,real
UN pledges to help Kenya combat terrorism,real
Breathing Easier? Satellites Show The Air Down Here On Earth Is Cleaner Than  ...,real
It's Time for Android Wear Smartwatches: 3 Things to Know,real
Google Points Its Search Engine Inside Apps,real
"After dismal first quarter, rosy outlook emerging",real
Ex-P&G head to lead Veterans Affairs,real
Rise of asset managers may create new risks: BIS report,real
"Quicken, Citizens 30 Year Mortgage Rate Deals Today Jun 29, 2014",real
"Short Week, Jobs Data May Bring Back Market Swings",real
Dollar General CEO to step down next year,real
Amazon gives away 30 apps worth $100. You only have until today to download.,real
"NASA showcases big drop in air pollution over DC, I-95 corridor since 2005",real
NASA launches test flight of flying saucer craft for future manned mission to Mars,real
Texas racer hospitalized after Hill Climb wreck,real
Facebook Rigs News Feeds to Study Your Emotions,real
Report: Facebook Secretly Manipulated Newsfeed to Measure User Emotions,real
"Microsoft's Surface Pro 3 Comes Close, But Can't Win Over Its Critics",real
"Amateur radio operators gather in Factoryville to practice, teach",real
Radio operators plan annual field day,real
Ham radio operators to hold weekend event,real
"Recalls bring the company's total for the year to 48, covering more than 20  ...",real
YouTube Now Features 60 FPS Playback and a 'Tip Jar',real
"YouTube Announces Crowdfunding, Donations, Free Music",real
Google Releases Stand Alone “Email” App for Android,real
DIGITAL LIFE Verizon Lights Up Its XLTE Tech in 300 Markets,real
All the Places You Can Buy a New iPhone 5s for Under $100,real
"Amy Adams gives first-class airline seat to soldier, sits in coach, passenger says",real
From 'Lost' to The Rapture,real
Liza Minnelli's rep sends Shia LaBeouf 'Cabaret' DVD,real
"Jay Z, Beyonce show Justin Bieber's mugshot during Miami concert",real
"Crowds gather in the rain to see Jay-Z, Beyonce perform",real
Transformers: Age of Extinction Review,real
Transformers: Age of Extinction Has Biggest Opening Weekend of the Year,real
"Glastonbury 2014, Sunday: as it happened",real
Twitterati hail Dolly's Glastonbury performance,real
Metallica called hundreds of fans onstage at Glastonbury,real
"What Time, Date and Channel Are BET Awards 2014? When And Where To  ...",real
"Khloe Kardashian gets diamond ring, jeep from French Montana",real
Kim Kardashian Steals the Spotlight in Plunging Dress at Khloe's 30th Birthday  ...,real
Chris Brown Performs 'Loyal' In Surprise BET Awards Performance,real
Lil Wayne Rocks into 'Believe Me' at 2014 BET Awards,real
Ex-teen model drops third Hollywood suit,real
"Rick Ross Arrested Following North Carolina Concert, Released",real
Sherri Shepherd and Jenny McCarthy Get the Boot From The View,real
"Sherri Shepherd Leaving 'The View,' Jenny McCarthy Confirms Exit",real
N. Korea preparing to indict 2 American tourists,real
Breaking News: Bobby Womack Dead At 70,real
Clashes kill 21 Iraqi troops south of Baghdad,real
WOMAD star Bobby Womack dies,real
Zendaya NOT Playing Aaliyah In Lifetime Movie,real
Just married! Olivia Palermo makes a beautiful bride as she weds Johannes  ...,real
Actor Meshach Taylor dies at 67,real
"Kelly Osbourne Shows Off New Head Tattoo: ""Sorry Mum And Dad But I Love It""",real
"Gvernor says plan to boost HIV testing, treatment will end epidemic in New York  ...",real
"Despite ridicule, Egypt pushes ahead with AIDS, hepatitis 'cure'",real
Low-dose aspirin use may decrease risk of pancreatic cancer,real
Pistorius trial to resume after evaluation,real
Pests not scared off by cold weather of last winter,real
TreeHouse Foods to Buy Flagstone Foods for $860 Million,real
UPDATE 1-US pending home sales hit eight-month high in May,real
"Dow, S&P 500 edge up with tech shares; DuPont drags",real
New York's top court OKs local bans on hydraulic fracturing,real
Philips to spin off lighting components business,real
Acreage Report Could Be a Shocker,real
Listen to the World's Central Bank,real
Eurozone's money supply and private credit slightly improved in May,real
"Dot Hill Joins Russell 3000, Russell 2000, and Russell Global Indexes",real
PPG rolls up Comex for $2.3B,real
EU approves state aid for Bulgarian banks as lender targeted,real
Bulgaria arrests 5 amid efforts to stop run on banks,real
Money in the Bank 2014: John Cena wins WWE World Heavyweight Title in  ...,real
WWE Money In The Bank: WWE World Heavyweight Title Ladder Match,real
WWE News: Major SummerSlam Storyline And Match Pushed Back,real
"Backstage News On John Cena Possibly Winning The WWE Title, JBL & Cole  ...",real
WWE Spoilers: SummerSlam 2014 Poster Possibly Reveals Money in the Bank  ...,real
Ohio gas prices drop as Fourth of July approaches,real
NASA CO2 Satellite Set To Launch,real
Report: Microsoft shoveling more dirt onto Windows 8.1 with 'Threshold',real
App Folders are Finally Coming to Windows Phone,real
You are here! Home > SCIENCE and TECHNOLOGY > Iconic Emperor penguins  ...,real
Samsung Galaxy Note 4 launch draws closer as phablet enters mass production  ...,real
Samsung Galaxy Core Mini 4G G3568V ready to hit China market,real
Galaxy Note 4 And Galaxy S6: What Will Samsung Deliver?,real
Samsung Galaxy Tab 2 7.0 vs. Samsung Galaxy Tab 3 7.0 – Comparison of  ...,real
Samsung Galaxy Tab S US pre-orders start Tuesday,real
Samsung Galaxy Note 3 Unlock Method Detailed,real
UK Cinemas Ban Google Glass,real
Facebook 'manipulated' 700k users' News Feeds during 'psychology experiment',real
Facebook May Have Secretly Messed with Your Head for Science,real
Internet outraged by Facebooks creepy mood experiment - KCTV5,real
How does Facebook decide what to show in my news feed?,real
Facebook manipulated users' emotions in secret study,real
On topic: Tech news to know now,real
NASA successfully test flies a Flying Saucer like spacecraft for future Mars  ...,real
NASA Launches 'Flying Saucer' to Test Mars Landing Tech (Video),real
US Feds probe Nissan Versa cars,real
"Google Gets Down to Business with Android Work, Cloud Drive for Work",real
Android Wear watches pre-order starts,real
Could Android TV be Google's Television Trump Card?,real
Monday Movie Memo: Michael Bay Needs To Give Up Transformers,real
Check out Transformers: Age of Extinction's New Cars,real
It's all white on the night for Nicola,real
Inside that Eric-Jason 'True Blood' sex dream you can't stop watching,real
BET Awards: Hits and a Lionel Richie miss,real
'I just felt dead': Rolf Harris's victims forced to relive ordeal,real
Rolf Harris has been found guilty of 12 counts of indecent assault,real
"Rolf Harris, 84, found guilty of indecently assaulting four girls",real
Over 100000 People Attend 44th Annual Pride Parade in San Francisco,real
Gay pride parades across the US draw huge crowds,real
Robert Downey Jr. Issues Statement on Son's Arrest for Cocaine Possession,real
Karrueche Tran Reportedly 'Annoying' Chris Brown,real
Mark Ruffalo blames Ben Affleck for ending his friendship with Jennifer Garner,real
Is Nicki Minaj vs. Iggy Azalea the new rap feud?,real
Beat it like Lionel Richie and Pharell Williams,real
Celebrity Deathmatch: Nicki Minaj Vs. Iggy Azalea,real
7 things you missed at the BETs,real
Robin Thicke Debuts Emotional Ballad 'Forever Love' At The BET Awards,real
Robin Thicke 'cries' on stage at BET Awards during performance,real
"Olivia Palermo Got Married in a Sweater and Shorts, Basically",real
"Beyonce is world's most powerful celebrity, magazine says",real
So Long Oprah Winfrey! Beyonce Crowned World's Most Powerful Celebrity,real
Zendaya On Leaving Aaliyah Biopic: 'It Wasn't A Good Choice For Me',real
Watch Erykah Badu Try to Steal a Kiss on the NYC News,real
Pix11 Reporter Mario Diaz Stiff Arms Erykah Badu,real
Rock Bottom! Shia LaBeouf Checks Into Rehab After Drunken NYC Arrest - Report,real
Shia LaBeouf Arrested After Wild Weekend,real
'It's a bunch of wrinkly old men trying to relive their youth and make a lot of  ...,real
"Cuomo: Boost Testing, Treatment to End HIV Crisis",real
Fogging Set After Mosquitos Test Positive for West Nile Virus,real
"Pistorius Was Not Mentally Ill at Time of Shooting, Psychiatrists Report",real
Double amputee Oscar Pistorius is mentally fit to stand trial for the murder of his  ...,real
Oscar screams hard to analyse - expert,real
In pictures: Battling Ebola in West Africa,real
"Fertility treatment outcomes 'dependent on sperm quality, not age of donor'",real
Inhaled insulin approved in US,real
Lancaster County company hails contraception decision,real
Eurozone inflation stays weak at 0.5% in June: Eurostat,real
"PRECIOUS-Gold near 2-1/2 month top; softer dollar, fund inflows boost appeal",real
Is the Deck Stacked Against Caesars Entertainment Shareholders?,real
European Markets Up; Data in Focus,real
Manufacturing PMI for June underlines need for tight Budget,real
Posted by Parvez Jabri,real
BNP insists it's business as usual after record fine,real
Sullivan & Cromwell acts for BNP Paribas for record $9bn sanctions fine,real
France says BNP-US deal preserves bank's future,real
France's Sapin: BNP Paribas Accord With US Lifts Uncertainty,real
Morgan Stanley stockbrokers finally given freedom to tweet,real
Japan business confidence sags in June quarter,real
Dollar Falls to One-Month Low Versus Euro as Krone Slides,real
FAA will miss drone deadline,real
American Apparel rejected Charney's request for meeting,real
GM recalls 7.6M more cars as costs balloon,real
"New GM Recall announced after 7 crashes, 8 injuries and 3 deaths",real
GM recalls another 8.23m cars as deaths linked to faults climb to 16,real
"Lost without your smartphone? Almost half the country is, too",real
Microsoft Sues To Seize Domains Responsible For Millions Of Infections,real
US Supreme Court rejects Google appeal,real
AAA: Michigan gasolione prices 40 cents above year-ago level,real
Samsung Galaxy S5 Marvel Superhero Bundle Coming?,real
4.5-Inch Samsung Galaxy S5 Mini Arrives,real
"Samsung Launches Compact, Stylish Galaxy S5 mini Smartphone",real
"Galaxy Note 4 Samsung Release Date 2014 Update, Specs, Upgraded Camera  ...",real
Facebook stirs controversy after admitting to conducting study on emotional impact,real
A closer look at Facebook's experiment with its users' emotions,real
Why Facebook has been experimenting on you behind your back,real
Facebook Study & Experiment: Users Upset After Researchers Alter News Feeds  ...,real
Twitter Names Goldman Sachs Exec to CFO Post,real
Market overview: IMF warns on Russian capital outflows,real
Oil Holds Above $112 After Strong Chinese Data,real
US Manufacturing PMI Little Changed at 55.3 in June--ISM,real
S.African metal strike disrupts work at Eskom -building firm,real
Employers urge Numsa to abandon strike,real
"Actinium Joins Russell 3000®, Russell 2000®, Russell Global, and Russell  ...",real
Goldman Sachs Upgrades Netflix (NFLX) to Buy; Sees 34% Upside,real
US imposes record fine on French bank in diplomatic sanctions violation,real
BNP Paribas to pay record fine for sanctions violations,real
Tiny elephant shrew is smallest of its kind,real
California Launch Of NASA Carbon-Monitoring Satellite Delayed Until 3 PM  ...,real
Samsung Unveils the Galaxy S5 Mini Smartphone,real
Triceratops Horn Evolution: a Million Year Process,real
Road tripping for the 4th of July? Better save money this week,real
Facebook Mood Study: The Facts,real
General Motors Recalling Another 8.45 Million Vehicles,real
Russian Hacking Group Targets European and US Oil and Gas Companies,real
Graco recalls buckles used on 1.9 million infant car seats,real
Microsoft launches Lumia 930 and Lumia 635 4G smartphones with a affordable  ...,real
Foursquare app for Windows Phone blocked to download for some Lumia 1520  ...,real
"Community Gets a 6th Season, and the Cast Rejoices on Twitter",real
The article requested cannot be found! Please refresh your browser or go back  ...,real
Yahoo saves Community for a sixth season,real
"Los Angeles authorities say the 20-year-old son of actor Robert Downey, Jr. is  ...",real
Indio Downey: Robert Downey Jr.'s Son…,real
"Susan Sarandon Wore Prosthetic Cankles for Tammy, and They Were Liberating",real
Liza Minnelli's publicist sends LaBeouf DVD copy of Cabaret,real
Shia LaBeouf Reportedly Checks Into Rehab Following His Arrest In New York  ...,real
Jessie J Announces Collaboration With Ariana Grande and Nicki Minaj,real
New Adam Richman Show Postponed After Instagram Tirade,real
"'Once' director scores 'Again' with musical optimism, restraint",real
Cameron Diaz on 'Sex Tape' nudity: 'You see everything',real
Pippa Middleton's Famous Bottom: Kate's Sister Insists Bridesmaid's Dress  ...,real
SEBASTIAN SHAKESPEARE: Duchess of Cambridge's parents cashing in on  ...,real
