Botox-maker Allergan rejects takeover bid from Valeant,real
Allergan Rejects Valeant's Unsolicited Takeover Proposal,real
"$50B AT&T, DirecTV deal nearly done, sources say",real
Report: AT&T Readying Acquisiton of DirecTV for $50 Billion,real
WSJ: AT&T/DirecTV deal could be announced in two weeks,real
Gas prices drop more than 5¢ in the past week,real
The history of Beats Electronics: from inception to Apple,real
Dr. Dre May Become Hip-Hop's First Billionaire,real
Billboard: Beats founders Jimmy Iovine and Dr. Dre could become Apple execs,real
Apple Likely to Keep Beats Hardware a Separate Brand,real
XP end of support: 17% of British PCs still run Windows XP,real
Microsoft to fix two critical bugs this Patch Tuesday,real
General Motors In-Vehicle Wireless Prices,real
Moto E India launch: First look and picture gallery,real
Motorola Moto G with LTE and microSD goes official,real
Entry-Level Moto E Phone Has Sharp Screen and Water-Resistant Body,real
More rumours emerge over Motorola's Moto E as images appear,real
"Another Moto E render leaks, this time showing the handset in white",real
Sony Xperia T2 Ultra vs Motorola Moto X - Specs and Price Comparison,real
India based online retailer Flipkart teases the upcoming Motorola Moto E; launch  ...,real
What Motorola is going to Launch at May 13 Event? Is its Moto E?,real
Moto G Cinema name pops up Motorola's website,real
"Moto E name confirmed through import shipment, along with low price",real
"Motorola Moto E spotted on Indian import website, confirms sub-Rs 10000 price  ...",real
BlackBerry launches low-cost handset,real
BlackBerry fights back with cut-price Z3 smartphone,real
BlackBerry plans comeback with Indonesian phone,real
Climate Change Chatter: Science and Politics,real
Rubio says he's ready to become first Hispanic US president,real
Brzezinski Mocks Scarborough's 'Long Road' to Defend Rubio's Climate Change  ...,real
Marco Rubio: “I do not believe that human activity is causing these dramatic  ...,real
Climate change threat to infrastructures in Qatar,real
Wandering Oregon wolf may have a mate,real
Facebook removes Poke and Camera apps from stores,real
'Unstoppable' glacial collapse in west Antarctica will lead to metres rise in global  ...,real
"Antarctic glaciers melting ""unstoppable:"" study",real
Loss of West Antarctic glaciers 'have passed the point of no return',real
NASA Research Indicates Antarctic Glaciers Melting Past Point of No Return,real
'Past The Point Of No Return:' An Antarctic Ice Sheet's Slow Collapse,real
Rep. Carol Shea-Porter: Washington must enforce equal Internet speeds for all,real
Tom Wheeler Revising His Net Neutrality Plans... But Not Actually Fixing Them,real
Cadillac CTS-V Coupe special edition,real
Office for iPad apps have been downloaded 27 million times in 46 days,real
Twitter Adding Mute Button for Unwanted Posts,real
Twitter Is Adding an Option to 'Mute' People,real
Twitter update brings mute feature to official Android app,real
New Twitter Mute Button Hides People From Your Feed,real
MUSIC NEWS: STREAM COLDPLAY'S 'GHOST STORIES',real
Bella Thorne Talks Boyfriend Tristan Klier In Seventeen Magazine,real
Neighbors' grabs North American box office top spot,real
How Seth Rogen Became the Stoner King of Comedy,real
First Look: Eminem Apologizes To His Mom In Spike Lee-Directed Video For  ...,real
"'Castle' spoilers, season 7 news: A glitch threatens the big wedding for Beckett",real
"'Mad Men' Review: ""The Runaways""",real
Miley Cyrus date rape joke goes down like a lead balloon at GAY,real
"Miley Curses Liam Hemsworth For Breaking Her Heart, Poses With Giant  ...",real
Miley Cyrus Makes A Date Rape Joke On Stage! Not Funny!,real
WATCH: Miley Cyrus cracking date rape joke,real
Jennifer Esposito takes aim at a mystery ex in explosive new memoir,real
"Bradley Cooper a 'master manipulator,' says ex Jennifer Esposito",real
Misha Defonseca: Author who made up Holocaust memoir ordered to repay  ...,real
Michael Jackson's back from the dead. Again.,real
Michael Jackson to Get SiriusXM Channel Focusing on Solo Career,real
NOTHING TO SEE HERE,real
Watch The Moment Jay-Z Is Led AWAY From Solange's Car After Met Ball,real
Beyoncé And Jay-Z Relax At Basketball Game After Solange Attack Video Leaks,real
Solange Was In A 'Vicious Mood' At Met Ball Ahead Of Jay Z Elevator Fight  ...,real
After THAT Jay Z and Solange fight - Beyonce's sister deletes family Instagram  ...,real
Leaked video shows Jay Z getting attacked in elevator by Beyonce's sister,real
Beyonce's sister attacked Jay Z at the Met Gala after-party in New York City last  ...,real
#WhatJayZSaidToSolange: Twitter reacts,real
Top 10 #WhatJayZSaidToSolange tweets,real
"The Standard Releases Statement Regarding Jay Z, Solange Altercation",real
Fox ready to air 'Batman' prequel,real
'Brooklyn Nine-Nine' and 'Mulaney' bring FOX's Sunday back where it started,real
Fox Plays Up 'Eventizing' in Upfront,real
24: Live Another Day: “1:00 PM—2:00 PM”,real
Batman v Superman director Snyder teases glimpse of new Batmobile,real
2016 Batmobile teased,real
'Batman vs. Superman' Batmobile (PHOTO): Zack Snyder Teases Ben Affleck's  ...,real
Zack Snyder reveals new Batmobile from Batman vs. Superman,real
Optimus Prime Rides Grimlock Into Battle in New Poster for Transformers: Age of  ...,real
Community Creator Gives Fans Hope For Life After NBC! Find Out Why He's Not  ...,real
Why a Community resurrection is extraordinarily unlikely—though not impossible,real
'Alien' designer HR Giger dies at 74,real
'Alien' creator HR Giger dies at 74,real
"Lea Michele, Cory Monteith Tribute: Actress Remembers His Birthday On Twitter  ...",real
Dancing With The Stars: Semi Final Shocker As An Olympian Is Voted Off,real
Dancing with the Stars Recap: Charlie Eliminated on Semi-Finals Night (5/12/14),real
Meryl Davis Dancing With the Stars Viennese Waltz Video 5/12/14 #DWTS  ...,real
"'Game of Thrones' recap | Tyrion goes on trial, and we like him when he's angry",real
"Review: Game of Thrones — 'The Laws of Gods and Men' (s4, e6) (Includes first  ...",real
"13.05.2014 10:48 - 3,3 million people die worldwide due to use of alcohol",real
WHO calls on governments to do more to prevent alcohol-related deaths and  ...,real
Risk of Car Crash Increases Drastically during Second Trimester of Pregnancy  ...,real
"Pregnant Women More Likely to be in Car Crashes, Study Finds",real
Mild Shock Can Induce Lucid Dreaming,real
CDC confirms 2nd mers case in US,real
US confirms second case of lethal MERS virus,real
Second U.S. case of deadly MERS virus found in Orlando area,real
Fried foods and obesity,real
E-cigs getting snuffed out?,real
Resveratrol benefits in red wine a 'myth',real
'No benefit' from red wine ingredient,real
"New study says red wine, chocolate aren't a health booster",real
Solvents linked to memory and thinking problems,real
Samsung Chairman Stable After Surgery Following Heart Attack,real
Lee Kun Hee Was Catalyst For Growth Of Samsung Group,real
Samsung Electronics Chairman Stable After Heart Attack,real
Samsung chairman Lee Kun Hee stable after surgery for heart attack,real
McAuliffe Asks Board to Review Abortion Clinic Regulations,real
SAC Capital's Michael Steinberg Faces Six Years Jail Time,real
SAC's Steinberg gets 3-1/2 years prison for insider trading,real
Switzerland to vote on world's highest minimum wage,real
AAA: Americans ready to travel,real
AAA expects Memorial Day travel increase,real
More people expected to travel this Memorial Day,real
"Sulzberger: Abramson ouster about management, not unequal pay",real
Why people get tattoos of their employer's logo,real
Does the New York Times Know How to Fire Someone?,real
Is There a “Right to Be Forgotten”?,real
Was the New York Times' firing of Jill Abramson sexist?,real
Making college education affordable,real
More Than 3000 Chinese Nationals Evacuated From Vietnam: State Media,real
China's Achilles' Heel in the South China Sea,real
Violence subsides in Vietnam after anti-China rioting,real
"Filipino, Vietnamese protesters demand China leave South China Sea areas  ...",real
Protests erupt after Philippines accuses China of building secret military base on  ...,real
Cyprus finance minister says lenders anticipate shallower recession in 2014,real
Here's Exactly Why Pinterest Is Worth Its $5 Billion Valuation,real
Social bulletin board Pinterest raises $200M with a $5B valuation (updated),real
Who'll miss a Red Lobster?,real
"Darden to sell Red Lobster, focus on Olive Garden",real
"Reader feedback May 17: Pizza deliver driver robbed, Red Lobster, LPGA  ...",real
More Cheddar: Red Lobster Sold For $2.1 Billion,real
The Red Lobster Chain is Worth Two Billion Dollars,real
Darden Defies Hedge Funds With Red Lobster Sale Plan,real
Red Lobster sold to Golden Gate Capital for $2.1B,real
What Thomas Piketty Got Wrong,real
Why Democrats Are Paying Attention to Piketty's Book on Inequality,real
"TrueCar raises $70 million in IPO, shares rise 12% after trading debut",real
TrueCar Announces Pricing of Initial Public Offering,real
Gold down on positive US economic data,real
Today's Gold per ounce price spot gold per gram spot silver rate close review  ...,real
Weather hurts Wal-Mart in 1Q,real
Markets take a beating as stocks end in the red,real
Walmart earnings fail disheartens traders,real
"US Stock Futures Near Flat After Drop in Jobless, Higher Consumer Spending",real
Wal-Mart Q1 Profit Down - Quick Facts,real
Report: AT&T will announce it's buying DirecTV,real
JC Penney sees jump in sales,real
JCPenney's sales went up,real
JC Penney sales rebound,real
"JC Penney quarterly sales rise 6.3%, shares surge",real
J.C. Penney: What To Expect From The Quarter (JCP),real
Vince McMahon loses $350 million in one day; no longer a billionaire,real
Vince McMahon Changing His Mind On WWE Creative Causing Troubles,real
WWE Is Taking a Beating—And Not the Fake for TV Kind of Beating,real
WWE Programming Stays With NBC Universal,real
WWE and NBCUniversal Close to Signing a New Deal,real
Sued over disapearing iMessage texts by Apple,real
Google Improves iOS Now App,real
This single screenshot shows why iOS is years behind Android in usability,real
The 'right to be forgotten' explained,real
Google fielding 'take-down requests' after European privacy ruling,real
Actor 'Asks Google To Pull Teen Affair Results',real
European Court of Justice issues judgment on right to erasure under EU data  ...,real
Report lists top 5 people who would want the 'right to be forgotten',real
Google EU Antitrust Decision Expected After Summer Break,real
German Regulator Says Google Promises 'Right to be Forgotten' Mechanism in  ...,real
European court lets users erase records on web,real
"Apple, Google Make Peace, Drop Lawsuits",real
"Apple and Motorola settle patent battle, agree to work on patent reform",real
"Apple, Google settle one of the highest-profile lawsuits in technology",real
"Apple, Google Agree To End All Smartphone Patent Battles",real
Apple and Google drop lawsuits to focus on patent reform,real
Hyundai Recalls Tucson SUV Models,real
'World's largest dinosaur' discovered in Argentina,real
Is this the largest dinosaur to have existed?,real
Paleontologists in Argentina discover largest dinosaur bones,real
4 Reasons Texting 911 Might be a Mistake,real
911 officials: Text messaging coming soon,real
Now You Can Text 911*,real
A 911 text? Elkhart County emergency dispatchers are ready for typed calls for  ...,real
Titanfall Expedition DLC Release Update: Now Available for Xbox One; Xbox  ...,real
Prepare for Titanfall on your mobile: official companion app out now,real
Mario Kart 8,real
Google buys Word Lens app maker to improve Google Translate,real
"Word Lens Translator Team Joining Google, Offers Free Language Packs For A  ...",real
Adidas teases with new 'Photo Print' app; takes sneaker customization to another  ...,real
Microsoft accidentally outs Surface Pro 3 ahead of May 20 launch?,real
Test for Satya Nadella as he touts Microsoft's new Surface tablets,real
Surface Pro 3 and Surface Mini release set for next week?,real
New specialty store opening today at Jordan Creek,real
Google I/O 2014 schedule is now available,real
"NASA's Curiosity Mars rover finishes drilling task at Windjana, resumes mission  ...",real
Curiosity GOUGES AND SCORCHES Mars with drill and laser,real
Whatever happened to the Apple deal for Beats?,real
Apples Massive Beats Deal Reportedly Delayed,real
Dr. Dre's 'First Billionaire in Hip – Hop' Facebook Post Strengthens Possibility of  ...,real
Jupiter's Great Red Spot has shrunk to its smallest size yet,real
"The Red Spot Of Jupiter Is Shrinking, Say's NASA",real
Hubble Sees Jupiter's Red Spot Shrink to Smallest Size Ever,real
Halo 5: Guardians officially announced,real
Halo HD Collection Is Rumored To Be Coming to Xbox One,real
343 Industries Announces Halo 5: Guardians for Xbox One,real
"Microsoft unveils 'Halo 5: Guardians,' out in 2015",real
Halo 5 Guardians Will Be the Xbox One's Maiden Halo,real
Halo 5: Guardians Set for 2015,real
Cannes: Man Dives Under Ugly Betty Star's Skirt,real
"America Ferrara opens up about red carpet ambush: 'It felt like a crazy, weird  ...",real
Man dragged away after bizarre dive under actress at Cannes,real
'Twin Peaks' Fanatics: Massive 10-Disc Blu-Ray Set Will Make All Your Dreams  ...,real
Grey's Anatomy Season 10 Episode 24: Live Streaming Information of Finale Show,real
Contra Costa Times,real
Sandra Oh Open to Returning for 'Grey's Anatomy' Series Finale,real
"'Grey's Anatomy' season 10, episode 24 airs tonight: Cristina says goodbye",real
"Sarah Silverman, Bill Hader And Judd Apatow Now Writing For Chipotle!",real
Chipotle One Ups Starbucks Cup Art: Features Stories by 10 Remarkable  ...,real
Revenge comedy wins hearts at Cannes,real
NYT editor's firing 'nothing to with gender' says publisher Sulzberger,real
"Jill Abramson brought a lawyer to a salary fight, and other reasons why the  ...",real
Obama says victims' self-sacrifice is legacy of Sept. 11,real
Here Are Some Of The Poignant Artifacts On Display At The New 9/11 Memorial  ...,real
Bearing witness to evil: The National September 11 Memorial & Museum,real
"Artifacts large, small highlight museum dedicated to Sept. 11",real
"September 11 Memorial Museum dedicated, open to family and first responders",real
The 9/11 Museum Dedication -- A Profile of Two Unsung Heroes of 9/11,real
Star Wars: Episode VII has Officially Started Filming,real
STAR WARS release first official image from the set!,real
"'Star Wars Episode VII' Begins Filming, First Photo Shared By J.J. Abrams",real
Here We Go: 'Star Wars Episode VII' Kicks Off Filming at Pinewood,real
Oscar Isaac: 'JJ Abram's Approach to Star Wars: Episode VII Is Refreshing',real
Original 'Star Wars' Actor Tells New Movie to Take a Hike: It'll Just Bore Me,real
"“Orphan Black” Recap: Sex, Guns, and Needles, Oh My",real
Footage of FDR walking unveiled in Pa.,real
"Rare footage shows FDR walking at 1937 All-Star game, dispelling, experts say  ...",real
Sherri Shepherd's Ex Rules for Our Marriage: 1) DON'T GET FAT,real
"Salma Hayek stands out at Cannes with dress, message to free Nigerian girls",real
Andy Samberg Teases 'SNL' Return,real
Oprah Winfrey says farewell to Barbara Walters: 'You're the reason I wanted to  ...,real
How Barbara Walters Got a Reputation for Making People Cry,real
Oprah Winfrey and Hillary Rodham Clinton help TV host Barbara Walters say  ...,real
Hillary Clinton Joins Barbara Walters as She Bids Farewell,real
Best and worst advice Barbara Walters gave Kevin Newman,real
"Oprah, others help Barbara Walters say farewell",real
Dawes draws big Friday afternoon crowd to Hangout Fest main stage,real
Festival Blast – The Hangout Fest 2014,real
Arcade Fire 'We Exist': Andrew Garfield plays trans woman in new video,real
arcade fire tour 2014,real
Video For Arcade Fire's 'We Exist' Stars Andrew Garfield. In A Bra [Video],real
Solange & Jay Z Elevator Video Gets Audio Courtesy of 'SNL'!,real
Scientists Record Breakthrough In Cancer Cure,real
Measles vaccine cures cancer,real
Massive dose of measles virus kills cancer cells,real
Altered Measles Vaccine Cures Cancer,real
Life expectancy 80 years plus,real
Japan's women enjoy top life expectancy,real
"Life expectancy rises in poor nations, UN reports",real
Meds and Movement: My Breast Cancer Treatment Plan,real
Sperm Abnormalities may Increase Mortality Risk in Men,real
America's health care divide deepens as the coverage gap in red states grows,real
Kidney dialysis drug could stall HIV progression,real
"Using internet, apps to manage blood pressure has dangers, study says",real
"Third MERS case surfaces in the US, no cure found yet",real
MERS virus infects another in Illinois,real
CDC: Man who met MERS patient has virus,real
Brazil faces dengue threat during FIFA world cup,real
U of U researchers studying stem cells inadvertently cure mice of paralysis,real
Stem Cell Therapy Shows Promise For MS In Mouse Model,real
Emerging Pharmaceutical Technologies - Stem cells,real
And Now The Bad News: Red Wine Is Not Great For Health After All,real
"VIRAL VIDEO: EMT busts move, while on the move",real
Time to Stop the War on Inequality,real
Kraft recalling 1.2 million cases of cottage cheese products,real
WWE: WTF Went Wrong?,real
"Vietnam stops anti-China protests after riots, China evacuates workers",real
"Overall situation in Vietnam stabilizing, sources say",real
"Chinese flee Vietnam as tensions, unrest grow",real
Over 3000 Chinese Flee Vietnam Due to Violence,real
"More than 3000 Chinese evacuated from Vietnam after violence, China state  ...",real
Home builders most pessimistic in a year,real
Report: Uber Is Gunning For A $10 Billion Valuation With A Big New Investment  ...,real
"After A Rough Winter, We're Ready To Hit The Road",real
"Nobel winner tells Pfizer: give us firm promises, and for 10 years",real
Find your own investment benchmark,real
Warren Buffett's 10 Most Valuable Stock Positions,real
Auto interiors company to be created by joint venture between Wisconsin  ...,real
"AT&T, DirecTV To Approve Deal to Merge -T, DTV",real
Pinterest Valued at $5 Billion in Financing Round,real
Facebook developing video-chat app to rival Snapchat: FT,real
FTC says Snapchat deceived customers,real
SpaceX Dragon returns to Earth from space station (Update),real
Edmond wrong on global warming,real
Google says could take several weeks to honour people's requests to be 'forgotten',real
Sony PlayStation 4 outsells Microsoft Xbox One for fourth straight month,real
"Including Kinect was 'the right call,' says Microsoft exec",real
Bestselling Console of PS4 In April,real
Xbox One and Xbox 360 sales for April revealed,real
April NPD: Xbox One still in second as price drop looms,real
"Xbox One, PlayStation 4 are big energy users",real
Microsoft Completes Its 180 And Drops Kinect From Xbox One,real
Flappy Bird Return Date! Creator Confirms Multiplayer Version For August Plus  ...,real
Texas should worry about Antarctica,real
Health TechZone Week in Review,real
Google Glass gets new leader as company hires marketing expert,real
Meet The Woman Google Hired To Save Google Glass,real
Google Glass Becomes Part of UC Irvine Medical School,real
Google Brings Glass to US for $1500,real
How octopuses don't tie themselves into knots,real
Why don't octopuses tie themselves in knots? Scientists make shock discovery,real
Camelopardalid Meteor Shower Date and When to Watch: Rare Cosmic Event to  ...,real
Scientists Have Discovered The World's Biggest Dinosaur In Argentina,real
Fossils of 'Titanosaur' in Argentina bigger than 13 African elephants,real
"AT&T relaunches Cricket as nationwide brand with new smartphones, plans, and  ...",real
Apple and Google settle patent war on smartphone OS platforms,real
"Jay Z and Beyonce Release Epic, Violent New Short Film For 'On the Run' Tour",real
Beyoncé and Jay Z star in fake movie trailer to promote On The Run Tour,real
Beyonce and sister all smiles in Instagram pic following infamous elevator fight,real
Jay Z and Beyonce Tease Star-Packed Action Film 'Run',real
"Jay Z And Solange Incident Spoofed On ""Saturday Night Live""",real
Beyonc&eacute; and Solange photographed for the first time since video leak,real
Virus-hit Sir Paul cancels concert,real
Paul McCartney nixes two more Tokyo shows,real
Sum 41 Star Deryck Whibley Posts Pics From Hospital Bed After Nearly Dying  ...,real
Deryck Whibley blames month-long hospital stay on heavy drinking,real
TV BAFTAs 2014: Olivia Colman breaks down in tears as she is awarded Best  ...,real
"Doctor Who: Radio Times BAFTA Audience Award a ""really special moment for  ...",real
Caroline Flack leads gothic and sexy theme in stunning floor-length dress on TV  ...,real
"Backstage at BAFTA: Graham Norton on buses, awards and lots of wine",real
Rare footage of FDR walking emerges capturing his 'brave struggle',real
James Franco refuses to be part of `Spring Breakers` movie sequel,real
Cannes Competition blog: The Homesman gets a warm welcome,real
As I Lay Dying singer Tim Lambesis jailed for six years for trying to hire hitman to  ...,real
As I Lay Dying's Tim Lambesis sentenced for murder-for-hire plot,real
Bachelorette 2014 Spoilers: Does Andi Dorfman Get Engaged in the Finale?,real
What You Need to Know About Andi's Bachelorette Suitors,real
"Schwarzenegger, Stallone, and Gibson lead charge of action heroes from  ...",real
5SOS are total rockstars on the Billboard Music Awards red carpet - FIT PICS,real
LIVE! Be First On The Billboard Music Awards Red Carpet,real
"Katy Perry, Robin Thicke - and Jackson hologram? - set for Billboard Music  ...",real
Billboard Music Awards' Most Memorable Fashion Moments,real
Jimmy Fallon And Maya Rudolph Improvise Characters Based On Unfortunate  ...,real
"After Box Office Success, Warner Bros. and Legendary Pictures Moving Ahead  ...",real
'Godzilla 2′ In Development,real
'Godzilla' opens with smashing $93.2M - FOX Carolina 21,real
"CANNES WATCH: Hilary brilliant, Our Girls campaign gets more attention on  ...",real
Pamela Anderson reveals sex abuse,real
Pamela Anderson Reveals She Was 'Molested From Age Six' And 'Gang Raped  ...,real
'Girls Gone Wild' founder booked on assault charge,real
"Kim Kardashian, Kanye West arrives in Paris for wedding",real
Kim Kardashian's grey Lanvin wedding gown in Vogue a hug hit! (see pics),real
"FDA: Pet treats kill dogs, make at least 3 people sick",real
Mosquito Season,real
Saudi Arabia's $16 billion religious tourism at risk with Mers outbreak,real
"US Confirmed Third Case of MERS, CDC Says It's a Man From Illinois",real
"Hookah use may expose users to carcinogens, nicotine",real
Is too much exercise bad for your health?,real
"Deals of the Day: DirecTV Says Yes, AstraZeneca Says No",real
AT&T Buying DirecTV for $48.5B (T),real
AT&T Makes It Official – Will Buy DirecTV For $48.5 billion,real
AT&T agrees to purchase DirecTV in $48.5B deal,real
AT&T Strikes Deal for DirecTV Acquisition for $48.5 Billion,real
AT&T makes bet on video with $48.5 bln DirecTV bid,real
NON-STICKONOMICS The economy is getting sticky in Teflon Thailand,real
Billionaire has untreatable cancer,real
"Stocks flat after lower open; Pfizer gains, AT&T slides",real
U.S. stock futures edge lower Monday to start week,real
Pre-Market: Google Will Buy Twitch for $1 Billion; AstraZeneca Rejects Pfizer's  ...,real
Cable 'keeping options open' about AstraZeneca future,real
AstraZeneca board rejects new offer from Pfizer in a day,real
Sweden pans Pfizer bid for AstraZeneca,real
AstraZeneca Rejects Pfizer's Latest $119B Offer,real
Deutsche Bank sees 'tectonic plate shift' in banking,real
AstraZeneca weighs on Europe shares as it rejects Pfizer bid,real
Deutsche Bank taps investors for €8bn,real
Turkey prosecutor: 3 face charges in mine disaster,real
BBC Turkey mistakes women's identities in Soma blunder,real
Turkey mine bosses arrested after disaster,real
"Yahoo Japan Corp.'s share price down, cancels its offer for the acquisition of  ...",real
Kraft Recalls 1.2M Cases of Cottage Cheese Over Refrigeration Fears,real
Hong Kong stocks finish flat,real
Commodities report – May 19,real
AAA says 1.3 million Ohioans will travel for long Memorial Day holiday weekend,real
The ECB Has Three Interest Rates It Could Cut,real
Completing the single market in capital,real
Samsung says it's got 1.8 million active Knox users,real
"Verizon To Boost 4G LTE Using AWS Spectrum Under A New Brand Name, XLTE",real
Facebook Gears Up to Develop VideoChat App Slingshot Report,real
Facebook to release Snapchat-style video messaging app?,real
Facebook developing Snapchat video-chat rival: report,real
Ailing Kepler telescope cleared for new duty,real
Surface Pro 3 details begin to flow,real
RUBIK'S CUBE INVENTION: Google celebrates toy puzzle's 40th anniversary  ...,real
How to solve the Google Doodle Rubik's Cube,real
Procrastination warning: today's Google doodle is a functioning Rubick's Cube,real
Rubik's Cube: Google creates Doodle to mark 40th birthday of brain teasing puzzle,real
Average Gas Prices Fall 1.5 Cents in PA,real
"US Gas Prices Drop 3.5 Cents, May Continue To Drop",real
Is Level 3 Communications Ready to Move to the Next Level?,real
World's Largest Dinosaur Discovered in Argentina,real
"Paleontologists Discover Fossil Remains of World's Biggest Creature, Titanosaur",real
Police in 40 Michigan counties boosting seat belt enforcement,real
"Turning Light into Matter, Ending an 80-Year Quest",real
"Apple, Samsung Close To Deal That Would Stop Patent Infringement Lawsuits",real
