"Apple unaffected by Heartbleed, adds to sites patched list",real
Feds issue warning: Hackers trying to exploit 'Heartbleed' bug,real
"Social Media Today: FTC OKs Facebook Acquisition, New Twitter Alerts",real
WhatsApp and Facebook's Deal confirmed by FTC,real
"FTC warns Facebook to maintain WhatsApp privacy standards - Sir, yes sir!",real
US warns Facebook on privacy in WhatsApp mega deal (Update),real
There's Less To Oculus Than Meets The Eye,real
"Look in the mirror and be very, very afraid",real
Movie review: Scary 'Oculus' will make you avoid mirrors,real
"Too often, Oculus simply reflects the scare tactics of better movies",real
"The Weekend Warrior: Rio 2, Oculus, Draft Day",real
Football flick Draft Day gains yards but doesn't win,real
Sports movie champ Costner steps up for 'Draft Day',real
Draft Day Review: Trouble with the End Zone,real
"Movie reviews: 'Draft Day,' 'Rio 2'",real
"Watch Nirvana Play With Lorde, St. Vincent, Kim Gordon, Joan Jett at the Rock  ...",real
"Rock and Roll Hall of Fame Celebrates Nirvana with Lorde, St. Vincent, Kim  ...",real
Lorde and Joan Jett Jam With Nirvana at Rock Hall Ceremony,real
"Nirvana, Hall and Oates and more inducted by Rock and Roll Hall of Fame",real
Nirvana gets an incredible Rock and Roll Hall of Fame induction,real
"J Mascis, St Vincent and more join Nirvana for tiny Brooklyn show",real
"Nirvana perform with Lorde, Joan Jett, St Vincent - watch",real
It's a Mad Men world: Stylish drama returns for its seventh season on Sunday,real
Move Over Don Draper! The Simpsons Get A Mad Men Makeover For Their  ...,real
'Mad Men' Where They Were: Peggy Olson,real
"Mad Men creator faces the end, and its challenges",real
'Divergent' Trilogy Finale 'Allegiant' Will Be Split Into Two Films,real
"Adrian Mole's final diary left unfinished, publisher says",real
Michael Billington on Sue Townsend: 'Plays poured out of her',real
Adrian Mole was in the great British literary tradition of comic failure,real
"Drake Wears Disguise, Interviews Pedestrians About Drake on Jimmy Kimmel Live",real
Drake Goes Undercover To Ask General Public Their Opinion Of Him,real
VIDEO: Selena Gomez Splits With Manager Parents,real
'Grown up' Selena Gomez 'fires' parents as managers,real
Selena Gomez to Parents: You're Fired!,real
Paul Walker dead: Fast & Furious actor to receive tribute at the MTV Movie  ...,real
Hemsworth up for 'shirtless' MTV award,real
"Just Seen It Celebrates the MTV Movie Awards with a Look Back at the 80s, the  ...",real
Woody Allen's First Foray Into Musical Theater: Bullets Over Broadway,real
'Bullets over Broadway': Musical of mobsters and old standards,real
Debbie Rowe To 'Launch Legal Battle For Custody Of Michael Jackson Children  ...,real
"Guardians of the Galaxy Movie Cast, Characters, and News Update: Chris Pratt  ...",real
"Miley Cyrus Has Gotten A Haircut While Topless, Shares Throwback Pic",real
Miley Cyrus to Appear on the May Cover of Seventeen Magazine with a Photo  ...,real
John Hancock erroneously graces Louis-Dreyfus backside,real
Ireland's wedding-singer priest an Internet hit 'Frozen' tops Billboard chart for 4th  ...,real
Julia Louis-Dreyfus' Rolling Stone cover called out for historical inaccuracy  ...,real
'Rio 2' dazzling but overloaded,real
"Rio 2 - reviewed by a 7 year old (OK, her dad really)",real
'Rio 2' a gorgeous but muddled sequel,real
"Review: Amid 'Rio 2's' cacophony, the musical numbers shine",real
Birds are back in dazzling but overloaded 'Rio 2',real
"First movie studios, now record labels sue Kim Dotcom",real
'Girl Meets World' Trailer Released: Meet Daughter Riley (VIDEO),real
Girl Meets World: The First Trailer Is Online,real
"Stephen Colbert 'Only Logical Successor' for Letterman, Leslie Moonves Says",real
Stephen Colbert Is Replacing David Letterman And Twitter Just Exploded,real
Who Should Be Stephen Colbert's Bandleader?,real
How Late-Night Hosts Reacted to Colbert's 'Late Show' Gig,real
"“Stephen Colbert” is dead, long live Stephen Colbert!",real
Why Rush Limbaugh isn't very happy with Stephen Colbert's new gig,real
"Watch OutKast, Pharrell & More LIVE From Coachella This Weekend From The  ...",real
Frank Ocean Is Almost Done With New Album; May Skip Coachella To Complete It,real
Frank Ocean's second album is almost done,real
Coachella 2014 Adds Pixies and Julian Casablancas To Lineup,real
Heading to Coachella this weekend? Set times have been released!,real
Battle over Mickey Rooney's burial place,real
Ted Cruz: Democrats pushed Kathleen Sebelius out,real
Sebelius steps down as HHS secretary,real
"HHS Sebelius Resigns, to be Replaced by Budget Office Head Burwell",real
Barack Obama names Sylvia Burwell as US health secretary to fix Obamacare  ...,real
Medicare by the Numbers,real
Menendez Campaign Contributor Tops List of Medicare's Top-Paid Doctors,real
Fla. eye doctor received almost $21 million from Medicare,real
340 Texas doctors among Medicare's millionaires,real
Top-paid Medicare docs defend practices,real
Top-paid Medicare doctors said they had reasons,real
Nearly 4000 doctors got more than $1 million from Medicare in 2012,real
Women thank doctors after lab-grown vagina implants are big success,real
You can now grow vaginas in a lab,real
Lab-Grown Vaginal Organ Successfully Implanted on Four Women,real
Americans look past calories as approach to dieting evolves; major brands feel  ...,real
Princess Cruises 'Crown Princess' outbreak tops 150,real
Crown Princess cruise ship with sick passengers arrives in San Diego,real
"Spring allergies linked to some food allergies, specialist says",real
"Today's Biotech Stocks to Watch: AbbVie Inc., Enanta Pharmaceuticals Inc. and  ...",real
$84000 For A 12-Week Treatment? Pharma Trade Group Defends Hepatitis  ...,real
Merck hepatitis C drugs shine in easier to treat patients,real
Math may help whittle away jet lag,real
'Jet lag app' to help travellers adjust body clocks,real
Ebola Outbreak Update: Some Virus Patients in Western Africa Are Recovering,real
Nigeria is in Danger: Health Minister Raises Alert on Ebola Virus,real
Ebola outbreak most challenging ever seen by WHO,real
How women can help men spot symptoms of prostate cancer,real
Spinal Cord Stimulator Moves Limbs That Were Paralyzed for Years,real
Paralyzed Men Move Their Legs Again After Spinal Implant,real
UK wasted millions on ineffective flu drug,real
Researchers raise questions about flu drugs,real
What the Tamiflu saga tells us about drug trials and big pharma,real
UK's £560m Flu Drug Stockpile's Effectiveness Slammed,real
Drugs 'were waste which are given for swine flu,real
Pandemic flu: was the Tamiflu stockpile a waste of money?,real
Excessive benzene found in Lanzhou tap water,real
"Stock plunge continues, Nasdaq drops below 4000",real
Damage assessment: Nasdaq down 8.2% from 2014 high,real
US Stock Futures Suggest Weak Opening After Thursday's Rout; Day's Moves  ...,real
Last-minute tax tips,real
Why taxpayers procrastinate,real
Business Highlights,real
Beyond azodicarbonamide: Other ingredients removed from foods,real
"Family Dollar to close 370 stores, cut prices on 1000 items",real
Crews now grading land for Family Dollar store in Axton,real
Dollar Stabilizes After Rough Week,real
US dollar slides against euro,real
"Canadian Dollar Lower, Consolidating After Gains on Wednesday",real
CANADA FX DEBT-C$ at nearly 3-month high after Fed minutes,real
IAC Buys Back 10% Stake in Mobile Dating App Tinder,real
Ohio geologists link small quakes to fracking,real
Earthquakes prompt tougher horizontal drilling standards,real
Technology stocks falling for 2nd day in a row,real
JPMorgan Earnings Fall Short of Expectations,real
Wall Street sees bad end to even worse week,real
US producer prices rise 0.5% in March,real
US Producer Prices Post Largest Gain In Nine Months,real
Report: Spirit most complained about US airline,real
49ers QB took to Twitter Friday to say reports of 'incident' were completely false.,real
49ers Quarterback Colin Kaepernick Subject of Miami PD Investigation of  ...,real
49ers star QB Colin Kaepernick under investigation for sexual assault,real
Kaepernick defends himself on social media,real
Fitch raises outlook on Portugal's debt rating,real
I've Got Issues: Digital is a Carefree Way to Enjoy Comics,real
Amazon Buys Digital Comic Book Seller ComiXology,real
Why Amazon is paying employees $5000 to quit,real
Prime Takeaways From Amazon's Annual Shareholder Letter,real
Walmart's organic push could alter California agriculture,real
VIDEO: Herbalife Being Investigated by DoJ and FBI: FT,real
"Herbalife Ltd. Is Focus Of FBI, DOJ Investigation, Shares Crash [REPORT]",real
Coldwater Creek plans liquidation sales before Mother's Day,real
Coldwater Creek to close stores,real
Wells Fargo to Provide $75MM DIP Loan to Coldwater Creek,real
Mailbox 1.0 for Android,real
Dropbox Offering New Photo Storage Features,real
Google and Apple to be targeted by Dropbox apps,real
Drew Houston on Dropbox: 'We are going after something really big',real
Dropbox launches photo and video app called Carousel,real
"Dropbox Announces Private Beta of Mailbox for Mac, Launches Mailbox for  ...",real
Gear Fit first impressions and device compatibility,real
"Samsung launches Galaxy S5, new wearables in 125 nations worldwide",real
Early impressions: Samsung Gear Fit,real
"Samsung Galaxy S5 Google Play edition: so, ummmm… where is it?",real
Samsung's New Flagship Galaxy S5 A Biometric Beast,real
"Review: S5 features useful, less about gimmicks",real
"Samsung Galaxy 5, wearables launched in 125 countries worldwide",real
TELUS: The New HTC One M8 Now Available!,real
Google Glass to go on sale to anyone for one day in the US,real
Google to open sales of Glass to a bigger pool of consumers,real
Google Glass is going to be sold to the public on April 15th,real
2014 Jeep Cherokee Real-World Cargo Space,real
The growing importance of NASA's Commercial Crew Program,real
Facebook Reveals 1900 Requests To Spy On Users For Criminal Cases,real
UK agencies in more than 1900 Facebook data requests,real
US warns business about 'heartbleed' computer bug,real
Networking systems also gets affected by Heartbleed bug,real
"Hackers may be using Heartbleed bug, US warns",real
Tech companies need to up their game on internet security,real
Looks like maybe the NSA did know about Heartbleed ...,real
Obama administration denies knowing about Heartbleed before this month,real
"That Terrible, No Good, Horrible Internet Security Flaw You've been Hearing  ...",real
For US holiday season Amazon smartphone will be ready,real
Amazon to unveil smartphone in time for winter holidays,real
Amazon Is (Not Very) Despondent After Fire TV Sells Out,real
Companies sharing cybersecurity data not to be prosecuted: US,real
2015 Corvette Z06 Convertible Unveiled Ahead of NYIAS,real
2014 New York Auto Show: New Chevy Corvette Stingray Variant Confirmed,real
Actress Sues New York Pharmacy Over Photo,real
Katherine Heigl Sues Pharmacy Chain Duane Reade… for a Tweet!,real
Is Katherine Heigl's Lawsuit The Most Bizarrely Written Thing in History?,real
"'Fargo,' a new FX miniseries not really based on the movie, debuts Tuesday",real
Adrian Mole creator dead,real
Best-selling author of the Secret Diary of Adrian Mole Sue Townsend has died  ...,real
'It's a Small World' turns 50,real
Miley Cyrus posts topless photo (again),real
The family members of late actor MICKEY ROONEY have settled their dispute  ...,real
Lamar Odom Reportedly Making 'Desperate Calls' To Khloe Kardashian Amid  ...,real
"Khloe Kardashian: Denying Lamar Odom, Declining ""Desperate"" Phone Calls!",real
Has Khloe Kardashian finally moved on from Lamar Odom? Star snapped with  ...,real
The Amazing Spider-Man 2 Stars Hit Paris For Premiere [PHOTOS],real
The Amazing Spider-Man 2: Post-Credits Secret Cameo Finally Solved,real
Emma Stone's Yellow 'Amazing Spider-Man 2' Versace Dress Is Iconic (PHOTOS),real
Emma Stone dazzles at the Spider-Man 2 premiere,real
"Andrew Garfield discusses spandex and says he feels ""pretty much naked"" at  ...",real
Andrew Garfield stole his Spider-man costume,real
Depp's Transcendence a dose of AI Film sounds goofy but could be a sleeper,real
Johnny Depp Finally Explains Why He Wears Fiancee's Engagement Ring,real
'Oculus' Scares Off Kevin Costner Football Flick 'Draft Day' At Box Office,real
"Film Review: 'Draft Day' is Daft, Except as an NFL Infomercial",real
'Draft Day': By the Numbers,real
"Liberals Are Miserable Creatures, NY Times 'Draft Day' Review Edition",real
STAGE TUBE: MURDER FOR TWO Welcomes BULLETS OVER BROADWAY!,real
Church Services,real
St. John's schedules Holy Week events,real
Trinity Church in Waltham offers Holy Week services,real
"Religion news: April 10, 2014",real
Northampton town centre church opening its doors for Easter shoppers,real
Pastor Defrocked for Gay Wedding Speaks at Local Church,real
"Jesse Winchester, singer-songwriter who dodged US draft, dies at 69",real
Question of the Day,real
Coachella 'Reflects' Artist Phillip K. Smith's Work,real
"Coachella 2014 Line Up: Shop Festival Fashions Like Vanessa Hudgens, Katy  ...",real
COACHELLA 2014: DJ and producer Gareth Emery ready to 'Drive',real
Selena under the influence,real
MTV Movie Awards To Reunite 'Mean Girls' Cast: Report,real
Tori Spelling's Husband Dean McDermott Comes Clean About Cheating  ...,real
Colbert right person to do Late Show: O'Brien,real
Comic signs five-year Late Show deal,real
Stephen Colbert: 7 Great Replacements Comedy Central Should Consider,real
Golden Parachutes: Why it's bad business,real
New Study Says Eating at Restaurants Doubles Your Chance of Food Poisoning,real
More illnesses aboard Princess cruise ship,real
Scientists Have Successfully Grown and Implanted Vaginas in Four Women,real
Tamiflu: Britain spent £424m on a drug that shortens bouts but is no cure,real
Salmonella outbreak linked to Foster Farms isn't over,real
"Tree, grass pollen peaking this week",real
"MERS sickens UAE paramedics, Jordanian, more Saudis",real
Dove 'Beauty Patches' Reveal Women Need Only A Small Push To Perceive  ...,real
Dove's Beauty Patch Experiment Wants You to Embrace What You Have,real
Men suffer from eating disorders too,real
Town marks World Autism Day,real
Austin Public Schools: April events raise awareness of autism,real
Study examines link between recalling alcohol brands in popular music and  ...,real
The state tax grab,real
Mario Draghi hedges on ECB's stimulus options,real
Toxic Debt Condemned in Crisis Heralded as Europe's Savior,real
"Ohio geologists link fracking, quakes",real
Social Climber: Amazon Offers Employees $5000 to Quit,real
Dollar Steadies After Solid U.S. Jobs Data,real
"Fees drain 401(k) plans, researchers warn",real
Merkel a 'believer' in Greece after tough reforms,real
EXTRA: Merkel: Greece to see more opportunities from reforms,real
"Merkel, in Athens, praises Greek reform progress - WVTM-TV: News, Weather  ...",real
Greece confirms return to markets with 5-year bond,real
Herbalife Stock Price & Chart: Diet Supplement Company Stock Drops Amid  ...,real
"US producer prices increase in March on gains for food, clothing, jewelry and  ...",real
Business Highlights,real
JPMorgan Chase Earnings Drop 18.5% on Trading and Mortgage Slowdown,real
Oil company blamed for toxic tap water in China: Xinhua,real
Jobless Claims at Lowest Level in 7 Years,real
jobless claims near seven-year low,real
Applications for unemployment aid hit 7-year low,real
Fewest Firings Since 2007 Mark U.S. Job-Market Gains,real
How can NASA put a two-story building on Mars? Its very own flying saucer.,real
Strange light on Mars.... Total eclipse next week....,real
"Blood Moon Tetrad April 15, 2014: When and Where to Watch [Live Stream  ...",real
Total Eclipse Of The Moon Next Week Throughout North America,real
"Blood Moon Rising, April 15",real
Marquez grabs pole at Austin GP,real
Marc Marquez in pole position for Grand Prix of the Americas,real
Motorcycling: Marquez dominates MotoGP practice,real
Austin MotoGP: Marquez 'Difficult to maintain this gap',real
MotoGP: Valentino Rossi ready for Austin title test,real
The Hunt For Marquez Continues As MotoGP Heads To Texas,real
BMW extends recall to half-million cars,real
BMW Extends Recall Over Engine Bolts,real
CRA: Site down for Heartbleed fix may soon return,real
NSA and White House deny knowing about — and exploiting — the Heartbleed  ...,real
"Sources: NSA Exploited Heartbleed Bug for Years, Exposing Consumers",real
Ice Age climate decoded from La Brea Tar Pits bee fossils,real
US warns Facebook on privacy in WhatsApp mega deal,real
ISS computer outage may prompt spacewalk,real
ISS computer outage could delay Monday's SpaceX rocket launch,real
Civilization: Beyond Earth Takes Us Back to The Stars,real
Twitter Revamp: 10 Things To Know,real
Twitters Revamp Continues With Interactive Pop Up Notifications,real
Twitter introduces web notifications,real
Hacker Weev Conviction Overturned Leaving the State Of Internet Security In  ...,real
Astral Beauty: Gravitational microlensing spots first Exomoon,real
Amazon may debut its smartphone later this year,real
Amazon's First Smartphone with 3D Display Pegged for June 2014 Release,real
Samsung Galaxy S3 vs Motorola Moto G – Price and Specs Comparison,real
"The week's biggest tech news in pictures: Galaxy S5, Twitter, Facebook",real
Grilled Cheese Day,real
President and First Lady See A Raisin in the Sun,real
Khloe and Kourtney Kardashian get cloud of confetti thrown at them by clown  ...,real
Johnny Depp Has Been Weirdly Subpoenaed To Prove A Woman Is Insane?!,real
Johnny Depp gets subpoena for murder trial at film premiere: report,real
"Women are funny, but not when crude, says Jerry Lewis",real
"Daily Wrap of All Things For Friday, April 11: Amazon, Captain America: Winter  ...",real
'Winter Soldier' intense,real
Review: 'Winter Soldier' might be coolest Marvel film so far,real
'Captain America' breaks boring streak,real
Captain America: The Winter Soldier #1 Movie In The World TV Spot Released,real
Why Batman vs. Superman vs. Captain America 3 Can Never Happen,real
"Warner Bros. Opening Batman vs. Superman A Week Earlier In The U.K., Not  ...",real
Agents of S.H.I.E.L.D. Ratings Hit A Series Low With Captain America: The  ...,real
Rio 2 leads the Easter charge with Captain America hot on its tail,real
'Captain America 3' Confirmed: What Does This Mean for Warner Bros.?,real
"Today in the News: 'Jesus' wife' papyrus is not a fake, experts say",real
"Researchers Believe the ""Gospel of Jesus' Wife"" to Be No More Fake Than Other  ...",real
Tori Spelling Breaks Down Over Dean McDermott's Infidelity: “I Can Never Give  ...,real
MOVIE REVIEW: 'Draft Day' more than a football movie,real
Storm Shield is a life-saving app that is like a NOAA Emergency Weather Radio  ...,real
'Divergent' film finale to be released in two parts,real
"'Allegiant,' the finale to 'Divergent,' will be split into two films",real
Summit Entertainment Announces Release Dates for Allegiant Part 1 & 2,real
Watch KISS Roll Back The Years As They Perform On 'The Tonight Show',real
Paul Stanley Claims Some KISS Bandmates Were Anti-Semitic,real
"VIDEO: O'Brien Promises Nudity, Fire At MTV Movie Awards",real
Watch Outkast's Coachella Performance,real
Coachella 2014: OutKast's reunion show not quite ready for prime time,real
Outkast Reunited at Coachella,real
"Coachella Music Festival 2014: OutKast Reunites, Rocks the Crowd",real
"OutKast Reunion To Celebrate 20th Anniversary Tour for Fans, Confirmed By  ...",real
Coachella 2014: Party it up with the desert's hottest events outside of the festival,real
Who is the real Stephen Colbert?,real
"Stephen Colbert hosting 'Late Show' raises questions, hope",real
Andrew Garfield says he was bullied at school,real
Emma Stone brings colour to premiere,real
Reports: There is No 'Amazing Spider-Man 2' Post-Credits Scene,real
Disturbing New Report Shows How America Really Treats Its Mentally Ill,real
Lawsuit: Lawrence Hospital failed to remove appendix of patient William  ...,real
Millions awarded to SD programs preventing tobacco product use,real
H5N1 Bird Flu Could Be 5 Mutations Away From Spreading Like The Seasonal Flu,real
Experimental Hepatitis Drugs Cures 95% During Clinical Trials,real
Govt 'may have wasted millions' on stockpiling Tamiflu,real
Lab-grown vaginas prove long-term success for four women born without one,real
Hepatitis A Outbreak Linked to Charlotte Pizza Shop,real
Last Minute Tax Tips,real
Last minute tax tips for Connecticut taxpayers,real
Lone Squirrel Does $300000 In Damage,real
Bank Earnings Reports: JPMorgan Chase Versus Wells Fargo,real
Oklahoma Agriculture,real
Osborne says critics proved 'wrong',real
Spirit Airlines racks up most complaints,real
ECB's Nowotny: Additional ECB Easing Steps 'Clearly Possible',real
Canadian Stocks Tumble for Second Day Amid Plunge in U.S.,real
Fruit Flies Evade Enemies like Fighter Jet,real
Pesky flies use fighter jet manoeuvres,real
Astronauts spot first possible 'exomoon',real
Meet the 'Titans of Twitter'!,real
UN global warming limits can be reached 'if CO2 emissions are cut by up to 70  ...,real
UN climate chief urges 'bold' carbon-curbing steps,real
We're Probably Doomed On Climate Because Developed Countries Can't Stop  ...,real
"Sony warns of battery issue in some Vaio laptops, says its non-removable  ...",real
Sony Warns Of Laptop Battery Issue,real
Marc Marquez on pole for second race of the year,real
Marquez Returns To Scene Of First MotoGP Victory,real
"LEAK: For One Day Only, Google Will Let Anyone Pay $1500 For Glass",real
Google Glass May Soon Be Sold to Normal People--But Just for One Day,real
Google Glass Explorer program will reportedly be opened up to everyone in the  ...,real
"Android phones, tablets vulnerable to Heartbleed bug",real
Don't Panic About Heartbleed but Have a Spring Clean Anyway (Op-Ed),real
NASA orders spacewalk to fix space station computer failure,real
'Cherry tree from space' amazes and baffles Japan,real
"Comcast, TWC face uphill battle to push merger through",real
Amazon to unveil smartphone in time for holidays: Report,real
"Get your cameras ready, first in series of rare 'blood moon' eclipses begins April 15",real
Lunar eclipse to occur Monday morning,real
Worldwide Wearable Computing Market Climbing to Nearly 112 Million in 2018  ...,real
Parker: Limbaugh not laughing over Colbert's comedy,real
"Another possible signal heard in Flight 370 search - WNCN: News, Weather",real
Search Digital Spy,real
Coachella 2014: Camping gets underway without issues,real
'Captain America: The Winter Solider': The Gun-Craziest Superhero Movie Ever,real
"Zooey, Taylor, Franco Crash Seth Rogen's SNL Monologue",real
"'SNL' Recap: The Few Highs, And Many Lows, Of Seth Rogen",real
Jewish faithful celebrate Passover on Grand Strand,real
Photos: 'Mad Men' is back,real
'Mad Men' premiere party: All you need are cocktails,real
7 Times Peggy Olson Stole the Show On 'Mad Men',real
'Mad Men' Is Celebrating Its Final Season With This Giant Glass Of Scotch In  ...,real
"Jennifer Lopez, 'Orange Is the New Black's' Laverne Cox Celebrated at GLAAD  ...",real
"Jerry Lewis says women are funny, but not when crude",real
Chris Martin Steps Out Without Wedding Ring,real
Chris Martin spotted without wedding band for first time since split from Gwyneth  ...,real
Gwyneth Paltrow Tried To Keep Marriage Breakdown 'Secret',real
There's a lot to be said for Gwyneth Paltrow's and Chris Martin's conciliatory  ...,real
"KISS, Nirvana, Hall and Oates inducted by Rock and Roll Hall of Fame",real
Latest Rock and Roll Hall of Fame Inductees Perform at Barclays Center,real
KISS inducted to Rock And Roll Hall Of Fame,real
Lorde Offers Nirvana Tribute at Rock and Roll Hall of Fame Induction (VIDEO),real
Cameron nervous as 'Avatar' scripts are finalised,real
James Cameron Reveals 'Avatar' Sequel Script Plans During Reddit AMA,real
From Backstreet Boy To Married Man: Nick Carter Weds Lauren Kitt,real
"The Science Of Lab-Grown Organs: Vaginas, Noses Now Possible",real
"Food Poisoning Most Often from Restaurant Visits, Study Finds",real
State-run oil firm blamed for water contamination in NW China,real
"Beef Prices Spiking High, Some Consumers Switching To Pork or Chicken",real
"As tax deadline approaches, chances of getting audited by IRS lowest in years",real
Amazon Offers Employees $5000 To Quit,real
"Pulaski Skyway project to be completed in 10 phases, extend through 2020",real
High-Frequency Traders Set for Curbs as EU Reins In Flash Boys,real
IMF Warns on Low Inflation,real
Dollar jumps against euro on prospects of ECB stimulus,real
Glencore Xstrata Sells Copper Mine to Chinese Consortium for $5.85 Bln,real
High-flying stocks come down to earth,real
Tax deadline Tuesday: 6 last-minute reminders for checking returns,real
Camp's Departure Creates Opening for Tax Reform,real
“IPCC report claims: No more excuses for funding coal and gas projects”,real
UN: Act fast on global warming to save planet - and money,real
"'Modest hope' to slow warming, but no 'free lunch,' U.N. warns",real
Fast action urged on global warming,real
"For Unproven Theory, Scientists Propose Unproven Solutions",real
Marquez wins in Texas to extend perfect start,real
2014 Austin MotoGP Results from Circuit of the Americas,real
First Titanfall DLC drops in May,real
Titanfall DLC Expedition coming with 3 exciting maps in May: Get ready for  ...,real
"Something to 'Like': Facebook cleans up News Feed of Like-baiting, spammy posts",real
NASA to grow more veggies in space,real
