"Fed official says weak data caused by weather, should not slow taper",real
UPDATE 1-ECB to reveal bad loan hurdles for euro zone bank test -sources,real
EBay Rejects Icahn Board Picks As Activist Strikes Again,real
McDonald's US sales continue to struggle in February,real
Stocks Down At Midday On Weak China Export Data,real
"U.S. futures mixed to lower, Chinese data weighs; Dow Jones down 0.09%",real
What the bull market has meant for Europe,real
Mt. Gox files for US bankruptcy,real
Bitcoin exchange Mt. Gox files for US bankruptcy,real
"Until bitcoin has oversight, it's a volatile uncertainty",real
Color of Money: Bitcoin trendy but too risky for most investors,real
Metro-North Worker From Yonkers Killed After Being Struck By Train,real
REVEALED: How Bill Ackman Has Been Lobbying To Bring Down A Company  ...,real
American dropped 14000 Feb. flights due to storms,real
Public transit boom,real
"10.7 Billion trips taken on transit in America last year, the most since 1956",real
"Oil sinks on weak Chinese data, end of heating season",real
Asian shares lower as China trade data sends dour signal,real
Burned To A Crisp: Sbarro Files For Bankruptcy (Again),real
Sbarro Files For Chapter 11 Bankruptcy,real
Ukraine Crisis: LNG Stocks in Focus,real
Polish PM: Germany's Dependence On Russian Gas Poses Risks For Europe,real
Eastern European countries paid much more for Russian gas than western ones,real
Oil falls to around $101 after China data,real
Chiquita Brands acquires Fyffes to create world's biggest banana seller,real
Fyffes and Chiquita are getting hitched,real
Share this on:,real
"World stocks, copper, oil dip after weak China export data",real
China learns not to rescue its lame ducks,real
HK: Shares in biggest loss in 5 weeks after anemic China data,real
"China's CSI300 index at near 9-mth low, Hong Kong sinks too",real
China's rising demand for expats,real
Titanfall Xbox One Launch: Microsoft Releases Critically Acclaimed First-Person  ...,real
Microsoft's Xbox Is on Its Last Life,real
Titanfall Xbox One May Be Bumped Up To 1080p With A Patch,real
Titanfall: Exact Timing When Players Can Start Playing Digital Copies Tonight,real
Titanfall: Best Places To Get One Upon Release,real
Real-life “Death Stars” deadlier than Darth Vader astronomers find,real
Elephants never forget... a human language,real
Bitcoin Exchange Mt. Gox Moves to Protect US Assets,real
Mt. Gox files for US bankruptcy to halt class...,real
American Honda Strengthens Auto Sales Division to Accelerate Sales Growth of  ...,real
iPhone 6 holographic projector phone concept video hits web,real
Google's Android boss announces SDK specifically geared toward wearables,real
Google wants Android to be your wearable OS of choice,real
"LG G3 vs Nexus 6 Release Date, Spec, Features Expected to Unveil by June  ...",real
Chromecast heading to the UK 'in weeks',real
"Chromecast Success Story: Sales In Millions, Set To Debut In International Markets",real
GM Picks Former Lehman Investigator Valukas for Recall Probe,real
GM and NHTSA Fail To Protect Public on Ignition Switch Fiasco,real
Former NHTSA Chief Rebukes General Motors,real
The Talker: 'Cosmos' makes its return,real
"Did ""Cosmos"" Pick the Wrong Hero?",real
5 great moments from Episode 1 of 'Cosmos',real
How to read an entire novel in just 90 minutes,real
Reading app helps readers to read 600 words per minute,real
"Apple releases iOS 7.1 update, complete with CarPlay",real
First Apple TV update for 2014 released,real
iOS 7.1 vs. iOS 7 keyboard changes,real
Apple Releases iOS 7.1 Update for iPad and iPhone,real
"iOS 7.1 is here, download it immediately",real
Apple TV 6.1 and Remote 4.2 Bring Welcome Interface Improvements,real
Business in Savannah in brief,real
"As Temps Rise, So Do Gas Prices",real
US Gasoline Declines to $3.294 a Gallon in Lundberg Survey,real
Edward Snowden Speaks,real
Snowden: Mass surveillance is backfiring on US efforts to combat terrorism,real
"At SXSW, Edward Snowden Offers Tips to Better Secure Your Small Business",real
NSA leaker Edward Snowden speaks via video at South By Southwest  ...,real
Edward Snowden Says He Would 'Absolutely' Do It Again,real
NSA Whistleblower Edward Snowden: Keep Their Hands Off Our Data,real
"Surveillance must become ""too expensive"" before we have privacy",real
Edward Snowden Streaming Live From South By Southwest [Watch It Here - Video],real
"'Celebrity' Zimmerman signs autographs at gun show; America, we have a  ...",real
Watch: a new trailer for Game of Thrones,real
Video: Secrets rule Westeros in new 'Games of Thrones' trailer,real
Game Of Thrones Season 4 Plot Direction And Details Revealed,real
New “Secrets” Trailer For Season 4 Of 'Game Of Thrones',real
Lindsay Lohan Docu-Series Debuts to Over 693000 Viewers on OWN,real
5 Candid Quotes from Lindsay Lohan's OWN Docu-Series: 'There's Nothing Left  ...,real
Here's Lindsay Lohan Chewing Out Multiple People on Her Reality Show,real
TV Review: 'Lindsay',real
"Fan arrested for breaking into Miley Cyrus' dressing room, leaving note and  ...",real
'Bachelor' Juan Pablo makes his final decision,real
BREAKING: Juan Pablo Galavis Doesn't Propose to Nikki Ferrell — Are You  ...,real
"THE BACHELOR AFTER THE FINAL ROSE: RECAP FOR MARCH 10, 2014",real
Juan Pablo Galavis upsets Clare Crawley with sexual comment,real
Juan Pablo Is the Worst Bachelor in History,real
Juan Pablo offers wedding song? 'The Bachelor' shares music with Clare Crawley,real
"'The Bachelor': Is Juan Pablo broke, being paid to propose? still close with ex?",real
"'The Bachelor' finale: Rumors on Juan Pablo Galavis, Sean Lowe, Catherine  ...",real
The Bachelor Finale: Who Should Juan Pablo Choose?,real
Huge 'The Bachelor' 2014 spoilers: Is Juan Pablo still with winner?,real
Bach Juan Pablo Recap 10: The Women Tell All (Through Super White Teeth),real
Edward Snowden speaks at SXSW conference,real
'Neighbors' Movie Shows Seth Rogen All Grown Up,real
High School Musical reunion Sorry Zac not now,real
"Stop Everything! Zac Efron Confesses He's ""100%"" Down For Another High  ...",real
Neighbors Review [SXSW 2014],real
House of Cards comes to Comcast,real
'True Detective' Creator Nic Pizzolatto Teases Saga Of Rust & Martin Could  ...,real
"Glitches Spoil ""True Detective"" Finale Online",real
Which Pulpy Genre Should True Detective Plunder for Season Two?,real
True Detective Creator Says Season 2 Will Stay Strange,real
True Detective Finale: A Happy Ending?,real
Lena Dunham admits molestation joke was off-colour,real
"#etiquette: Lena Dunham tweeted an offensive joke, then deleted it. Good call or  ...",real
"Lena Dunham makes molestation joke, apologizes and adds 'women can have a  ...",real
Lena Dunham gets butt naked to spoof Girls on Saturday Night Live - WATCH,real
"Lena Dunham got naked on SNL, was a hit",real
Lena Dunham Gets Nude for Her 'Saturday Night Live' Hosting Gig,real
SXSW's hottest young apps... and Neil Young's start-up,real
Neil Young's PonoMusic Player Announces Pre-Order Date,real
Neil Young's PonoMusic Launching Kickstarter Campaign At SXSW,real
SXSW: Jon Favreau On Swapping Iron Man For 'Food Porn' In His New Movie Chef,real
"At SXSW, Favreau serves up satisfying 'Chef'",real
Justin Bieber and Selena Gomez grind to John Legend - WATCH,real
Romantic Justin Bieber Dedicates 'As Long as You Love Me' to Selena Gomez in  ...,real
"Justin Bieber Stands By Video Deposition Kiss-Off, 'We All Have A Right To  ...",real
Justin Bieber (Kind Of ) Explains Why He Was Acting Out in His Deposition Video,real
Video: Check out Justin Bieber's belligerent deposition,real
WATCH: The REAL Justin Bieber,real
Stacy Keibler Got Married to Not George Clooney,real
Stacy Keibler marries Jared Pobre in Mexico,real
Stacy Keibler marries Jared Pobre in an intimate beach ceremony in Mexico,real
Stacy Keibler Wedding 2014 - George Clooney's Ex Marries Jared Pobre,real
Taylor Swift named music's top money maker,real
Taylor Swift tops Bilboard's highest-paid musicians list of 2013,real
"Prince Harry and Cressida Bonas to Get Engaged in 2014, Oddsmakers Predict",real
Britain is betting on another royal wedding,real
Recap: NBC The Voice Season 6 – Blind Auditions Night 5 + Videos,real
Josh Kaufman Sings on The Voice 2014 Season 6 Blind Auditions (VIDEO),real
"Miley Cyrus 'a scapegoat,' says Kylie",real
Miley Cyrus performed in nothing but underwear during her Bangerz concert,real
"Miley Cyrus Adds ""Motor Boating"" To Her Outrageous Onstage Concert Repertoire",real
CloudFlare's Female Cofounder On How She Helped Build A Billion-Dollar Tech  ...,real
The 7 Most Ridiculous Things About The New Ban Bossy Campaign,real
Sandberg and Chávez Respond to 'Bossy' Critics,real
"Let's ALL Join Beyonce and Jennifer Garner In Banning the Word ""Bossy""",real
"Beyoncé, Jennifer Garner and Victoria Beckham want to ban 'bossy' - VIDEO",real
I was bossy. Here's why that's a big problem.,real
Parents Pay More Attention To Phones Than Kids During Meals (STUDY),real
"Smartphones can Negatively Affect Parenting Skills, Study Reports",real
Local mom pushes for medical marijuana,real
J.C. Penney Shares Rally as Citi Ups Retailer to 'Buy',real
Help locate the missing Malaysia Airlines plane using the wisdom of crowds,real
"Chrysler Recalls 25000 Jeep Grand Cherokee, Dodge Durango SUVs",real
Libyan parliament ousts the prime minister in a vote of confidence | The Republic,real
Libya threatens to bomb N.Korean tanker if it ships oil from rebel port,real
Unicredit posts 14 bn euro loss for 2013,real
What Colorado's Recreational Marijuana Tax Revenue Means for Massachusetts,real
Colorado Makes $3.5-Million In January Pot Revenue,real
Bill to legalize marijuana in Missouri moves ahead in House,real
Colorado gets $2.1 million profit after first month of cannabis sales,real
Colorado reaps millions from pot sales,real
AEO: American Eagle Outfitters Sinks on Disappointing Sales,real
"S&P 500 Fluctuates Near High as Investors Weigh Economy, Ukraine",real
4 Important Takeaways from Urban Outfitters Earnings Release,real
US stocks inch down amid worry over China's sluggish growth,real
Asia growth worries cause stocks to decline,real
International markets roundup,real
Bank of England Destroys Tapes of Meetings After Minutes Published,real
"Interest rate rise will not be delayed by general election, says Mark Carney",real
Carney: RBS might have to leave independent Scotland,real
RBS Could Move HQ to England if Scotland Joins EU,real
What Role Did the BOE Play in Alleged FX Rigging?,real
Bank of England reveals concern about strength of sterling,real
PIMCO Trustee Blasts Bill Gross' $200 Million Salary,real
"Fannie Mae, Freddie Mac Would Be Eliminated in Senate Bill",real
Housing Recovery Expected to Press,real
Why Fairholme Is Likely To Win Discovery In Fannie Mae Case,real
Jefferson Co. Republicans launch campaign to win black voters,real
Is Comcast Building the Next Magic Kingdom?,real
"Job Openings in the US Increased in January, Hiring Declined",real
OECD: Growth in advanced economies gains momentum - WBOC-TV 16  ...,real
Virtu Filing Shines Light on High-Frequency Trading,real
Dick's Sporting Goods Inc. (DKS) Releases Q1 Earnings Guidance,real
Men's Wearhouse Ties Deal,real
Men's Wearhouse and Tux,real
"Will this Bid of Men's Wearhouse (NYSE:MW) Rally Stock after Merger, Clean  ...",real
Jos. A. Bank to Be Bought by Men's Wearhouse,real
SoftBank CEO Son: US mobile broadband industry needs more competition,real
"T-Mobile: further industry consolidation isn't a question of if, but when",real
Stock futures ease lower; Congress to probe GM recall; Japanese bank eyes  ...,real
"Sprint CFO: The sky isn't falling, management is working with SoftBank's Son",real
"Twitter goes down, and then rebounds",real
"Fox's 'Cosmos' isn't an affront to religion, it's divine confirmation of faith (Edward  ...",real
What Does Neil deGrasse Tyson's 'Cosmos' Say About Religion?,real
Flappy Bird creator says he's considering letting the bird loose again,real
Flappy birds creator says the game may return soon,real
What the creators of Flappy Bird and Bitcoin are teaching us about online media,real
US Federal Prosecutors open criminal probe of GM recall,real
US House committee investigating GM recall,real
GM ignition-switch recall poses first big test for new CEO,real
UberConference Launches Google Docs Add-on,real
Google's New Apps Referral Program Offers $15 For Successful Sign-Ups,real
Titanfall launch hindered by Xbox Live sign-in issues,real
Huge Titanfall update could bring 1080p gameplay,real
Heat Develops Major Ad Launch For EA's Titanfall,real
How Much of a Boost Will `Titanfall' Give Xbox?,real
Titanfall Released; Will It Revive Xbox One Sales?,real
"Twitch, Titanfall Release: Package Out On Microsoft Xbox One",real
LivePlay: TitanFall & Xbox One Twitch App,real
Twitch broadcasting now live on Xbox One,real
Titanfall “Free the Frontier” live-action teaser arrives,real
Xbox One Twitch broadcasting update hits tonight,real
The Titanfall Day 1 Update Is 840 MB Big,real
Australian Research Finds Rising Temperatures More Damaging to Antarctica  ...,real
DIVERGENT Stars Shailene Woodley & Theo James to Share Clip on 2014  ...,real
"'Divergent': IMAX screening March 19 with Jai Courtney, Neil Burger",real
Grant Gustin: 'The Flash' Full Costume!,real
The CW's THE FLASH Adds Another Comic Book Character To Cast,real
'The Flash' Costume: See Grant Gustin's Full Outfit Ready for CW Super Speed!,real
Keith Richards Is Writing a Children's Book,real
"Photograph by: Chris Pizzello , Chris Pizzello/Invision/AP",real
Will Russell Crowe's biblical epic Noah sink with audiences?,real
Emma Watson Reveals New 'Noah' Trailer,real
"Bahrain cinema bosses back the big ban on ""Noah""",real
Taylor Swift is No. 1 highest-earning music artist - see top 10 list,real
Taylor Swift Earned HOW Much More Than Beyonce Last Year?!,real
Source: Selena Gomez's Family Concerned About Justin Bieber Reunion,real
Justin Bieber and Selena Gomez get steamy on the dance floor,real
What Do Selena Gomez's Parents Think of Justin Bieber? (VIDEO),real
Justin Bieber and Selena Gomez are definitely back together!,real
Justin Bieber shares steamy video of dance routine with on/off girlfriend Selena  ...,real
Justin Bieber - Justin Bieber Dedicates Song To Selena Gomez,real
The 5 Best Quotes From Justin Bieber's Hilarious Deposition,real
Justin Bieber And Selena Gomez 'Kiss In The Shadows' As They Enjoy Laser  ...,real
SXSW: The New Rules of South By Southwest,real
Lady Gaga Confirmed as Keynote Speaker at SXSW Music 2014,real
Editorial: Green beer is not Irish,real
5 things you need to know about where to party on St. Patty's weekend,real
"Irish Road Bowling returns to St. Patrick, Missouri",real
St. Patrick's Day: Modernized Corned Beef recipe,real
'The Real Housewives of Orange County' Returns for a Juicy Ninth Season  ...,real
Lena Dunham Says She May Quit Acting After Girls Ends,real
Lena Dunham on the cover of Glamour with her tatts out- what do you think?,real
Saturday Night Live recap: How did Girls' Lena Dunham perform as host?,real
Disney TV executive Sweeney to leave company in January,real
Anne Sweeney to step down as Disney chief,real
Lindsay Lohan's latest 'last chance' -- can it save her?,real
10 Reasons Nikki and Juan Pablo are confusing,real
Trista Sutter on Juan Pablo and Nikki's Bachelor Finale Mistakes: 'Listen to Your  ...,real
Juan Pablo & Nikki Pose Together After 'Bachelor' Drama: 'We Are Free',real
The 14 Douchiest Things Bachelor Juan Pablo Has Done,real
"Nikki Ferrell lashes out at 'The Bachelor' haters: Your words hurt me, you should  ...",real
"'Bachelor' Juan Pablo Picks His Girl, Pisses Off Internet and Officially Becomes  ...",real
The Bachelor Finale: Chris Harrison & Juan Pablo Galavis Clash Over 'I Love You',real
VIDEO: 20 total strangers awkwardly share a FIRST KISS on camera,real
20 Strangers Share a First Kiss in Viral Advertisement (Video),real
'First Kiss' video of strangers smooching is worth a watch,real
"New 'Mad Men' Final Season Images, Explained by Matthew Weiner",real
"The Originals Quotes: Season 1, Episode 16 — “You Missed My Heart""",real
Neil Young on MP3s: “We Were Selling Shit!”,real
Neil Young Raising $800K On Kickstarter for iPod Killer Music Player,real
Headband OK'd to cut migraines,real
US drug regulator approves headband device to prevent migraines,real
"Drug company changes course, gives drug to sick Va. boy",real
Social Media Campaign to Save Boy Denied Lifesaving Drug,real
Family pleas for company to give experimental drug to son with life-threatening  ...,real
New blood test for Alzheimer's disease?,real
New Test Predicts Alzheimer's at Least Three Years in Advance,real
Blood test for Alzheimer's disease still years away,real
New breakthrough makes it possible: Would you want to know if you were going  ...,real
Blood Test that Can Predict Alzheimer's is 90 Percent Accurate,real
"Blood test can predict Alzheimer's, says study published in Nature Medicine",real
Blood test to forecast who is on brink of dementia,real
Marijuana advocates press case for legalization at House committee hearing,real
Mental health cuts are 'putting lives at risk',real
"To End The War On Drugs – A Guide For Politicians, The Press and Public",real
Sign-ups for health care may miss goal,real
"Op-ed: Flexible, Utah-specific solution best for Medicaid",real
Scientist who created STAP stem cells says studies should be withdrawn,real
Japan stem cell scientist calls for retraction of study (Update),real
Middle-class women are ignoring the rules about drinking during pregnancy  ...,real
Group Predicts Cancer Doctor Shortage,real
Obesity Linked To Ovarian Cancer: Study,real
Call to stub it out on No Smoking Day,real
"HEALTH MATTERS: Myths, truths about hookah smoking",real
China's Li Keqiang says future financial defaults 'unavoidable',real
Chinese premier admits 'friction' with US,real
Premier Li calls for new progress in mainland-Taiwan ties,real
Google execs solidify control with stock split,real
Stocks Recover From Initial Weakness To Close Roughly Flat - U.S. Commentary,real
"U.S. Stocks Fluctuate as Investors Weigh Economy, Ukraine Crisis",real
Indexology®: A Bang not a Whimper,real
Starbucks' new iPhone app could fatten baristas' wallets,real
Starbucks Revamps App to Become Even More Innovative in Mobile Payments  ...,real
New Starbucks App Allows Digital Tipping,real
"PRECIOUS-Gold near 6-mth high as Ukraine, China prompt safe-haven bids",real
"Gold hits 6-month peak, while copper falls to lowest since 2010",real
"Gold Rises on China, Ukraine Worries",real
Gold market update - 11th March 2014,real
"Gold Ends Firmer On Bargain Hunting, Short Covering",real
"Gold falls for 2nd session, US growth optimism weighs",real
Comex Gold Falls On Profit-Taking After US Jobs Data,real
Mercedes-Benz mulls three-cylinder hybrid powertrains,real
"China Jan-Feb factory output up 8.6%, a five-year low",real
FTC to probe Herbalife after request by Markey,real
FTC OPENS INVESTIGATION INTO HERBALIFE — SHARES PLUNGE,real
Herbalife (HLF) Sinks On FTC Probe; Usana Also Drops,real
"Herbalife Ltd. (HLF), Nu Skin Shares Halted, FTC Announces Probe",real
UPDATE 2-FDA bans imports from Sun Pharma plant in India crackdown,real
Can $7.6 billion valuation take Candy Crush to next level?,real
Candy Crush maker King seeks to price US IPO at $21-24/sh,real
'Candy Crush' leads game maker to IPO counter,real
Candy Crush-Maker King Sees Up To $7.6 Bln IPO Valuation,real
Candy Crush executives poised to make millions more from float,real
Candy Crush-maker King sees up to S$9.6 bln IPO valuation,real
Bouygues Ups Offer For Vivendi's SFR Unit By EUR1 Bln - Quick Facts,real
PHH Mortgage Mortgage Interest Rates Edge Down Thursday Mar 13,real
HSH.com: Stronger Employment Numbers Force Mortgage Rates Upward,real
TD Bank Mortgage Interest Rates Slip Wednesday Mar 12,real
FHA Mortgage Rates and VA Loans: KeyBank Mortgage Interest Rates for March  ...,real
GM offering $500 cash allowance to owners of recalled vehicles,real
GM Now Says Ignition-Switch Troubles Date Back to 2001,real
US opens probe into GM recall,real
Cash for Flunkers,real
Analyst: Replacement part could be $2-$5 in GM recall,real
Seattle couple thrown from dumpster into garbage truck; GM faces criminal  ...,real
MISSING MH370: Taiwanese passenger has Malaysian ties,real
"Thursday, March 13 2014 07:41 AM",real
Malaysia: No airline debris at spot shown on China images,real
"Friends, colleagues defend pilots of missing Malaysia Airlines plane",real
"Euro at 2 1/2 year high as China, Ukraine jitters boost safe havens",real
Germany outpaces flat European shares,real
Gas prices on the rise in Nevada; statewide average is up 17 cents in 1 month,real
"Gas prices rising in Charlotte, U.S.",real
Genghis Khan's Expansionist Empire Aided by Ideal Climate – Study,real
Google plans to open first retail store in New York City,real
SpaceX Tests Falcon 9 Landing Rocket Before Big Launch,real
17-Year-Old Wins $100K with Flu Drug Research,real
GM is offering free loaners to owners of recalled vehicles,real
"GM to offer loaner cars, cash to recalled small-car owners",real
Sprint Chairman Says US Internet Speeds are “Horrible” And He's Fixing It,real
T-Mobile US CFO says industry consolidation is inevitable,real
'The NSA' Masqueraded as 'Facebook' to Spread Malware on User PCs,real
How NSA plans to infect 'millions' of computers,real
Pint-sized T rex cousin once roamed the Arctic,real
United Airlines Launching In Flight Streaming Service For Apple Devices,real
Rare Diamond Reveals Earth's Interior is All Wet,real
Rough diamond shows there is water hidden deep in the Earth,real
World Wide Web inventor Tim Berners-Lee calls for 'online Magna Carta' or  ...,real
SA's first encounter with the world wide web,real
#Web25: The 25 Ways The Internet Changed Hip-Hop,real
Want to Wish the World Wide Web Happy Anniversary?,real
Moments that shaped the web,real
"Happy 25th Birthday, World Wide Web! Our Gift: An Intentionally Brief History Of  ...",real
Mutant dual-boot Android and Windows Phone coming to US this spring,real
"Nokia X, Snazzy and Affordable",real
Crytek to demo CryEngine Linux support at GDC,real
Lena Dunham might quit acting after Girls,real
'Big Bang Theory' To Remain An Air At Least Until 2017,real
CBS's 'The Big Bang Theory' Renewed For Three More Seasons,real
'Big Bang Theory' renewed for three more seasons,real
"Tinder Plans To Verify Celebs' Accounts Because Stars Need Love Too, Dammit",real
"Rick Ross Storms The Billboard Chart With ""Mastermind"", What Else Is New?",real
Rick Ross Is the Bawse as 'Mastermind' Hits No. 1,real
High fidelity Pono portable music player crushes Kickstarter funding goals in less  ...,real
Neil Young is 'rescuing music',real
Neil Young - Neil Young's Kickstarter Campaign Reaches Goal In 10 Hours,real
Neil Young Launches PonoMusic Player For 'Highest Quality Digital Music',real
Kim Kardashian Steals Sister Kylie's Bikini For Sexy Selfie!,real
Kim Kardashian models same black cutout bikini as sister Kylie in sexy selfie,real
"American Idol: Jena Irene, C.J. Harris and Alex Preston Stand Out from the Pack",real
American Idol 2014 Top 11 Performances [VIDEOS],real
Watch CJ Harris Sing “Can't You See” in American Idol 2014 Top 11 — March 12  ...,real
Latest American Idol dropped in UK,real
"Ohioan ""Jeopardy"" champ Arthur Chu is defeated",real
'Jeopardy' champ Arthur Chu unseated after 11-day reign,real
Lindsay Lohan prepares for 2 Broke Girls,real
Fey: No 'Mean Girls' reunion,real
Lindsay Lohan's alleged sex partner list publicly surfaces,real
Could There Be a 'Mean Girls' Sequel? Tina Fey Weighs In,real
Lindsay Lohan Made a List of the 36 People She's Banged,real
Star Wars Episode 7: battle for lead in JJ Abrams film in full force,real
"'Star Wars: Episode VII' lead actor shortlist includes 'Breaking Bad,' 'Downton  ...",real
Film Review: Veronica Mars,real
Kristen Bell: 'It's Inherently More Interesting To Watch A Female',real
'Veronica Mars': Where Are They Now,real
Kristen Bell - Kristen Bell hopes fans are 'satisfied' with Veronica Mars,real
"A Veronica Mars Sequel, LoVe's Beginning And 4 Other Topics We Explored  ...",real
'Veronica Mars': From TV to Motion Picture [WATCH VIDEO],real
Veronica Mars movie review: This is V Mars at her very best,real
Rooney Mara Cast As Tiger Lily In Forthcoming Fairytale Epic 'Pan',real
Rooney Mara in Talks for Pan's Tiger Lily,real
"Finale, It Is Happening To TV",real
"Chris Harrison on Bachelor Juan Pablo Galavis: ""From the Beginning Something  ...",real
Juan Pablo Declares Love for Nikki Online?,real
Juan Pablo Galavis Responds to 'Bachelor' Backlash + Opens Up About Nikki  ...,real
'There Is No Romance Left': The Bachelor's Juan Pablo Galavis And Nikki Ferrell  ...,real
Filming of 'Fast & Furious 7' to take place in Abu Dhabi next month,real
Filming of 'Fast & Furious 7' starting next month,real
Elizabeth Olsen Reportedly Engaged!,real
Another Olsen Sister is Getting Married,real
Rolling Stones' Keith Richards is Writing a Book for Kids,real
Keith Richards to release children`s book,real
VIDEO: Taylor Swift tops Billboard list of top music earners.,real
Facebook campaign to ban the word bossy is nonsense - girls should be bossy  ...,real
"Jay Leno on Fallon, Meyers and the Chances He'll Appear on Letterman",real
Face rebuilt using 3D-printed parts,real
South Wales dad has 3D facial reconstruction surgery at Swansea's Morriston  ...,real
Strollin' Colon raises colon cancer awareness,real
