"Fed official says weak data caused by weather, should not slow taper",real
EBay Rejects Icahn Board Picks As Activist Strikes Again,real
Stocks Down At Midday On Weak China Export Data,real
What the bull market has meant for Europe,real
Bitcoin exchange Mt. Gox files for US bankruptcy,real
Color of Money: Bitcoin trendy but too risky for most investors,real
REVEALED: How Bill Ackman Has Been Lobbying To Bring Down A Company  ...,real
Public transit boom,real
"Oil sinks on weak Chinese data, end of heating season",real
Burned To A Crisp: Sbarro Files For Bankruptcy (Again),real
Ukraine Crisis: LNG Stocks in Focus,real
Eastern European countries paid much more for Russian gas than western ones,real
Chiquita Brands acquires Fyffes to create world's biggest banana seller,real
Share this on:,real
China learns not to rescue its lame ducks,real
"China's CSI300 index at near 9-mth low, Hong Kong sinks too",real
Titanfall Xbox One Launch: Microsoft Releases Critically Acclaimed First-Person  ...,real
Titanfall Xbox One May Be Bumped Up To 1080p With A Patch,real
Titanfall: Best Places To Get One Upon Release,real
Elephants never forget... a human language,real
Mt. Gox files for US bankruptcy to halt class...,real
iPhone 6 holographic projector phone concept video hits web,real
Google wants Android to be your wearable OS of choice,real
Chromecast heading to the UK 'in weeks',real
GM Picks Former Lehman Investigator Valukas for Recall Probe,real
Former NHTSA Chief Rebukes General Motors,real
"Did ""Cosmos"" Pick the Wrong Hero?",real
How to read an entire novel in just 90 minutes,real
"Apple releases iOS 7.1 update, complete with CarPlay",real
iOS 7.1 vs. iOS 7 keyboard changes,real
"iOS 7.1 is here, download it immediately",real
Business in Savannah in brief,real
US Gasoline Declines to $3.294 a Gallon in Lundberg Survey,real
Snowden: Mass surveillance is backfiring on US efforts to combat terrorism,real
NSA leaker Edward Snowden speaks via video at South By Southwest  ...,real
NSA Whistleblower Edward Snowden: Keep Their Hands Off Our Data,real
Edward Snowden Streaming Live From South By Southwest [Watch It Here - Video],real
Watch: a new trailer for Game of Thrones,real
Game Of Thrones Season 4 Plot Direction And Details Revealed,real
Lindsay Lohan Docu-Series Debuts to Over 693000 Viewers on OWN,real
Here's Lindsay Lohan Chewing Out Multiple People on Her Reality Show,real
"Fan arrested for breaking into Miley Cyrus' dressing room, leaving note and  ...",real
BREAKING: Juan Pablo Galavis Doesn't Propose to Nikki Ferrell — Are You  ...,real
Juan Pablo Galavis upsets Clare Crawley with sexual comment,real
Juan Pablo offers wedding song? 'The Bachelor' shares music with Clare Crawley,real
"'The Bachelor' finale: Rumors on Juan Pablo Galavis, Sean Lowe, Catherine  ...",real
Huge 'The Bachelor' 2014 spoilers: Is Juan Pablo still with winner?,real
Edward Snowden speaks at SXSW conference,real
High School Musical reunion Sorry Zac not now,real
Neighbors Review [SXSW 2014],real
'True Detective' Creator Nic Pizzolatto Teases Saga Of Rust & Martin Could  ...,real
Which Pulpy Genre Should True Detective Plunder for Season Two?,real
True Detective Finale: A Happy Ending?,real
"#etiquette: Lena Dunham tweeted an offensive joke, then deleted it. Good call or  ...",real
Lena Dunham gets butt naked to spoof Girls on Saturday Night Live - WATCH,real
Lena Dunham Gets Nude for Her 'Saturday Night Live' Hosting Gig,real
Neil Young's PonoMusic Player Announces Pre-Order Date,real
SXSW: Jon Favreau On Swapping Iron Man For 'Food Porn' In His New Movie Chef,real
Justin Bieber and Selena Gomez grind to John Legend - WATCH,real
"Justin Bieber Stands By Video Deposition Kiss-Off, 'We All Have A Right To  ...",real
Video: Check out Justin Bieber's belligerent deposition,real
Stacy Keibler Got Married to Not George Clooney,real
Stacy Keibler marries Jared Pobre in an intimate beach ceremony in Mexico,real
Taylor Swift named music's top money maker,real
"Prince Harry and Cressida Bonas to Get Engaged in 2014, Oddsmakers Predict",real
Recap: NBC The Voice Season 6 – Blind Auditions Night 5 + Videos,real
"Miley Cyrus 'a scapegoat,' says Kylie",real
"Miley Cyrus Adds ""Motor Boating"" To Her Outrageous Onstage Concert Repertoire",real
The 7 Most Ridiculous Things About The New Ban Bossy Campaign,real
"Let's ALL Join Beyonce and Jennifer Garner In Banning the Word ""Bossy""",real
I was bossy. Here's why that's a big problem.,real
"Smartphones can Negatively Affect Parenting Skills, Study Reports",real
J.C. Penney Shares Rally as Citi Ups Retailer to 'Buy',real
"Chrysler Recalls 25000 Jeep Grand Cherokee, Dodge Durango SUVs",real
Libya threatens to bomb N.Korean tanker if it ships oil from rebel port,real
What Colorado's Recreational Marijuana Tax Revenue Means for Massachusetts,real
Bill to legalize marijuana in Missouri moves ahead in House,real
Colorado reaps millions from pot sales,real
"S&P 500 Fluctuates Near High as Investors Weigh Economy, Ukraine",real
US stocks inch down amid worry over China's sluggish growth,real
International markets roundup,real
"Interest rate rise will not be delayed by general election, says Mark Carney",real
RBS Could Move HQ to England if Scotland Joins EU,real
Bank of England reveals concern about strength of sterling,real
"Fannie Mae, Freddie Mac Would Be Eliminated in Senate Bill",real
Why Fairholme Is Likely To Win Discovery In Fannie Mae Case,real
Is Comcast Building the Next Magic Kingdom?,real
OECD: Growth in advanced economies gains momentum - WBOC-TV 16  ...,real
Dick's Sporting Goods Inc. (DKS) Releases Q1 Earnings Guidance,real
Men's Wearhouse and Tux,real
Jos. A. Bank to Be Bought by Men's Wearhouse,real
"T-Mobile: further industry consolidation isn't a question of if, but when",real
"Sprint CFO: The sky isn't falling, management is working with SoftBank's Son",real
"Fox's 'Cosmos' isn't an affront to religion, it's divine confirmation of faith (Edward  ...",real
Flappy Bird creator says he's considering letting the bird loose again,real
What the creators of Flappy Bird and Bitcoin are teaching us about online media,real
US House committee investigating GM recall,real
UberConference Launches Google Docs Add-on,real
Titanfall launch hindered by Xbox Live sign-in issues,real
Heat Develops Major Ad Launch For EA's Titanfall,real
Titanfall Released; Will It Revive Xbox One Sales?,real
LivePlay: TitanFall & Xbox One Twitch App,real
Titanfall “Free the Frontier” live-action teaser arrives,real
The Titanfall Day 1 Update Is 840 MB Big,real
DIVERGENT Stars Shailene Woodley & Theo James to Share Clip on 2014  ...,real
Grant Gustin: 'The Flash' Full Costume!,real
'The Flash' Costume: See Grant Gustin's Full Outfit Ready for CW Super Speed!,real
"Photograph by: Chris Pizzello , Chris Pizzello/Invision/AP",real
Emma Watson Reveals New 'Noah' Trailer,real
Taylor Swift is No. 1 highest-earning music artist - see top 10 list,real
Source: Selena Gomez's Family Concerned About Justin Bieber Reunion,real
What Do Selena Gomez's Parents Think of Justin Bieber? (VIDEO),real
Justin Bieber shares steamy video of dance routine with on/off girlfriend Selena  ...,real
The 5 Best Quotes From Justin Bieber's Hilarious Deposition,real
SXSW: The New Rules of South By Southwest,real
Editorial: Green beer is not Irish,real
"Irish Road Bowling returns to St. Patrick, Missouri",real
'The Real Housewives of Orange County' Returns for a Juicy Ninth Season  ...,real
Lena Dunham on the cover of Glamour with her tatts out- what do you think?,real
Disney TV executive Sweeney to leave company in January,real
Lindsay Lohan's latest 'last chance' -- can it save her?,real
Trista Sutter on Juan Pablo and Nikki's Bachelor Finale Mistakes: 'Listen to Your  ...,real
The 14 Douchiest Things Bachelor Juan Pablo Has Done,real
"'Bachelor' Juan Pablo Picks His Girl, Pisses Off Internet and Officially Becomes  ...",real
VIDEO: 20 total strangers awkwardly share a FIRST KISS on camera,real
'First Kiss' video of strangers smooching is worth a watch,real
"The Originals Quotes: Season 1, Episode 16 — “You Missed My Heart""",real
Neil Young Raising $800K On Kickstarter for iPod Killer Music Player,real
US drug regulator approves headband device to prevent migraines,real
Social Media Campaign to Save Boy Denied Lifesaving Drug,real
New blood test for Alzheimer's disease?,real
Blood test for Alzheimer's disease still years away,real
Blood Test that Can Predict Alzheimer's is 90 Percent Accurate,real
Blood test to forecast who is on brink of dementia,real
Mental health cuts are 'putting lives at risk',real
Sign-ups for health care may miss goal,real
Scientist who created STAP stem cells says studies should be withdrawn,real
Middle-class women are ignoring the rules about drinking during pregnancy  ...,real
Obesity Linked To Ovarian Cancer: Study,real
"HEALTH MATTERS: Myths, truths about hookah smoking",real
Chinese premier admits 'friction' with US,real
Google execs solidify control with stock split,real
"U.S. Stocks Fluctuate as Investors Weigh Economy, Ukraine Crisis",real
Starbucks' new iPhone app could fatten baristas' wallets,real
New Starbucks App Allows Digital Tipping,real
"Gold hits 6-month peak, while copper falls to lowest since 2010",real
Gold market update - 11th March 2014,real
"Gold falls for 2nd session, US growth optimism weighs",real
Mercedes-Benz mulls three-cylinder hybrid powertrains,real
FTC to probe Herbalife after request by Markey,real
Herbalife (HLF) Sinks On FTC Probe; Usana Also Drops,real
UPDATE 2-FDA bans imports from Sun Pharma plant in India crackdown,real
Candy Crush maker King seeks to price US IPO at $21-24/sh,real
Candy Crush-Maker King Sees Up To $7.6 Bln IPO Valuation,real
Candy Crush-maker King sees up to S$9.6 bln IPO valuation,real
PHH Mortgage Mortgage Interest Rates Edge Down Thursday Mar 13,real
TD Bank Mortgage Interest Rates Slip Wednesday Mar 12,real
GM offering $500 cash allowance to owners of recalled vehicles,real
US opens probe into GM recall,real
Analyst: Replacement part could be $2-$5 in GM recall,real
MISSING MH370: Taiwanese passenger has Malaysian ties,real
Malaysia: No airline debris at spot shown on China images,real
"Euro at 2 1/2 year high as China, Ukraine jitters boost safe havens",real
Gas prices on the rise in Nevada; statewide average is up 17 cents in 1 month,real
Genghis Khan's Expansionist Empire Aided by Ideal Climate – Study,real
SpaceX Tests Falcon 9 Landing Rocket Before Big Launch,real
GM is offering free loaners to owners of recalled vehicles,real
Sprint Chairman Says US Internet Speeds are “Horrible” And He's Fixing It,real
'The NSA' Masqueraded as 'Facebook' to Spread Malware on User PCs,real
Pint-sized T rex cousin once roamed the Arctic,real
Rare Diamond Reveals Earth's Interior is All Wet,real
World Wide Web inventor Tim Berners-Lee calls for 'online Magna Carta' or  ...,real
#Web25: The 25 Ways The Internet Changed Hip-Hop,real
Moments that shaped the web,real
Mutant dual-boot Android and Windows Phone coming to US this spring,real
Crytek to demo CryEngine Linux support at GDC,real
'Big Bang Theory' To Remain An Air At Least Until 2017,real
'Big Bang Theory' renewed for three more seasons,real
"Rick Ross Storms The Billboard Chart With ""Mastermind"", What Else Is New?",real
High fidelity Pono portable music player crushes Kickstarter funding goals in less  ...,real
Neil Young - Neil Young's Kickstarter Campaign Reaches Goal In 10 Hours,real
Kim Kardashian Steals Sister Kylie's Bikini For Sexy Selfie!,real
"American Idol: Jena Irene, C.J. Harris and Alex Preston Stand Out from the Pack",real
Watch CJ Harris Sing “Can't You See” in American Idol 2014 Top 11 — March 12  ...,real
"Ohioan ""Jeopardy"" champ Arthur Chu is defeated",real
Lindsay Lohan prepares for 2 Broke Girls,real
Lindsay Lohan's alleged sex partner list publicly surfaces,real
Lindsay Lohan Made a List of the 36 People She's Banged,real
"'Star Wars: Episode VII' lead actor shortlist includes 'Breaking Bad,' 'Downton  ...",real
Kristen Bell: 'It's Inherently More Interesting To Watch A Female',real
Kristen Bell - Kristen Bell hopes fans are 'satisfied' with Veronica Mars,real
'Veronica Mars': From TV to Motion Picture [WATCH VIDEO],real
Rooney Mara Cast As Tiger Lily In Forthcoming Fairytale Epic 'Pan',real
"Finale, It Is Happening To TV",real
Juan Pablo Declares Love for Nikki Online?,real
'There Is No Romance Left': The Bachelor's Juan Pablo Galavis And Nikki Ferrell  ...,real
Filming of 'Fast & Furious 7' starting next month,real
Another Olsen Sister is Getting Married,real
Keith Richards to release children`s book,real
Facebook campaign to ban the word bossy is nonsense - girls should be bossy  ...,real
Face rebuilt using 3D-printed parts,real
Strollin' Colon raises colon cancer awareness,real
Food Label Makeover a Great Step Toward Healthier Eating,real
Marin County Opens Up on HIV AIDS,real
"US wholesalers boost stockpiles 0.6 pct in Jan., despite biggest sales drop since  ...",real
Dying Boy's Family Wins Battle for Experimental Drug,real
ADHD prescriptions skyrocket in US,real
FDA Approves Headband Device That Reduces Migraines,real
The internet is where commerce is shifting.,real
Chinese e-commerce titan Alibaba confirms U.S. IPO,real
TV: City of Los Angeles Files $10 …,real
Toyota shuts two India plants in lockout over wages,real
Vodafone to Buy Ono in $10 Billion Spanish Cable Push,real
Vodafone Group plc: VODAFONE TO ACQUIRE GRUPO CORPORATIVO ONO  ...,real
How Subway Toasted Quiznos,real
European Economics Preview: Eurozone Final Inflation Data Due,real
Navy SEALs take oil tanker from rebels,real
Week ahead: Yellen must walk a verbal tightrope,real
China announces plans to expand cities,real
Amazon raising price of prime membership by $20,real
PBOC Sharply Widens Yuan Trading Band,real
Co-pilot spoke last words heard from missing Malaysian plane,real
"Flight 370 Mystery: Investigators Believe Co-Pilot Spoke Last Words, Reportedly  ...",real
Oz takes lead in Boeing hunt,real
Mozilla Scraps Metro Firefox for Windows 8,real
"Soft-Bodied, Robotic Fish Described In Premiere Issue Of Soft Robotics Journal",real
Julie Ann Horvath Describes Sexism And Intimidation Behind Her GitHub Exit,real
Is Microsoft Corporation Adopting an Android Strategy for Windows Phone?,real
Happy Pi Day: 7 outrageous pies math geeks --or anyone -- can cook up,real
"Office 365 For Mac, iPhone, And iPad Coming As Microsoft Considers Future  ...",real
Police enforce car ban as Paris battles smog,real
France offers free weekend transport to ease air pollution,real
Xbox One makes hot debut as console war revs up,real
Xbox One controllers are compatible with PC despite rumors to the contrary  ...,real
"Combined Xbox One, PS4 software sales up 80% compared to Xbox 360, PS3",real
Hyundai overstates mileage for revamped Sonata sedan in publicity materials,real
Oklahoma Station Edits Out Evolution Section of 'Cosmos' -- Here's the Video,real
Honda recalls Odyssey Minivan,real
Honda Recalls Odyssey Minivans For Potential Fire Risk From Fuel Pump Part,real
Police: Shooting on MLK Boulevard,real
Tonight's TV picks: 'Dancing With the Stars' premieres with a lot of change,real
Chris Pine Boldly Admits To A DUI Charge,real
Steven Tyler at Johnny Depp/Amber Heard's Slightly Medieval Engagement Party,real
Britney Spears' sister weds in Las Vegas,real
Jamie Lynn Spears Getting Married on Friday,real
How to fix SXSW and 11 more take-aways from 2014's festival,real
'Peabody and Sherman' climbs to top of box office,real
TOP 10 MOVIES AT THE WEEKEND BOX OFFICE,real
"Lost Producers Reflect on Finale, Insist: They Weren't All Dead!",real
Film Review | Veronica Mars (2014),real
"Tyler, The Creator Plays Dallas Show After Arrest At SXSW",real
Emma Stone And Andrew Garfield Are In Sydney,real
Miley has kitty tattooed on lip,real
Miley Cyrus recording music with The Flaming Lips,real
Wayne Knight Confirms That He Is Not Dead,real
Wayne Knight tweets proof he's not dead!,real
Medical Corner: Screening is the key to early detection of colorectal cancer,real
States to pharmacies: Stop selling tobacco,real
Autism linked to pollution,real
"The Younger You Are, The More You Will Yawn: Study",real
Bundled body of woman found in NE Ohio shed,real
Kirkland Signature Real Sliced Fruit Recall: Salmonella Contamination,real
German court rejects case against eurozone bailout scheme,real
4 things to expect from Yellen's Fed,real
Mt. Gox allows customers to check bitcoin balances,real
Report: Health insurance exchanges bring mixed levels of competition to markets,real
Health-care enrollment tops 5 million,real
Jack Kingston: insurance company bailout 'socialistic approach to marketplace',real
Kathleen Sebelius: Signup for marketplace insurance by March 31,real
Cash prizes for signing up for Obamacare?,real
Hertz Drives 8% Higher on Spinoff Buzz,real
Where does money come from? The Bank of England explains all,real
"GM recalls 1.5M vehicles for air bag, fire risks",real
"General Motors Knew About Faulty Engines For Over a Decade, Issue Recall  ...",real
"March 17, 2014 11:09 am",real
$300m to Cover for Faulty Ignition Switch,real
Sally Beauty Says Fewer Than 25000 Cards' Data Accessed,real
Income inequality hits retirement confidence,real
"Wal-Mart taking on GameStop, will soon accept video game trade-ins",real
Walmart to start selling used video games,real
SC umemployment down again in January; Beaufort County's rate increases,real
Unemployment rates drop in 43 states in January,real
EUR/GBP: Disappointing ZEW economic sentiment for Germany and Eurozone,real
fish tank bursts at Downtown Disney restaurant,real
Where in the World Is Flight 370?,real
Missing Plane: China Satellites Scan For MH370,real
Major discovery provides new evidence of Big Bang theory,real
Freaky Physics: Why the Discovery of Gravitational Waves Should Blow Your Mind,real
"In the afterglow of the Big Bang, scientists see 'smoking gun' for growth spurt at  ...",real
Astronomers discover echo of the Big Bang,real
Diablo 3's auction house is now closed for business,real
8 GB iPhone 5c Intended to Boost Mid-Tier Markets Where LTE Is Growing,real
Apple Is Launching a Much Cheaper 8GB iPhone 5c,real
"iPhone 5c gets more affordable with £429 8GB model, on sale now",real
Concept design shows larger Apple iPad Pro having iPhone5S-like TouchID,real
New Leak Suggests Apple May Launch A Cheaper 8GB iPhone 5c Tomorrow,real
Alleged iPhone 6 Specs Revealed,real
Steve Jobs Never Wanted Apple To Make A TV,real
"Google, Viacom Settle YouTube Copyright Lawsuit",real
YouTube enrolls 'super flaggers' to watch for offending videos,real
Newborn Stars Blast Gas Inside a Monkey's Head,real
Piksel Behind Channel 4's 4oD for Xbox One at Global Console Release,real
"Rumor: Microsoft Has Also Been Developing VR Tech, To Work With Kinect",real
UK retailer to cut Xbox One to £299 this week,real
WhatsApp denies Facebook acquisition compromises user privacy,real
WhatsApp founder says privacy concerns after Facebook...,real
Honda Recalls Nearly 900000 Odyssey Minivans Over Potential Fire Risk; Offers  ...,real
Microsoft could launch iPad version of Office on March 27,real
Office for iPad may (finally) arrive as soon as March 27,real
K-Glass: Korea's Answer to Google Glass,real
'The Voice' Recap: The Band Perry Drops By As Battle Rounds Begin,real
"Angus T. Jones Slams 'Two And A Half Men' After Finding Christianity: ""I Was A  ...",real
Chris Brown -- Jailed For a Month ... He Can't Stay Out of Trouble,real
Chris Brown to spend a month in jail after being kicked out of rehab,real
Paramount deny Pope Francis 'cancelled' meeting with Noah's Russell Crowe  ...,real
Kate Winslet Receives Star on Walk of Fame,real
Kate Winslet Lands at LAX Ahead of Hollywood Walk Of Fame Ceremony,real
Courtney Love claims to have 'located' missing Malaysia Airlines plane MH370,real
"Ashton Kutcher's Approach To Marriage Is Chivalrous, Until You Remember It's  ...",real
"Mick Jagger on Late Girlfriend, Designer L'Wren Scott: ""I Will Never Forget Her""",real
Sir Mick Jagger: 'I'm struggling to understand how my lover and best friend could  ...,real
Mick Jagger's representative dismisses L'Wren Scott split rumours,real
Charlie White & Sharna Burgess Score Big on 'DWTS' Week #1!,real
'Dancing With the Stars' 2014: Pro Chelsie Hightower on Week 1,real
"Dancing with the Stars 2014 Results Tonight, Elimination Rules Changes  ...",real
"Cathy Whims, Naomi Pomeroy, Clyde Common, Andy Ricker: Finalists for 2014  ...",real
Jason Aldean Dating American Idol Alum Brittany Kerr After Cheating Scandal  ...,real
Maleficent Trailer: There Is Evil In This World,real
Angelina Jolie is a frightful sight to behold in new Maleficent poster,real
"'Seinfeld' Actor Wayne Knight Is Not Dead, Wayne Knight Confirms",real
The 3D Peanuts Teaser Trailer Is Out; We Have Mixed Feelings [Video],real
NFL Demands Additional $15.1 Million In Restitution From MIA,real
MIA Sued By NFL For $16.6 Million Over Super Bowl Middle Finger,real
Miley Cyrus And The Flaming Lips Pelted With Bras During Tulsa Performance  ...,real
Miley Cyrus rolls a joint [PHOTO],real
Kermit the Frog and Jimmy Fallon Sing a St. Patrick's Day Duet (Video),real
Sweetener Extracted from Tequila Plant could Help Lower Blood Sugar Levels,real
Chocolate Pills May Stop Heart Attacks And Strokes,real
Research Raises Questions About The Link Between Fatty Acids And Heart  ...,real
Do Saturated Fats Really Cause Heart Disease?,real
San Diego Zoo veterinarians perform rare C-section on gorilla; baby in guarded  ...,real
Study reveals decline in colon cancer in older adults in US,real
Breast cancer and rates of survival,real
"TV Time, Feeding Habits Set Babies Up for Obesity: Study",real
Oldest Case of Cancer Discovered in Ancient Skeleton,real
"The US Economy, Is All About Marijuana Now",real
European Stocks Seen Little Changed Before Fed Review,real
Relatives of missing Malaysian flight passengers thrown out of press conference,real
Investigation of Malaysia Airlines pilots undercuts suicide theory,real
Unemployment rate rises by 2000,real
A new 12-sided one pound coin based on the threepenny bit is being unveiled  ...,real
British chancellor reveals new pound as he prepares to deliver budget Eds: epa  ...,real
"GM CEO admits recall tardy, won't pledge liability",real
GM appoints safety chief to deal with mounting recall crisis,real
"Premarket: Shares slip ahead of Fed, investors eye Russia,Ukraine",real
Forex - Dollar slides lower against yen,real
Bank of England minutes reveal risks of further pound gains,real
UK expected to name next BoE deputy governor on Tuesday: source,real
"New Big Bang evidence supports creation, says Orthodox physicist",real
Cosmologists Find 'Tell-Tale' Energy Pattern In The Cosmic Background  ...,real
Sony's Project Morpheus will be 'affordable',real
Sony Unveils its Project Morpheus VR Headset for PS4,real
Oppo Launches 5.5-Inch Quad HD Find 7 Smartphone,real
Google Chromecast Launches in UK Costing £30 as BBC Adds Support for iPlayer,real
"Google Chromecast costs £30 in the UK, out today",real
Toyota Motor Corp in US settlement over unintended acceleration -source,real
Customers not scared off by GM recall,real
Is Google Apps Down? Google Chat and Drive Offline,real
Motorola and LG unveil smartwatches using Google Android Wear OS,real
Motorola: The modern Moto 360 Android Wear,real
"Google reworks Android for 'smartwatches,' will feature virtual assistant",real
Disney planning 'The Incredibles' and 'Cars' sequels,real
Disney Confirms 'The Incredibles 2' Is Being Written By Brad Bird,real
Murphy's film gets US release date,real
Arts and Culture: 'Avengers' sequel in Seoul,real
Kate Winslet shows incredible post-pregnancy figure at Divergent premiere,real
Kate Winslet Receiving Star on Hollywood Walk of Fame Today!,real
"'Glee' season 5, episode 12 '100' part 1 airs tonight: Goodbye glee club",real
L'Wren Scott planned to close fashion business,real
Sir Mick Jagger rejects 'horrible' claims he had broken up with girlfriend L'Wren  ...,real
Rolling Stones Cancel Concerts Following L'Wren Scott's Death,real
"Charlie Brown, Snoopy get 3-D treatment in 'Peanuts' movie",real
Who Won The Battle Rounds On The Voice USA 2014 Last Night? Night 2,real
Who Went Home On The Voice 2014 Season 6 Tonight? 3/18/2014,real
"4 Things to Know About Divergent's Four, Theo James",real
"Shailene Woodley Has A Beauty Tip For Your Vagina! Don't Freak Out Yet, You  ...",real
"Shailene Woodley Covers Marie Claire in Leather Jumpsuit, Talks Scoliosis  ...",real
"Kermit goes bad, but all else is well in Muppets Most Wanted",real
Sofia Coppola to helm live-action film 'Little Mermaid',real
"Courtney Love found the missing Malaysian jetliner, and so can you",real
Police: Bieber claimed foot fracture in Miami,real
Miley Cyrus 'Bangerz' Tour Bus Catches Fire; Is She Hurt? [Watch Video Here],real
Miley Cyrus' Tour Bus Wrecked In Fire,real
New Star Wars to start filming in Britain in May,real
Director Ivan Reitman Drops Out Of Ghostbusters Threequel,real
EARLIER: Exact Sciences Publish Results of DeeP-C Study in NEJM,real
Mumps outbreak at Ohio State could increase,real
Saturated fat DOESN'T cause heart disease after all,real
PTSD Added To Michigan Medical Marijuana Program,real
Alzheimer's Disease: Blood Test Foretells Illness,real
Hospitals may be to blame for NYC measles outbreak,real
Kids Support National Kick Butts Day,real
Asian shares fall on Federal Reserve concerns,real
