Review: New Galaxy S5 features actually useful as Samsung simplifies phone  ...,real
Comcast argues benefits of Time Warner Cable deal,real
Fossil of Daddy Longlegs Suggest its Ancestors had Second Set of Eyes,real
Facebook tackles spam with latest news feed algorithm,real
House of Cards Season 3 Release Date: Netflix Premiere Date Almost Definitely  ...,real
Jeep shows latest off-road concepts for Moab Jeep Safari,real
Feds issue warning: Hackers trying to exploit 'Heartbleed' bug,real
WhatsApp and Facebook's Deal confirmed by FTC,real
US warns Facebook on privacy in WhatsApp mega deal (Update),real
"Look in the mirror and be very, very afraid",real
"Too often, Oculus simply reflects the scare tactics of better movies",real
Football flick Draft Day gains yards but doesn't win,real
Draft Day Review: Trouble with the End Zone,real
"Watch Nirvana Play With Lorde, St. Vincent, Kim Gordon, Joan Jett at the Rock  ...",real
Lorde and Joan Jett Jam With Nirvana at Rock Hall Ceremony,real
Nirvana gets an incredible Rock and Roll Hall of Fame induction,real
"Nirvana perform with Lorde, Joan Jett, St Vincent - watch",real
Move Over Don Draper! The Simpsons Get A Mad Men Makeover For Their  ...,real
"Mad Men creator faces the end, and its challenges",real
"Adrian Mole's final diary left unfinished, publisher says",real
Adrian Mole was in the great British literary tradition of comic failure,real
Drake Goes Undercover To Ask General Public Their Opinion Of Him,real
'Grown up' Selena Gomez 'fires' parents as managers,real
Paul Walker dead: Fast & Furious actor to receive tribute at the MTV Movie  ...,real
"Just Seen It Celebrates the MTV Movie Awards with a Look Back at the 80s, the  ...",real
'Bullets over Broadway': Musical of mobsters and old standards,real
"Guardians of the Galaxy Movie Cast, Characters, and News Update: Chris Pratt  ...",real
Miley Cyrus to Appear on the May Cover of Seventeen Magazine with a Photo  ...,real
Ireland's wedding-singer priest an Internet hit 'Frozen' tops Billboard chart for 4th  ...,real
'Rio 2' dazzling but overloaded,real
'Rio 2' a gorgeous but muddled sequel,real
Birds are back in dazzling but overloaded 'Rio 2',real
'Girl Meets World' Trailer Released: Meet Daughter Riley (VIDEO),real
"Stephen Colbert 'Only Logical Successor' for Letterman, Leslie Moonves Says",real
Who Should Be Stephen Colbert's Bandleader?,real
"“Stephen Colbert” is dead, long live Stephen Colbert!",real
"Watch OutKast, Pharrell & More LIVE From Coachella This Weekend From The  ...",real
Frank Ocean's second album is almost done,real
Heading to Coachella this weekend? Set times have been released!,real
Ted Cruz: Democrats pushed Kathleen Sebelius out,real
"HHS Sebelius Resigns, to be Replaced by Budget Office Head Burwell",real
Medicare by the Numbers,real
Fla. eye doctor received almost $21 million from Medicare,real
Top-paid Medicare docs defend practices,real
Nearly 4000 doctors got more than $1 million from Medicare in 2012,real
You can now grow vaginas in a lab,real
Americans look past calories as approach to dieting evolves; major brands feel  ...,real
Crown Princess cruise ship with sick passengers arrives in San Diego,real
"Today's Biotech Stocks to Watch: AbbVie Inc., Enanta Pharmaceuticals Inc. and  ...",real
Merck hepatitis C drugs shine in easier to treat patients,real
'Jet lag app' to help travellers adjust body clocks,real
Nigeria is in Danger: Health Minister Raises Alert on Ebola Virus,real
How women can help men spot symptoms of prostate cancer,real
Paralyzed Men Move Their Legs Again After Spinal Implant,real
Researchers raise questions about flu drugs,real
UK's £560m Flu Drug Stockpile's Effectiveness Slammed,real
Pandemic flu: was the Tamiflu stockpile a waste of money?,real
"Stock plunge continues, Nasdaq drops below 4000",real
US Stock Futures Suggest Weak Opening After Thursday's Rout; Day's Moves  ...,real
Why taxpayers procrastinate,real
Beyond azodicarbonamide: Other ingredients removed from foods,real
Crews now grading land for Family Dollar store in Axton,real
US dollar slides against euro,real
CANADA FX DEBT-C$ at nearly 3-month high after Fed minutes,real
Ohio geologists link small quakes to fracking,real
Technology stocks falling for 2nd day in a row,real
Wall Street sees bad end to even worse week,real
US Producer Prices Post Largest Gain In Nine Months,real
49ers QB took to Twitter Friday to say reports of 'incident' were completely false.,real
49ers star QB Colin Kaepernick under investigation for sexual assault,real
Fitch raises outlook on Portugal's debt rating,real
Amazon Buys Digital Comic Book Seller ComiXology,real
Prime Takeaways From Amazon's Annual Shareholder Letter,real
VIDEO: Herbalife Being Investigated by DoJ and FBI: FT,real
Coldwater Creek plans liquidation sales before Mother's Day,real
Wells Fargo to Provide $75MM DIP Loan to Coldwater Creek,real
Dropbox Offering New Photo Storage Features,real
Drew Houston on Dropbox: 'We are going after something really big',real
"Dropbox Announces Private Beta of Mailbox for Mac, Launches Mailbox for  ...",real
"Samsung launches Galaxy S5, new wearables in 125 nations worldwide",real
"Samsung Galaxy S5 Google Play edition: so, ummmm… where is it?",real
"Review: S5 features useful, less about gimmicks",real
TELUS: The New HTC One M8 Now Available!,real
Google to open sales of Glass to a bigger pool of consumers,real
2014 Jeep Cherokee Real-World Cargo Space,real
Facebook Reveals 1900 Requests To Spy On Users For Criminal Cases,real
US warns business about 'heartbleed' computer bug,real
"Hackers may be using Heartbleed bug, US warns",real
Looks like maybe the NSA did know about Heartbleed ...,real
"That Terrible, No Good, Horrible Internet Security Flaw You've been Hearing  ...",real
Amazon to unveil smartphone in time for winter holidays,real
Companies sharing cybersecurity data not to be prosecuted: US,real
2014 New York Auto Show: New Chevy Corvette Stingray Variant Confirmed,real
Katherine Heigl Sues Pharmacy Chain Duane Reade… for a Tweet!,real
"'Fargo,' a new FX miniseries not really based on the movie, debuts Tuesday",real
Best-selling author of the Secret Diary of Adrian Mole Sue Townsend has died  ...,real
Miley Cyrus posts topless photo (again),real
Lamar Odom Reportedly Making 'Desperate Calls' To Khloe Kardashian Amid  ...,real
Has Khloe Kardashian finally moved on from Lamar Odom? Star snapped with  ...,real
The Amazing Spider-Man 2: Post-Credits Secret Cameo Finally Solved,real
Emma Stone dazzles at the Spider-Man 2 premiere,real
Andrew Garfield stole his Spider-man costume,real
Johnny Depp Finally Explains Why He Wears Fiancee's Engagement Ring,real
"Film Review: 'Draft Day' is Daft, Except as an NFL Infomercial",real
"Liberals Are Miserable Creatures, NY Times 'Draft Day' Review Edition",real
Church Services,real
Trinity Church in Waltham offers Holy Week services,real
Northampton town centre church opening its doors for Easter shoppers,real
"Jesse Winchester, singer-songwriter who dodged US draft, dies at 69",real
Coachella 'Reflects' Artist Phillip K. Smith's Work,real
COACHELLA 2014: DJ and producer Gareth Emery ready to 'Drive',real
MTV Movie Awards To Reunite 'Mean Girls' Cast: Report,real
Colbert right person to do Late Show: O'Brien,real
Stephen Colbert: 7 Great Replacements Comedy Central Should Consider,real
New Study Says Eating at Restaurants Doubles Your Chance of Food Poisoning,real
Scientists Have Successfully Grown and Implanted Vaginas in Four Women,real
Salmonella outbreak linked to Foster Farms isn't over,real
"MERS sickens UAE paramedics, Jordanian, more Saudis",real
Dove's Beauty Patch Experiment Wants You to Embrace What You Have,real
Town marks World Autism Day,real
Study examines link between recalling alcohol brands in popular music and  ...,real
Mario Draghi hedges on ECB's stimulus options,real
"Ohio geologists link fracking, quakes",real
Dollar Steadies After Solid U.S. Jobs Data,real
Merkel a 'believer' in Greece after tough reforms,real
"Merkel, in Athens, praises Greek reform progress - WVTM-TV: News, Weather  ...",real
Herbalife Stock Price & Chart: Diet Supplement Company Stock Drops Amid  ...,real
Business Highlights,real
Oil company blamed for toxic tap water in China: Xinhua,real
jobless claims near seven-year low,real
Fewest Firings Since 2007 Mark U.S. Job-Market Gains,real
Strange light on Mars.... Total eclipse next week....,real
Total Eclipse Of The Moon Next Week Throughout North America,real
Marquez grabs pole at Austin GP,real
Motorcycling: Marquez dominates MotoGP practice,real
MotoGP: Valentino Rossi ready for Austin title test,real
BMW extends recall to half-million cars,real
CRA: Site down for Heartbleed fix may soon return,real
"Sources: NSA Exploited Heartbleed Bug for Years, Exposing Consumers",real
US warns Facebook on privacy in WhatsApp mega deal,real
ISS computer outage could delay Monday's SpaceX rocket launch,real
Twitter Revamp: 10 Things To Know,real
Twitter introduces web notifications,real
Astral Beauty: Gravitational microlensing spots first Exomoon,real
Amazon's First Smartphone with 3D Display Pegged for June 2014 Release,real
"The week's biggest tech news in pictures: Galaxy S5, Twitter, Facebook",real
President and First Lady See A Raisin in the Sun,real
Johnny Depp Has Been Weirdly Subpoenaed To Prove A Woman Is Insane?!,real
"Women are funny, but not when crude, says Jerry Lewis",real
'Winter Soldier' intense,real
'Captain America' breaks boring streak,real
Why Batman vs. Superman vs. Captain America 3 Can Never Happen,real
Agents of S.H.I.E.L.D. Ratings Hit A Series Low With Captain America: The  ...,real
'Captain America 3' Confirmed: What Does This Mean for Warner Bros.?,real
"Researchers Believe the ""Gospel of Jesus' Wife"" to Be No More Fake Than Other  ...",real
MOVIE REVIEW: 'Draft Day' more than a football movie,real
'Divergent' film finale to be released in two parts,real
Summit Entertainment Announces Release Dates for Allegiant Part 1 & 2,real
Paul Stanley Claims Some KISS Bandmates Were Anti-Semitic,real
Watch Outkast's Coachella Performance,real
Outkast Reunited at Coachella,real
"OutKast Reunion To Celebrate 20th Anniversary Tour for Fans, Confirmed By  ...",real
Who is the real Stephen Colbert?,real
Andrew Garfield says he was bullied at school,real
Reports: There is No 'Amazing Spider-Man 2' Post-Credits Scene,real
Lawsuit: Lawrence Hospital failed to remove appendix of patient William  ...,real
H5N1 Bird Flu Could Be 5 Mutations Away From Spreading Like The Seasonal Flu,real
Govt 'may have wasted millions' on stockpiling Tamiflu,real
Hepatitis A Outbreak Linked to Charlotte Pizza Shop,real
Last minute tax tips for Connecticut taxpayers,real
Bank Earnings Reports: JPMorgan Chase Versus Wells Fargo,real
Osborne says critics proved 'wrong',real
ECB's Nowotny: Additional ECB Easing Steps 'Clearly Possible',real
Fruit Flies Evade Enemies like Fighter Jet,real
Astronauts spot first possible 'exomoon',real
UN global warming limits can be reached 'if CO2 emissions are cut by up to 70  ...,real
We're Probably Doomed On Climate Because Developed Countries Can't Stop  ...,real
Sony Warns Of Laptop Battery Issue,real
Marquez Returns To Scene Of First MotoGP Victory,real
Google Glass May Soon Be Sold to Normal People--But Just for One Day,real
"Android phones, tablets vulnerable to Heartbleed bug",real
NASA orders spacewalk to fix space station computer failure,real
"Comcast, TWC face uphill battle to push merger through",real
"Get your cameras ready, first in series of rare 'blood moon' eclipses begins April 15",real
Worldwide Wearable Computing Market Climbing to Nearly 112 Million in 2018  ...,real
"Another possible signal heard in Flight 370 search - WNCN: News, Weather",real
Coachella 2014: Camping gets underway without issues,real
"Zooey, Taylor, Franco Crash Seth Rogen's SNL Monologue",real
Jewish faithful celebrate Passover on Grand Strand,real
'Mad Men' premiere party: All you need are cocktails,real
'Mad Men' Is Celebrating Its Final Season With This Giant Glass Of Scotch In  ...,real
"Jerry Lewis says women are funny, but not when crude",real
Chris Martin spotted without wedding band for first time since split from Gwyneth  ...,real
There's a lot to be said for Gwyneth Paltrow's and Chris Martin's conciliatory  ...,real
Latest Rock and Roll Hall of Fame Inductees Perform at Barclays Center,real
Lorde Offers Nirvana Tribute at Rock and Roll Hall of Fame Induction (VIDEO),real
James Cameron Reveals 'Avatar' Sequel Script Plans During Reddit AMA,real
"The Science Of Lab-Grown Organs: Vaginas, Noses Now Possible",real
State-run oil firm blamed for water contamination in NW China,real
"As tax deadline approaches, chances of getting audited by IRS lowest in years",real
"Pulaski Skyway project to be completed in 10 phases, extend through 2020",real
IMF Warns on Low Inflation,real
Glencore Xstrata Sells Copper Mine to Chinese Consortium for $5.85 Bln,real
Tax deadline Tuesday: 6 last-minute reminders for checking returns,real
“IPCC report claims: No more excuses for funding coal and gas projects”,real
"'Modest hope' to slow warming, but no 'free lunch,' U.N. warns",real
"For Unproven Theory, Scientists Propose Unproven Solutions",real
2014 Austin MotoGP Results from Circuit of the Americas,real
Titanfall DLC Expedition coming with 3 exciting maps in May: Get ready for  ...,real
NASA to grow more veggies in space,real
"Total lunar eclipse, 'blood moon' to be showstoppers in sky",real
HTC Rumored to Release a Plastic HTC One M8 in May,real
"FTC Notifies Facebook, WhatsApp of Privacy Obligations",real
44% of those who joined Twitter never posted a single tweet: report,real
Obama reportedly lets NSA keep some security flaws secret,real
'Game of Thrones' fans celebrate The Purple Wedding (Spoilers),real
"'Game of Thrones': Another Day, Another Wedding (Video)",real
The 'Game Of Thrones' Wedding Dress We've All Been Dying To See,real
"Lady L.A. Rockers, Coming Soon Here, Kill It at Coachella",real
Pharrell Williams - Pharrell Williams' Falsetto Ruined By Coachella Sand,real
"Mad Men takes off for final season with ""Time Zones""",real
Presenting the Maddies: Five very real ad campaigns from the world of Mad Men,real
Hunger Games tops MTV Movie Awards,real
MTV Movie Awards: Times Square Is Toast in 'Amazing Spider-Man 2' Preview  ...,real
Conan O'Brien hosts MTV Movie Awards,real
"The Fault In Our Stars premieres beautiful new song from Birdy, 'Not About  ...",real
Blockbuster season has begun and it's looking great,real
"Conan O'Brien Calls Stephen Colbert the ""Right Person"" for Late Show",real
Stars align for arena tour of 'Jesus Christ Superstar',real
"PHOTO | Magpalaspas na, today is Palm Sunday",real
DiCaprio becomes victim of death hoax,real
Passover reflections on Promised Land,real
Mila Kunis shows off her 'baby bump' and all but confirms pregnancy at MTV  ...,real
Coachella 2014: Taking a ride on the festival's iconic Ferris wheel,real
"Gilead Sciences, Inc. (GILD) Receives FDA Priority Review Date for Ledipasvir +  ...",real
What will Coldwater closing mean to Sandpoint?,real
CBO: Obamacare Will Cover More People at a Lower Cost Than We Expected,real
"Exchange Rate Outlook: Pound Sterling To Dollar, Euro & New Zealand Dollar  ...",real
Daily Report: Dollar Extends Rebound as Retail Sales Beat Forecasts,real
Euro down in Asia on Draghi easing comments,real
Two senior GM executives depart,real
Tax Day freebies get goofier this year,real
US retail sales surge 1.1% in March as growth outlook brightens,real
Relativity makes 11th-hour play for Maker,real
Tax Freedom Day,real
Stocks Fight Back on Strong Retail Sales,real
"Wall Street climbs on retail sales, Citigroup earnings",real
Reports: Citigroup Trims Workforce By Another 200 To 300 Positions,real
Nikkei average loses further ground in Tokyo,real
Glencore to Buy Caracal for $1.35 Billion to Gain Chad Oil (3),real
TIAA-CREF to buy Nuveen Investments for $6.25 billion,real
IRS: Only one IRA rollover per year,real
Tonight SpaceX will live-test the reusable rocket that could change spaceflight,real
Google Glass sells to the public tomorrow. Here's how to decide whether or not  ...,real
Too Soon for Google Glass?,real
NASA creates prototype flying saucer for mission to Mars,real
Google buying NM drone manufacturer,real
UN: Act fast on global warming to save planet - and money,real
Mozilla Appoints Chris Beard As Interim CEO,real
"T-Mobile stops overage fees, starts petition pressuring other carriers to follow suit",real
Best viewing time for Tax Day's 'Blood Moon' over NH: 3:08 am Tuesday,real
'Blood Moon' is here: Rare lunar eclipse to be visible from Earth,real
BLOOD MOON: What's All The Fuss About? (And When You Can Watch It),real
Webcasts and Forecasts for Tonight's Total Lunar Eclipse,real
Rare lunar eclipse early tomorrow morning,real
Change passwords to avoid heartache from new bug,real
Hackers exploiting Heartbleed bug steal data from parenting website Mumsnet,real
NSA denies exploiting Heartbleed bug for surveillance,real
NSA must report security flaws — with some exceptions,real
Protecting Your Company's Reputation in a Heartbleed World,real
Online services back in business,real
Gas prices jump,real
Cherry tree blooms early after space trip,real
Here's the Crushing Poverty That Surrounds Coachella,real
Weekend Box Office: Tropical birds can't contend with winter,real
Captain America: The Winter Soldier Holds Off Rio 2 at the Weekend Box Office,real
Video: Leonardo DiCaprio dancing like your dad at Coachella,real
Henri Matisse and his Côte of many colours,real
"MTV Movie Awards catch up: 7 most memorable moments, from Zac Efron's abs  ...",real
10 moments you missed at the MTV Movie Awards,real
Zac Efron goes topless at MTV Movie Awards | BackStage,real
"The Hunger Games cleans up, Zac Efron goes shirtless and other winners at the  ...",real
MTV Movie Awards 2014: stars hit the red carpet in fashion-forward frocks,real
Taylor Swift Turned Up at a Superfan's Bridal Shower,real
"Billy Bob Thornton Says His Weird ""Fargo"" Haircut Was an Accident",real
Airline Reports Twitter Threat Copycat to Authorities,real
Teen arrested for tweeting terror threat to American Airlines,real
Alexa Ray Joel faints while performing on stage,real
Game of Thrones' George RR Martin: The Purple Wedding is payback for The  ...,real
George R.R. Martin and Jack Gleeson talk Game of Thrones shocking Season 4  ...,real
'Game Of Thrones' Season 4 Episode 2: 'The Lion and the Rose',real
7 Mad Men ladies Don must sleep with during seventh and final season,real
"TV Ratings: 'Mad Men' Takes a Hit in Return, Fetches 2.3 Million Viewers",real
Mad Men Season 7 Episode 1 Recap: California Dreaming,real
"The Irish family history of the new host of the ""Late Show""",real
Bryan Cranston Channels Walter White to Help Teen Land Prom Date,real
"US Airways investigating, apologizes for graphic image sent in response to  ...",real
Kim Kardashian to take personal trainer on honeymoon?,real
Kanye West - Kanye West To Wed Kim Kardashian In Us Ahead Of Paris  ...,real
What is the afikomen and why is it hidden?,real
Jewish Centers Shooting * Passover * Easter Prep: Monday's Roundup,real
How Miley Cyrus fulfilled her destiny as a superstar,real
"Review: Miley Cyrus delivers dizzying, non-stop party to Palace",real
Jail for dad who overdosed at Ohio McDonald's play area,real
Low blood sugar may incite marital conflict,real
Congressmen urge FDA to approve regulation of e-cigarettes,real
Successful trial testing pushes Lexicon stock up,real
Chinese Checkers with Gold Prices,real
Analysis: Health care law to cost less than expected,real
Stocks opening higher on Wall Street,real
Social Security drops debts older than 10 years,real
High Country Post Offices Open Regular Hours Tax Day,real
A Fair American Flat Tax,real
"On Tax Day, Americans' views of taxes and the IRS",real
Tax prep errors could be costly,real
"Tax extension is more time to file, not extra time to pay",real
Zebra Tech to buy Motorola's enterprise business for $3.5-billion,real
J&J earnings point to year-long high,real
Ukraine to Begin Importing Gas via Poland – Report,real
Breach could get worse: experts,real
Barclays replaces head of remuneration committee,real
NZ dollar holds gains ahead of Yellen appearances,real
India's consumer inflation rises to 8.31% in March 2014,real
Falling inflation takes the heat off consumers,real
Azerbaijan sees rise in consumer inflation,real
Coca-Cola shares jump as revenue beats estimates,real
Canada's tax agency and UK parenting site Mumsnet are the first confirmed  ...,real
T.rex roadtrip: Montana to Smithsonian,real
Game of Drones: Google beats Facebook to buy drone manufacturer Titan  ...,real
Google buys drone company for non evil reasons,real
Want to Use GMail? Agree to Get Mails Scanned,real
Twitter Has a Massive Plan to Conquer Your Data,real
Heartbleed threatens mobile users,real
How to Check If Your Android Device Could Be Hacked via Heartbleed,real
NSA details Heartbleed “mitigations” in new report,real
Spectacular total lunar eclipse turns moon red,real
Today in the News: Lunar eclipse 'blood moon' to appear overnight,real
Some Americans get front-row seat for lunar eclipse,real
PHOTOS: The blood moon in Michiana,real
Google Glass available for one-day for $1500; should we be interested?,real
Google Glass now available without invitation,real
Google Glass Is Available to Everyone Today: How to Buy It,real
"Business Insider writer is mugged for his Google Glass, squeezes 800 words out  ...",real
"As co-stars begin shooting ""Fast & Furious 7"" in UAE, Jordana Brewster admits  ...",real
Jordana Brewster on Fast & Furious 7: 'Paul Walker's absence is tough',real
Game of Thrones : Another memorable wedding day in Westeros as Joffrey and  ...,real
11 hilarious GIFs of viewers reacting to the 'Purple Wedding' on 'Game of Thrones',real
David Fincher Disconnects From Steve Jobs Biopic,real
Oprah Winfrey Makes Pharrell Cry,real
Pharrell Williams - Pharrell Williams cries on Oprah,real
Robert Pattinson Gets His Freak On WIth Julianne Moore in Maps to the Stars  ...,real
Brandy & Fiance Ryan Press Have Split Up,real
"Are AC/DC unplugging, or are we still on a highway to hell?",real
"Michael Strahan joins 'Good Morning America,' receives new alarm clock and  ...",real
'Dancing with the Stars' Recap: Shocking Elimination and Perfect Score on  ...,real
Why 'Fargo' For TV Works With Cold Efficiency And 'Bad Teacher' Doesn't,real
'Fargo' on FX is full of chipper humor,real
Brad Pitt Circling General McChrystal Film,real
Christina Grimmie – I Won't Give Up – The Voice Live Playoffs,real
"'Gone Girl' trailer: Director David Fincher, star Ben Affleck craft creepy thriller",real
Gone Girl Trailer & Poster – Did Ben Affleck kill his wife in David Fincher's movie?,real
Here's Your First Look at 'Gone Girl',real
Justin Bieber — and his fans — skip latest court hearing in Toronto as lawyers  ...,real
Aaron Carter & Drake Bell Want To Punch Justin Bieber?! See Their Mocking  ...,real
High Schooler Enlists Bryan Cranston To Ask a Girl To Prom,real
US AIRWAYS TWEET PICTURE RECEIVED VARIOUS REACTIONS ALL OVER  ...,real
"The crude joke's on you, US Airways",real
"DDP Talks Meeting Ultimate Warrior In WCW, WWE's ""Self Destruction DVD  ...",real
Ultimate Warrior's Life and Times in the WWE Celebrated in Raw Tribute Video,real
Sports Other Sports,real
Southwest Airlines flight attendant nails comedy routine before takeoff: Viral  ...,real
'Mad Men' premiere ratings drop significantly,real
"You are here! Home > Features Analyses > Forget moms, young dads face  ...",real
Guinea says few new Ebola cases,real
FDA OKs tablet to reduce grass allergies,real
Low Glucose Levels Could Mean More Aggression Between Spouses,real
New study shows a snack might help avoid fight with spouse,real
Repackaged Tobacco Control Bill and Matters Arising,real
Hepatitis C drugs too costly: Report,real
"Intel's Q1 earnings exceed estimates, says on track for tablet chip sales",real
Intel (INTC) Tops Q1 EPS by 1c,real
"US stocks rise on Coke, J&J earnings; Dow up 89",real
"Dow Fights Back Into the Green on Good Coke, J&J Numbers",real
Motorola to Vend Enterprise Business,real
Alibaba investment propels Yahoo's Q1 profit,real
Yahoo posts anaemic growth,real
Alibaba Profit Grows Ahead of Initial Public Offering,real
"Detroit makes deal with retired cops, firefighters to preserve current pensions",real
CHINESE ECONOMIC GROWTH SLOWS TO 18-MONTH LOW,real
China's Q1 GDP growth slows to 7.4pc,real
Numbers game,real
Burberry warns strong pound will hit profits,real
Tesco full year profits fall as environment changes 'more rapidly than ever before',real
SuperValu looks set to rival Tesco for top spot,real
Workers strike at Adidas supplier shoe factory,real
8 on Your Side: Businesses offer Tax Day deals,real
Buying A Home In Detroit Is Now Only A Mouse-Click Away,real
EPA Mull Methane Regs for Oil & Gas Sector,real
UK unemployment keeps falling amid recovery - KTVN Channel 2 - Reno Tahoe  ...,real
Coke's Soda Sales Down for First Time in 10 Years,real
Twitter buys data mining group,real
Vantage GT and DB9 Carbon Edition in New York show,real
Call My Kindle? Amazon To Release Smartphone by June,real
"Here's your rumored Amazon phone, 3D interface and all, now in allegedly  ...",real
The first 2015 Chevrolet Corvette Z06 Coupe sold for $1 million,real
Galaxy S5: sweeter on contract,real
Galaxy S5 fingerprint scanner hacked with ease,real
